id,name,price,rating,review_count,brand,seller,url,kw,group,page,brand_detail,seller_detail,categories,short_description
796085,Phụ Kiện Đàn Guitar Dây Đàn Guitar Vines GA-A30,55000,4.0,1,Vines,,https://tiki.vn/phu-kien-dan-guitar-day-dan-guitar-ga-a30-p796085.html?spid=1077510,phụ kiện đàn,Nhạc cụ,1,Vines,Sol.g,Dây đeo Guitar,Phụ Kiện Đàn Guitar Dây Đàn Guitar Vines GA-A30 đây là sản phẩm được làm bằng chất liệu nhựa PC cao cấp với thiết kế hướng đến tính khả dụng c...
814451,Dây Đàn Violin Phụ Kiện Đàn Violin Alice A703A,60000,4.5,6,Alice,,https://tiki.vn/day-dan-violin-phu-kien-dan-violin-alice-a703a-p814451.html?spid=839341,phụ kiện đàn,Nhạc cụ,1,Alice,Sol.g,Dây đàn,"Dây Đàn Violin Phụ Kiện Đàn Violin Alice A703A là sản phẩm được làm bằng chất liệu dây cao cấp và được xem là một bộ phận quan trọng trong chiếc đàn violin, ảnh hưởng rất lớn đến âm thanh tạo ra của ..."
53786093,"Elixir 12002, 12052 - Bộ Dây Đàn Guitar Điện - Chính Hãng (Electric Strings Phủ Lớp Nanoweb) - Kèm Móng Gảy DreamMaker",285000,5.0,3,Elixir,,https://tiki.vn/elixir-12002-12052-bo-day-dan-guitar-dien-chinh-hang-electric-strings-phu-lop-nanoweb-kem-mong-gay-dreammaker-p53786093.html?spid=53786097,phụ kiện đàn,Nhạc cụ,1,Elixir,Tiến Mạnh Music,Dây đàn,"Bộ Dây Đàn Guitar Electric Elixir được làm bằng dây thép bọc niken, phủ Nanoweb rất mỏng khiến người chơi thấy giống như đang chơi dây thông thường, tạo sự thoải mái khi sử dụng.Dây đàn dễ chơi ..."
3670115,Combo bao đàn guitar +Capo+Dây đàn+Pick gảy(SOL.G),227000,5.0,4,Alice,,https://tiki.vn/combo-bao-dan-guitar-capo-day-dan-pick-gay-sol-g-p3670115.html?spid=23022982,phụ kiện đàn,Nhạc cụ,1,Alice,Guitar MinMusic,Hộp đàn - Bao đàn,"Combo bao gồm bao đàn 3 lớp, capo, dây đàn & pick đủ trọn bộ phụ kiện cho đàn guitarBao đựng đàn guitar 3 lớp kiểu dáng thời trang kích cỡ full size, rất lý tưởng để đựng đàn guitar classic/Acous..."
799173,Bộ Dây Đàn Electric Guitar Strings Dây Guitar Điện cỡ 9 Phủ Lớp Optiweb Cao Cấp Elixir 19002,299000,5.0,2,Elixir,,https://tiki.vn/bo-day-dan-electric-guitar-strings-day-guitar-dien-co-9-phu-lop-optiweb-cao-cap-elixir-19002-p799173.html?spid=799175,phụ kiện đàn,Nhạc cụ,1,Elixir,Tiến Mạnh Music,Dây đàn,Bộ Dây Đàn Electric Guitar Strings Dây Guitar Điện cỡ 9 Phủ Lớp Optiweb Cao Cấp Elixir 19002 cao cấp được phủ lớp Optiweb giúp cảm giác tay rất tự nhiên k...
50360884, Combo Bộ Phụ kiện đàn Ukulele (Bao da 3 lớp + Capo + Phím gảy),149000,1.0,1,Woim,,https://tiki.vn/combo-bo-phu-kien-dan-ukulele-bao-da-3-lop-capo-phim-gay-p50360884.html?spid=50360905,phụ kiện đàn,Nhạc cụ,1,Woim,WOIM World of Instrumental Music,Phụ kiện đàn khác,"Combo 3 phụ kiện đàn Ukulele - hết sức tiện lợi cho người chơi đàn! Đàn ukulele có một đặc điểm thế mạnh là nhỏ gọn, dễ dàng mang theo, thuận tiện cho những người thích giao du, hay đi du lịch, hay p..."
50347358, Combo 10 phím (pick) gảy đàn guitar,27000,5.0,13,Woim,,https://tiki.vn/combo-10-phim-pick-gay-dan-guitar-p50347358.html?spid=50347359,phụ kiện đàn,Nhạc cụ,1,Woim,WOIM World of Instrumental Music,Miếng gảy - pick,Phím gảy đàn guitar có nhiều loại kích cỡ và đa dạng về độ mềm mỏng để phù hợp cho đàn đệm hay solo.Phím gãy đàn guitar có 2 loại thông dụng 0.46 và 0.71...
1260285,Bao Đàn Guitar 3 Lớp Yamaha BGS001Y - Đen,160000,4.7,9,Yamaha,,https://tiki.vn/bao-dan-guitar-3-lop-yamaha-bgs001y-den-p1260285.html?spid=1279527,phụ kiện đàn,Nhạc cụ,1,Yamaha,Sol.g,Hộp đàn - Bao đàn,"Bao Đàn Guitar 3 Lớp Yamaha BGS001Y được thiết kế với kiểu dáng thời trang, kích cỡ phù hợp với mọi loại đàn và rất lý tưởng để đựng đàn guitar Classic / Acoustic.Sản phẩm có bề mặt bên ngoài làm bằ..."
50410606,Combo Bộ phụ kiện đàn Ukulele (Bao da 3 lớp + Máy lên dây + Capo + Bộ dây dự phòng + Phím gảy),209000,3.5,2,Woim,,https://tiki.vn/combo-bo-phu-kien-dan-ukulele-bao-da-3-lop-may-len-day-capo-bo-day-du-phong-phim-gay-p50410606.html?spid=51854333,phụ kiện đàn,Nhạc cụ,1,Woim,WOIM World of Instrumental Music,Phụ kiện đàn khác,"Combo 5 phụ kiện đàn Ukulele - hết sức tiện lợi cho người chơi đàn!Đàn ukulele có một đặc điểm thế mạnh là nhỏ gọn, dễ dàng mang theo, thuận tiện cho những người thích giao du, hay đi du lịch, hay ph..."
1404097,Combo 6 Pick Gảy Đàn Guitar Alice AP100,17000,4.8,12,Alice,,https://tiki.vn/combo-6-pick-gay-dan-guitar-alice-ap100-p1404097.html?spid=23026501,phụ kiện đàn,Nhạc cụ,1,Alice,Guitar MinMusic,Miếng gảy - pick,"Combo 6 Pick Gảy Đàn Guitar Alice AP100 được làm bằng chất liệu nhựa cao cấp, bền bỉ với thiết kế màu sắc trẻ trung.Sản phẩm giúp cho người chơi có tốc độ đánh đàn nhanh và tạo ra âm thanh được to, ..."
196965542,"CASE ĐÀN HẠC LYRE HARP CEGA 19, 21 DÂY",579000,5.0,1,Woim,,https://tiki.vn/case-dan-hac-lyre-harp-cega-19-21-day-p196965542.html?spid=196965543,phụ kiện đàn,Nhạc cụ,2,Woim,WOIM World of Instrumental Music,Hộp đàn - Bao đàn,"CASE ĐÀN HẠC LYRE HARP CEGA 19, 21 DÂY ..."
9893340,Combo dây đàn guitar acoustic+Máy lên dây JA22+ Bảo vệ ngón,245000,5.0,1,Vines,,https://tiki.vn/combo-day-dan-guitar-acoustic-may-len-day-ja22-bao-ve-ngon-p9893340.html?spid=9893341,phụ kiện đàn,Nhạc cụ,2,Vines,Sol.g,Dây đàn,"Combo sản phẩm bao gồm: 1 bộ dây đàn guitar acoustic A406 (Gồm 6 dây) là bộ dây có tiếng hay, vang. Cỡ dây 111 máy lên dây đàn Grape GD-JA22 có thiết kế nhỏ gọn và thuận tiện khi mang theo bên mình-..."
53627487, Capo đàn Guitar Woim PK92 loại kẹp ngang tiện dụng ( Màu ngẫu nhiên ),59000,4.5,2,Woim,,https://tiki.vn/capo-dan-guitar-woim-pk92-loai-kep-ngang-tien-dung-mau-ngau-nhien-p53627487.html?spid=53627488,phụ kiện đàn,Nhạc cụ,2,Woim,WOIM World of Instrumental Music,Phụ kiện đàn khác,"Capo là một phụ kiện rất cần thiết cho những người chơi đàn Guitar. Sản phẩm thép chống gỉ, chất lượng cao cấp.Với chiếc capo, bạn có thể dễ dàng nâng tone cho cây đàn guitar.Màu sắc: đen, bạc, xan..."
68201944,Bộ 02 bộ dây đàn AW432,215000,0.0,0,Alice,,https://tiki.vn/bo-02-bo-day-dan-aw432-p68201944.html?spid=68201945,phụ kiện đàn,Nhạc cụ,2,Alice,Sol.g,Dây đeo Guitar,"       Giới thiệu sản phẩm Bộ 02 bộ dây đàn AW432. . . . Combo 02 bộ dây đàn AW Bộ gồm 6 dây đàn.- Alice là một trong những hãng sản xuất phụ kiện hàng đầu, với sự.kiểm tra về chất lượng nghiêm ng..."
200012565,Bao Túi Đựng Đàn Lyre Harp Gecko,200000,0.0,0,Woim,,https://tiki.vn/bao-tui-dung-dan-lyre-harp-gecko-p200012565.html?spid=200012566,phụ kiện đàn,Nhạc cụ,2,Woim,WOIM World of Instrumental Music,Hộp đàn - Bao đàn,"- Gọn nhẹ, giá rẻ.- Được may bằng vải dù với thiết kế gọn nhẹ, có quai đeo, quai xách.- Túi giúp bảo vệ tốt Đàn Lyre và tiện khi di chuyển, đi lại.- Sử dụng cho Đàn Lyre- Với chất liệu vải dù bạn cũng..."
275072447,"Chân, giá đỡ đàn guitar chắc chắn VInes",150000,3.8,4,Vines,,https://tiki.vn/chan-gia-do-dan-guitar-chac-chan-vines-p275072447.html?spid=275072448,phụ kiện đàn,Nhạc cụ,2,Vines,Sol.g,Phụ kiện đàn khác,"Chân đỡ Guitar PF-C10 dùng để kê đàn, trưng bày đàn, giúp bảo vệ cây đàn khỏi bị va đặp, và xước đàn. Bạn có thể gập lại khi không dùng đến, rất tiện lợi, phù hợp với nhà có diện tích nhỏ. Giá đỡ guit..."
271444306,Bao Vải Đàn Guitar Điện Giá Rẻ,79000,0.0,0,Woim,,https://tiki.vn/bao-vai-dan-guitar-dien-gia-re-p271444306.html?spid=271444307,phụ kiện đàn,Nhạc cụ,2,Woim,WOIM World of Instrumental Music,Hộp đàn - Bao đàn,"Mô tả sản phẩm:Bảo vệ cây đàn khỏi bụi, không chống bụi, chống sốc nhẹ, dễ dàng mang đi. Bao vải 3 lớp với cấu trúc vải dù cao cấp cho độ bền rất cao và cũng chống mưa.Lớp chống sock cực dầy với thiế..."
188632144,Bộ 6 Dây Cho Đàn Guitar Acoustic,90000,3.7,3,Woim,,https://tiki.vn/bo-6-day-cho-dan-guitar-acoustic-p188632144.html?spid=188632145,phụ kiện đàn,Nhạc cụ,2,Woim,WOIM World of Instrumental Music,Dây đàn,"Bộ dây đàn chuẩn nguyên seal 6 dâyDây đàn sài cực kỳ tốt và bền các bạn nhé!Âm thanh hay, sáng. Là dòng dây phosphor nên tiếng sẽ đẹp hơn các dây bình thường nhé!Ngoài ra, các dây được bọc đồng Phố..."
2621217,Bao đàn guitar điện 3 lớp BGA001F,161000,3.8,5,SOL.G,,https://tiki.vn/bao-dan-guitar-dien-3-lop-bga001f-p2621217.html?spid=2621219,phụ kiện đàn,Nhạc cụ,2,SOL.G,Sol.g,Hộp đàn - Bao đàn,"- Chất liệu da cao cấp- Độ bền cao- Hình thức đẹp- Giúp bảo về cây đàn khỏi va đập, ẩm mốc do thời tiết thay đổi Bao đựng đàn guitar 3 lớp kiểu dáng thời trang, rất lý tưởng để đựng đàn điện. Bên..."
7977361,Pick gảy đàn guitar REX(SOL.G),11000,3.0,1,Rex ,,https://tiki.vn/pick-gay-dan-guitar-rex-sol-g-p7977361.html?spid=7977362,phụ kiện đàn,Nhạc cụ,2,Rex ,Sol.g,Miếng gảy - pick,Pick gảy do hãng Rex sản xuất có chất lượng caoMàu sắc vàngHình thức đẹp ...
271444349,Bao Da Đàn Guitar Điện 3 Lớp Màu Đen,200000,0.0,0,Woim,,https://tiki.vn/bao-da-dan-guitar-dien-3-lop-mau-den-p271444349.html?spid=271444350,phụ kiện đàn,Nhạc cụ,3,Woim,WOIM World of Instrumental Music,Nhà Cửa - Đời Sống,"Bao đựng đàn guitar 3 lớp kiểu dáng thời trang kích cỡ full size, dày chắc chắn và rất lý tưởng để đựng đàn guitar classic/Acoustic.Thiết kế sang trọng, bên ngoài giả da mềm mịn, bên trong có lớp vải ..."
271444318,Bộ Dây Cho Đàn Guitar Điện Loại Tốt Bắt Pickup Rất Mạnh,90000,0.0,0,Woim,,https://tiki.vn/bo-day-cho-dan-guitar-dien-loai-tot-bat-pickup-rat-manh-p271444318.html?spid=271444319,phụ kiện đàn,Nhạc cụ,3,Woim,WOIM World of Instrumental Music,Nhà Cửa - Đời Sống,Dây Đàn Guitar Electric Woim chất Lượng Tốtcho tiếng đàn sáng to rõdây tốt bắt pickup rất mạnhĐảm Bảo Chất Lượng Tuyệt Vời...
71678064,Miếng dán chống xước cho đàn guitar chất lượng tốt SOL.G-Màu ngẫu nhiên,30000,0.0,0,Vines,,https://tiki.vn/mieng-dan-chong-xuoc-cho-dan-guitar-chat-luong-tot-sol-g-mau-ngau-nhien-p71678064.html?spid=71678065,phụ kiện đàn,Nhạc cụ,3,Vines,Sol.g,Nhà Cửa - Đời Sống,"- Thiết kế cá tính, bắt mắt, tạo vẻ đẹp cho cây đàn của bạn- Đây là phụ kiện không thể thiếu cho cây đàn của bạn- Miếng dán giúp chống xước khi bạn đàn, quạt chả- Dễ dàng sử dụng ..."
263450561,Bộ dây đàn guitar acoustic 6 dây màu Duy Guitar,48900,3.0,2,Duy Guitar,,https://tiki.vn/bo-day-dan-guitar-acoustic-6-day-mau-duy-guitar-p263450561.html?spid=263450563,phụ kiện đàn,Nhạc cụ,3,Duy Guitar,Duy Guitar,Dây đàn,"Bộ 6 dây đàn guitar màuDành cho đàn guitar acousticSize 10Màu đỏ hồng - xanh dương - gold - xanh lá - bạcTặng kèm pick gảiBộ dây có màu đẹp dành cho các bạn yêu thích màu sắc, âm thanh vang ấm á..."
196949746,BAO ĐÀN HẠC LYRE HARP CEGA 16 DÂY,289000,0.0,0,Woim,,https://tiki.vn/bao-dan-hac-lyre-harp-cega-16-day-p196949746.html?spid=196949747,phụ kiện đàn,Nhạc cụ,3,Woim,WOIM World of Instrumental Music,Product Line Root,Bao đàn dành cho đàn Lyre Harp 16 dây...
201358732,Phím gảy Alice dành cho đàn guitar/ukulele,2000,3.0,2,Woim,,https://tiki.vn/phim-gay-alice-danh-cho-dan-guitar-ukulele-p201358732.html?spid=201358733,phụ kiện đàn,Nhạc cụ,3,Woim,WOIM World of Instrumental Music,Miếng gảy - pick,Sản phẩm bao gồm 01 pick gảy.Chất liệu nhựa với thiết kế nhiều màu sắc năng động.Phím gảy đàn guitar có nhiều loại kích cỡ và đa dạng về độ mềm mỏng để phù hợp cho đàn đệm hay solo.Phím gảy đàn gui...
203422807,"Bộ Dây Thay Cho Đàn Lyre Harpika 7, 10, 16, 19, 21, 24, 27, 32 Dây",99000,0.0,0,Woim,,https://tiki.vn/bo-day-thay-cho-dan-lyre-16-19-21-day-p203422807.html?spid=248697723,phụ kiện đàn,Nhạc cụ,3,Woim,WOIM World of Instrumental Music,Dây đàn,"Dây dự phòng dây thay thế cho đàn lyre harp loại 16 dây, 19 dây, 21 dây có đánh số dây.Bộ dây đàn Lyre đàn hạc cầm tay bộ đủ 16 dây hoặc 19 dây.Mình chỉ bán trọn bộ không bán lẻ...."
202963310,Bao Đàn Hạc Lyre Harp Cega 19 Dây,279000,0.0,0,Woim,,https://tiki.vn/bao-dan-hac-lyre-harp-cega-19-day-p202963310.html?spid=202963311,phụ kiện đàn,Nhạc cụ,3,Woim,WOIM World of Instrumental Music,Hộp đàn - Bao đàn,"Bao Đàn Hạc Lyre Harp Cega 19 Dây- Gọn nhẹ, giá rẻ.- Được may bằng vải dù với thiết kế gọn nhẹ, có quai đeo, quai xách.- Túi giúp bảo vệ tốt Đàn Lyre và tiện khi di chuyển, đi lại.- Sử dụng cho Đàn L..."
278345159,"Pick Đàn Guitar Giả Gỗ – Bền Đẹp, Cá Tính",35000,0.0,0,OEM,,https://tiki.vn/pick-dan-guitar-gia-go-ben-dep-ca-tinh-p278345159.html?spid=278345160,phụ kiện đàn,Nhạc cụ,3,OEM,Guitar MinMusic,Phụ kiện đàn khác," Phím Gảy Đàn Guitar Vân Gỗ – Bền Đẹp, Phong Cách Cá Tính Mô tả sản phẩm:Phím gảy đàn guitar vân gỗ mang đến trải nghiệm chơi nhạc mượt mà, êm tay và chuẩn âm. Thiết kế vân gỗ tự nhiên giúp sản phẩm..."
2410845,Combo Bộ phụ kiện đàn Ukulele (Capo + Bộ dây dự phòng + Phím gảy) ,134000,0.0,0,Việt Hoàng Phong,,https://tiki.vn/combo-bo-phu-kien-dan-ukulele-capo-bo-day-du-phong-phim-gay-p2410845.html?spid=4794031,phụ kiện đàn,Nhạc cụ,3,Việt Hoàng Phong,Piano Lovers,Nhà Cửa - Đời Sống,"Một combo phụ kiện đàn - hết sức tiện lợi cho người chơi đàn!  Đàn ukulele có một đặc điểm thế mạnh là nhỏ gọn, dễ dàng mang theo, thuận tiện cho những người thích giao du, hay đi du lịch, hay phải ..."
796009,Phụ Kiện Đàn Guitar Capo Vines PBA106 - Đen,80000,5.0,3,Vines,,https://tiki.vn/phu-kien-dan-guitar-capo-vines-pba106-den-p796009.html?spid=1077496,phụ kiện đàn,Nhạc cụ,4,Vines,Sol.g,Nhà Cửa - Đời Sống,"Phụ Kiện Đàn Guitar Capo Vines PBA106 đây là sản phẩm được làm bằng chất liệu hợp kim cao cấp với thiết kế hướng đến tính khả dụng cao, đó là dễ s..."
2909275,Combo Bộ Phụ kiện đàn Ukulele (Bao da 3 lớp + Capo + Phím gảy) ,164000,0.0,0,Việt Hoàng Phong,,https://tiki.vn/combo-bo-phu-kien-dan-ukulele-bao-da-3-lop-capo-phim-gay-p2909275.html?spid=4794185,phụ kiện đàn,Nhạc cụ,4,Việt Hoàng Phong,Piano Lovers,Nhà Cửa - Đời Sống,"Combo 3 phụ kiện đàn Ukulele - hết sức tiện lợi cho người chơi đàn! Đàn ukulele có một đặc điểm thế mạnh là nhỏ gọn, dễ dàng mang theo, thuận tiện cho những người thích giao du, hay đi du lịch, hay p..."
23083236,Bộ phụ kiện đàn guitar acoustic bao da 3 lớp - Capo - 3 phím - Dây alice AW432,255000,4.7,15,Duy Guitar,,https://tiki.vn/bo-phu-kien-dan-guitar-acoustic-bao-da-3-lop-capo-3-phim-day-alice-aw432-p23083236.html?spid=23083237,phụ kiện đàn,Nhạc cụ,4,Duy Guitar,Duy Guitar,Đàn guitar acoustic,"Bộ phụ kiện gồm các sản phẩm như trong hình mô tả sản phẩmBao da 3 lớp chắc chắn, màu đenCapo màu dùng để tăng tone, giảm các hợp âm chặn ở thế tay cao3 phím Gibson màu ngẫu nhiên1 Bộ dây Alice AW..."
2406587,Combo Bộ phụ kiện đàn Ukulele (Bao da 3 lớp + Máy lên dây + Capo + Bộ dây dự phòng + Phím gảy),370000,0.0,0,Việt Hoàng Phong,,https://tiki.vn/combo-bo-phu-kien-dan-ukulele-bao-da-3-lop-may-len-day-capo-bo-day-du-phong-phim-gay-p2406587.html?spid=2584715,phụ kiện đàn,Nhạc cụ,4,Việt Hoàng Phong,Piano Lovers,Nhà Cửa - Đời Sống,"Combo 5 phụ kiện đàn Ukulele - hết sức tiện lợi cho người chơi đàn! Đàn ukulele có một đặc điểm thế mạnh là nhỏ gọn, dễ dàng mang theo, thuận tiện cho những người thích giao du, hay đi du lịch, hay p..."
275724242,[FLASH SALE] Capo kẹp đàn guitar(trắng) - phụ kiện guitar - nhạc cụ - 206437,38660,0.0,0,TLG Thành Long,,https://tiki.vn/flash-sale-capo-kep-dan-guitar-trang-phu-kien-guitar-nhac-cu-206437-p275724242.html?spid=275724244,phụ kiện đàn,Nhạc cụ,4,TLG Thành Long,ĐỒ DA THÀNH LONG TLG,Phụ kiện nhạc cụ khác,Mô tả sản phẩm [FLASH SALE] Capo kẹp đàn guitar(trắng) - phụ kiện guitar - nhạc cụ - 206437 - White Chất liệu cao cấp- Độ bền cao- Hình thức đẹp- Capo với thiết kế hướng đến tính khả dụng cao...
278128304,"Khăn phủ đàn tranh cổ, khăn phủ đàn guzheng, phụ kiện đàn tranh guzheng - HÀNG CHÍNH HÃNG",190000,0.0,0,SUZIN,,https://tiki.vn/khan-phu-dan-tranh-co-khan-phu-dan-guzheng-phu-kien-dan-tranh-guzheng-hang-chinh-hang-p278128304.html?spid=278128314,phụ kiện đàn,Nhạc cụ,4,SUZIN,Hoàng Hải Store,Nhạc cụ dân tộc khác,"Khăn phủ thiết kế riêng cho đàn tranh và đàn guzheng của Trung Quốc Chất liệu lụa, nhung, gấm thêu họa tiết sang trọng cho bạn lựa chọnChất vải dày dặn, không nhănMàu sắc trang nhã, sang t..."
143226572,Set 6 Tròn Phụ Kiện Kim Loại,19000,0.0,0,Kềm Nhật,,https://tiki.vn/set-6-tron-phu-kien-kim-loai-p143226572.html?spid=143226600,phụ kiện đàn,Nhạc cụ,4,Kềm Nhật,Kềm Nhật,"Bộ dụng cụ, phụ kiện làm móng","       SET PHỤ KIỆN TRANG TRÍ MÓNG   1. Phụ kiện trang trí móng nghệ thuật này được làm bằng chất liệu hợp kim cao cấp, bền, hình dạng đẹp mắt với bề mặt cắt đẹp, thích hợp cho làm móng nghệ ..."
205610296,Đàn kèn melodica 32 và 37 phím kèm phụ kiện và túi đựng tiện dụng,219000,5.0,11,DORON,,https://tiki.vn/dan-ken-melodica-32-va-37-phim-kem-phu-kien-va-tui-dung-tien-dung-p205610296.html?spid=142242694,phụ kiện đàn,Nhạc cụ,4,DORON,AnKhangShop,Đàn tranh,"Bộ đàn kèn melodica 32 phím kèm phụ kiện và túi đựng tiện dụng          Với sự trợ giúp của nhạc cụ melodica cơ bản, người mới bắt đầu học nhạc có thể dễ dàng hiểu và nhanh chóng nắm vữ..."
56409606,Đàn Kalimba Có Hướng Dẫn Tiếng Việt 17 Phím Đủ Phụ Kiện Thumb Piano BWS,464000,0.0,0,Legaxi,,https://tiki.vn/dan-kalimba-co-huong-dan-tieng-viet-17-phim-du-phu-kien-thumb-piano-bws-p56409606.html?spid=56409608,phụ kiện đàn,Nhạc cụ,4,Legaxi,Legaxi Official,Đàn Kalimba,Giới thiệu về đàn Kalimba:Đàn Kalimba còn được gọi là Thumb Piano. Đàn được thiết kế các phím bằng kim loại gắn trên 1 hộp gỗ (đóng vai trò như hộp cộng hưởng). Bạn có thể chơi các bài nhạc rất dễ d...
7189881,Đàn Guitar Acoustic DT70 màu gỗ tự nhiên laminate cần đàn có ty dành cho bạn mới tập Duy Guitar tặng 4 phụ kiện,1288000,5.0,20,Duy Guitar,,https://tiki.vn/dan-guitar-acoustic-dt70-p7189881.html?spid=7189883,phụ kiện đàn,Nhạc cụ,4,Duy Guitar,Duy Guitar,Đàn guitar acoustic,"Đàn guitar acoustic DT70 Dành cho người mới tập chơi guitarMã: DT70Mặt: gỗ thôngEo + lưng: ván ép chất lượng caoCần: gỗ thao lao, có ty chống cong cầnMặt phím: gõ mậtNgựa: gõ mậtDây: alice A206..."
49127906,"Bao Da Đựng Đàn Guitar 3 Lớp Yamaha Bag YAB (Túi đựng Acoustic và Classic Ghi-ta, Có 2 quai đeo, Ngăn đựng đồ ) - Bao Acoustic Guitar",149000,4.6,74,Yamaha,,https://tiki.vn/bao-da-dung-dan-guitar-3-lop-yamaha-bag-yab-tui-dung-acoustic-va-classic-ghi-ta-co-2-quai-deo-ngan-dung-do-kem-mong-gay-dreammaker-p49127906.html?spid=49127908,phụ kiện đàn,Nhạc cụ,5,Yamaha,Tiến Mạnh Music,Hộp đàn - Bao đàn," -Số lớp: 3- Số ngăn: 3- Chất liệu: Bao da- Màu sắc: Đen- Dây đeo: 2 dây, chiều dài tùy biến- Chiều dài x Chiều rộng x Chiều sâu: 112cm x 44cm x 15cm- Có Túi ngăn kéo bên ngoài tiện lợi- Bao..."
3671349,Combo bao đàn guitar 3 lớp+ Capo+ Pick gảy(SOL.G),157000,4.6,37,Alice,,https://tiki.vn/combo-bao-dan-guitar-3-lop-capo-pick-gay-sol-g-p3671349.html?spid=32079792,phụ kiện đàn,Nhạc cụ,5,Alice,Guitar MinMusic,Hộp đàn - Bao đàn,"- Capo với thiết kế hướng đến tính khả dụng cao (dễ sử dụng), “hệ thống kẹp” được đệm cao su nguyên chất “mút” dây rất chặt, trong khi hệ thống lò xo vô cùng mạnh mẽ giúp cho capo được kẹp vững chắc t..."
53444906,Elixir 12002 - Bộ Dây Đàn Guitar Điện Cỡ 9 (9-42) - Chính Hãng (Electric Strings Phủ Lớp Nanoweb) - Kèm Móng Gảy DreamMaker,285000,5.0,6,Elixir,,https://tiki.vn/elixir-12002-bo-day-dan-guitar-dien-co-9-9-42-chinh-hang-electric-strings-phu-lop-nanoweb-kem-mong-gay-dreammaker-p53444906.html?spid=53444907,phụ kiện đàn,Nhạc cụ,5,Elixir,Tiến Mạnh Music,Nhà Cửa - Đời Sống," Bộ Dây Đàn Guitar Electric Elixir 12002 được làm bằng dây thép bọc niken, phủ Nanoweb rất mỏng khiến người chơi thấy giống như đang chơi dây thông thường, tạo sự thoải mái khi sử dụng.Dây đàn d..."
984012,Bộ Dây Đàn Guitar Electric Elixir 12002,285000,4.5,2,Elixir,,https://tiki.vn/bo-day-dan-guitar-electric-elixir-12002-p984012.html?spid=984336,phụ kiện đàn,Nhạc cụ,5,Elixir,Tiến Mạnh Music,Dây đàn,"   Bộ Dây Đàn Guitar Electric Elixir 12002  được làm bằng dây thép bọc niken, phủ Nanoweb rất mỏng khiến người chơi thấy giống như đang chơi dây thông thường, tạo sự thoải mái khi sử dụng.  Dây đàn dễ..."
53497182,Elixir 19002 - Bộ Dây Đàn Guitar Điện Cỡ 9 (9-42) - Chính Hãng (Electric Strings Phủ Lớp Optiweb) - Kèm Móng Gảy DreamMaker,299000,4.8,12,Elixir,,https://tiki.vn/elixir-19002-bo-day-dan-guitar-dien-co-9-9-42-chinh-hang-electric-strings-phu-lop-optiweb-kem-mong-gay-dreammaker-p53497182.html?spid=53497183,phụ kiện đàn,Nhạc cụ,5,Elixir,Tiến Mạnh Music,Dây đàn,"Bộ Dây Đàn Electric Guitar Strings Dây Guitar Điện cỡ 9 Phủ Lớp Optiweb Cao Cấp Elixir 19002 cao cấp được phủ lớp Optiweb giúp cảm giác tay rất tự nhiên khi chơi, âm thanh vang và sắc nét.Thích hợ..."
53456120,Elixir 19052 - Bộ Dây Đàn Guitar Điện Cỡ 10 (10-46) - Chính Hãng (Electric Strings Phủ Lớp Optiweb) - Kèm Móng Gảy DreamMaker,299000,5.0,3,Elixir,,https://tiki.vn/elixir-19052-bo-day-dan-guitar-dien-co-10-10-46-chinh-hang-electric-strings-phu-lop-optiweb-kem-mong-gay-dreammaker-p53456120.html?spid=53644005,phụ kiện đàn,Nhạc cụ,5,Elixir,Tiến Mạnh Music,Dây đàn,"Bộ Dây Đàn Electric Guitar Strings Dây Guitar Điện cỡ 10 Phủ Lớp Optiweb Cao Cấp Elixir 19052 cao cấp được phủ lớp Optiweb giúp cảm giác tay rất tự nhiên khi chơi, âm thanh vang và sắc nét.Thích ..."
263772857,"[Chính Hãng] Dây Đàn Guitar Điện Ernie Ball 2220, 2221, 2222, 2223, 2224 - Cỡ 9, 9.5, 10,11 Electric Strings Hàng Chính Hãng  - Kèm Móng Gảy DreamMaker",175000,4.0,2,Ernie Ball ,,https://tiki.vn/chinh-hang-day-dan-guitar-dien-ernie-ball-2220-2221-2222-2223-2224-co-9-9-5-10-11-electric-strings-hang-chinh-hang-kem-mong-gay-dreammaker-p263772857.html?spid=263772865,phụ kiện đàn,Nhạc cụ,5,Ernie Ball ,Tiến Mạnh Music,Dây đàn,THÔNG SỐ KỸ THUẬT*Dây Đàn Guitar Điện Ernie Ball 2220 (11-48)- Chất liệu: Niken- Cỡ dây: (11-48)- Là dòng bán chạy nhất của hãng Ernie Ball giúp cảm giác tay rất mịn khi chơi- Có độ bền cao- Là mẫ...
126596539,Pick-Phím gảy đàn guitar Dunlop 417P-Hàng nhập Mỹ,25000,5.0,2,Dunlop,,https://tiki.vn/pick-phim-gay-dan-guitar-dunlop-417p-hang-nhap-my-p126596539.html?spid=126596541,phụ kiện đàn,Nhạc cụ,5,Dunlop,Sol.g,Miếng gảy - pick,417P là mẫu pick gảy có chất lượng caoCác cạnh rất linh hoạt & dễ sử dụngBề mặt mờ  tạo cho người chơi một cách cuồng nhiệt & rõ nét nhấtĐây là mẫu pick mà khi bạn chơi thấy thật thoải mái...
