id,name,price,rating,review_count,brand,seller,url,kw,group,page,brand_detail,seller_detail,categories,short_description
275724242,[FLASH SALE] Capo kẹp đàn guitar(trắng) - phụ kiện guitar - nhạc cụ - 206437,38660,0.0,0,TLG Thành Long,,https://tiki.vn/flash-sale-capo-kep-dan-guitar-trang-phu-kien-guitar-nhac-cu-206437-p275724242.html?spid=275724244,phụ kiện nhạc cụ,Nhạc cụ,1,TLG Thành Long,ĐỒ DA THÀNH LONG TLG,Phụ kiện nhạc cụ khác,Mô tả sản phẩm [FLASH SALE] Capo kẹp đàn guitar(trắng) - phụ kiện guitar - nhạc cụ - 206437 - White Chất liệu cao cấp- Độ bền cao- Hình thức đẹp- Capo với thiết kế hướng đến tính khả dụng cao...
5812515,Giá để sách nhạc đàn Guitar,97000,4.7,6,OEM,,https://tiki.vn/gia-de-sach-nhac-dan-guitar-p5812515.html?spid=72496976,phụ kiện nhạc cụ,Nhạc cụ,1,OEM,Guitar MinMusic,Nhà Cửa - Đời Sống,Chất liệu cao cấpĐộ bền caoThiết kế đẹp mắtDễ dàng sử dụngCần thiết cho người chơi guitar...
2822805,"Ghế đàn organ, piano",370000,4.6,39,Vines,,https://tiki.vn/ghe-dan-organ-piano-p2822805.html?spid=2822807,phụ kiện nhạc cụ,Nhạc cụ,1,Vines,Sol.g,Nhà Cửa - Đời Sống,"PF-F10 là loại ghế đàn dành cho organ hoặc pianoHình thức đẹpDễ dàng sử dụng, có thể gấp lại khi không dùng nữa ..."
143226572,Set 6 Tròn Phụ Kiện Kim Loại,19000,0.0,0,Kềm Nhật,,https://tiki.vn/set-6-tron-phu-kien-kim-loai-p143226572.html?spid=143226600,phụ kiện nhạc cụ,Nhạc cụ,1,Kềm Nhật,Kềm Nhật,"Bộ dụng cụ, phụ kiện làm móng","       SET PHỤ KIỆN TRANG TRÍ MÓNG   1. Phụ kiện trang trí móng nghệ thuật này được làm bằng chất liệu hợp kim cao cấp, bền, hình dạng đẹp mắt với bề mặt cắt đẹp, thích hợp cho làm móng nghệ ..."
191644228,Phụ kiện chụp hình - đồ chơi bắn giấy - phụ kiện cưới Giang,155000,0.0,0,OEM,,https://tiki.vn/phu-kien-chup-hinh-do-choi-ban-giay-phu-kien-cuoi-giang-p191644228.html?spid=191644229,phụ kiện nhạc cụ,Nhạc cụ,1,OEM,Phụ kiện cưới Giang,Root,     ...
277212590,Sách - Thiên Nhạc - NXB Phụ Nữ,75000,0.0,0,,,https://tiki.vn/sach-thien-nhac-nxb-phu-nu-p277212590.html?spid=277212591,phụ kiện nhạc cụ,Nhạc cụ,1,,Bamboo Books,Sách Kiến Thức Tổng Hợp,"    Thiên Nhạc  Truyền thuyết kể rằng, có những nữ linh được tạo thành từ mây, nước, ánh sáng, hương thơm, dùng âm nhạc để chiêu hồn tử sĩ trên các chiến trường.  Nguyên soái lần đầu nhìn thấy cô..."
273867239,"Thảm đàn âm nhạc cho bé chơi nhảy 8 nhạc cụ: đàn Piano, Guitar, Violin, kèn Saxophone, sáo Flute, Accordi",249000,0.0,0,MySun,,https://tiki.vn/tham-nhay-choi-nhac-cho-be-van-dong-gia-am-thanh-8-nhac-cu-dan-piano-guitar-violin-ken-saxophone-sao-flute-accordion-clarinet-tang-pin-aa-mysun-p273867239.html?spid=273877101,phụ kiện nhạc cụ,Nhạc cụ,1,MySun,MySun Vietnam,Nhạc cụ đàn Piano,"Âm nhạc không đơn thuần chỉ là một hình thức nghệ thuật sử dụng âm thanh để tạo ra trải nghiệm cảm xúc. Mà nó như một chiếc chìa khóa vạn năng giúp con người mở ra nhiều điều mới mẻ, đặc biệt. Đặc biệ..."
278538560,Đàn Kalimba 17 Phím - Nhạc Cụ Gỗ Dùng Ngón Tay Chơi Nhạc,600000,0.0,0,OEM,,https://tiki.vn/dan-kalimba-17-phim-nhac-cu-go-dung-ngon-tay-choi-nhac-p278538560.html?spid=278538570,phụ kiện nhạc cụ,Nhạc cụ,1,OEM,Guitar MinMusic,Các loại đàn khác,"Kalimba sản phẩm full phụ kiệnNhạc Cụ Min MusicC----- SHOP ĐẢM BẢO ------ Hình ảnh sản phẩm giống hình 100% Chất lượng sản phẩm đúng như mô tả Sản phẩm được kiểm tra kĩ càng, nghiêm ngặt trước khi gia..."
47078463,"Bộ Microphone không dây Wireless dùng cho Đàn Violin, Guitar, Kèn, Sáo, Nhị, Saxophone, Mic Nhạc cụ Dân Tộc và Mọi loại Nhạc Cụ khác Dr.MIC W8-8+B10 - Kèm Móng Gảy DreamMaker",1499000,0.0,0,Dr.MIC,,https://tiki.vn/bo-microphone-khong-day-dung-cho-dan-violin-guitar-nhi-va-moi-loai-nhac-cu-khac-dr-mic-w8-8-b10-kem-mong-gay-dreammaker-p47078463.html?spid=47078464,phụ kiện nhạc cụ,Nhạc cụ,1,Dr.MIC,Tiến Mạnh Music,Kèn Saxophone,"Thông số kỹ thuật: Bộ thu: Dải tần số sóng mang: UHF600 ~ 700MHZ (đã chọn)Kênh: Một kênhĐộ nhạy: Khi đầu vào 6dBv, S / N> 60D6Độ rộng băng tần: 30MHZPhạm vi độ lệch tối đa: + 45KHZTỷ lệ S / ..."
2410845,Combo Bộ phụ kiện đàn Ukulele (Capo + Bộ dây dự phòng + Phím gảy) ,134000,0.0,0,Việt Hoàng Phong,,https://tiki.vn/combo-bo-phu-kien-dan-ukulele-capo-bo-day-du-phong-phim-gay-p2410845.html?spid=4794031,phụ kiện nhạc cụ,Nhạc cụ,1,Việt Hoàng Phong,Piano Lovers,Nhà Cửa - Đời Sống,"Một combo phụ kiện đàn - hết sức tiện lợi cho người chơi đàn!  Đàn ukulele có một đặc điểm thế mạnh là nhỏ gọn, dễ dàng mang theo, thuận tiện cho những người thích giao du, hay đi du lịch, hay phải ..."
2909275,Combo Bộ Phụ kiện đàn Ukulele (Bao da 3 lớp + Capo + Phím gảy) ,164000,0.0,0,Việt Hoàng Phong,,https://tiki.vn/combo-bo-phu-kien-dan-ukulele-bao-da-3-lop-capo-phim-gay-p2909275.html?spid=4794185,phụ kiện nhạc cụ,Nhạc cụ,2,Việt Hoàng Phong,Piano Lovers,Nhà Cửa - Đời Sống,"Combo 3 phụ kiện đàn Ukulele - hết sức tiện lợi cho người chơi đàn! Đàn ukulele có một đặc điểm thế mạnh là nhỏ gọn, dễ dàng mang theo, thuận tiện cho những người thích giao du, hay đi du lịch, hay p..."
814451,Dây Đàn Violin Phụ Kiện Đàn Violin Alice A703A,60000,4.5,6,Alice,,https://tiki.vn/day-dan-violin-phu-kien-dan-violin-alice-a703a-p814451.html?spid=839341,phụ kiện nhạc cụ,Nhạc cụ,2,Alice,Sol.g,Dây đàn,"Dây Đàn Violin Phụ Kiện Đàn Violin Alice A703A là sản phẩm được làm bằng chất liệu dây cao cấp và được xem là một bộ phận quan trọng trong chiếc đàn violin, ảnh hưởng rất lớn đến âm thanh tạo ra của ..."
191645142,Phụ kiện cưới chụp hình kính gắn hoa phụ kiện cô dâu,280000,0.0,0,OEM,,https://tiki.vn/phu-kien-cuoi-chup-hinh-kinh-gan-hoa-phu-kien-co-dau-p191645142.html?spid=191645143,phụ kiện nhạc cụ,Nhạc cụ,2,OEM,Phụ kiện cưới Giang,Root,     ...
278503735,Đàn Kalimba 17 Phím – Nhạc Cụ Thumbs Piano Chơi Bằng Ngón Tay | Phù Hợp Mọi Lứa Tuổi,285000,0.0,0,OEM,,https://tiki.vn/dan-kalimba-17-phim-nhac-cu-thumbs-piano-choi-bang-ngon-tay-phu-hop-moi-lua-tuoi-p278503735.html?spid=278503739,phụ kiện nhạc cụ,Nhạc cụ,2,OEM,Guitar MinMusic,Các loại đàn khác,"Kalimba sản phẩm full phụ kiệnNhạc Cụ Min MusicC----- SHOP ĐẢM BẢO ------ Hình ảnh sản phẩm giống hình 100% Chất lượng sản phẩm đúng như mô tả Sản phẩm được kiểm tra kĩ càng, nghiêm ngặt trước khi gia..."
276326694,Đàn Piano Organ mini đồ chơi nhạc cụ đánh đàn cho bé có nhạc tặng kèm PIN,119000,0.0,0,MySun,,https://tiki.vn/dan-piano-organ-mini-do-choi-nhac-cu-danh-dan-cho-be-co-nhac-tang-kem-pin-p276326694.html?spid=276344227,phụ kiện nhạc cụ,Nhạc cụ,2,MySun,MySun Vietnam,Nhạc cụ đàn Piano,"Cho con phát triển tư duy và kỹ năng bằng việc tiếp tục với âm nhạc là phương pháp được nhiều ba mẹ áp dụng. Học đánh đàn là một trong những bộ môn được nhiều ba mẹ đầu tư cho con yêu. Tuy nhiên, chi ..."
47100643,"Bộ Microphone có dây dùng cho Đàn Violin, Guitar, Kèn, Sáo, Nhị, Saxophone, Mic Nhạc cụ Dân Tộc và Mọi loại Nhạc Cụ khác Dr.MIC DR-813 - Kèm Móng Gảy DreamMaker",699000,0.0,0,Dr.MIC,,https://tiki.vn/bo-microphone-co-day-dr-mic-dung-cho-dan-violin-guitar-nhi-va-moi-loai-nhac-cu-khac-dr-mic-dr-813-kem-mong-gay-dreammaker-p47100643.html?spid=47100644,phụ kiện nhạc cụ,Nhạc cụ,2,Dr.MIC,Tiến Mạnh Music,Kèn Saxophone,"- Thông số kỹ thuật:Dải tần số sóng mang: UHF600 ~ 700MHZ (đã chọn)Kênh: Một kênhĐộ nhạy: Khi đầu vào 6dBv, S / N> 60D6Độ rộng băng tần: 30MHZPhạm vi độ lệch tối đa: + 45KHZTỷ lệ S / N:> 105 dB..."
50360884, Combo Bộ Phụ kiện đàn Ukulele (Bao da 3 lớp + Capo + Phím gảy),149000,1.0,1,Woim,,https://tiki.vn/combo-bo-phu-kien-dan-ukulele-bao-da-3-lop-capo-phim-gay-p50360884.html?spid=50360905,phụ kiện nhạc cụ,Nhạc cụ,2,Woim,WOIM World of Instrumental Music,Phụ kiện đàn khác,"Combo 3 phụ kiện đàn Ukulele - hết sức tiện lợi cho người chơi đàn! Đàn ukulele có một đặc điểm thế mạnh là nhỏ gọn, dễ dàng mang theo, thuận tiện cho những người thích giao du, hay đi du lịch, hay p..."
72339752,Chân Đế Micro Lùn Cho Nhạc Cụ Biểu Diễn Transhine DT-01 - Hàng chính hãng,275000,4.3,9,TRANSHINE,,https://tiki.vn/chan-de-micro-lun-cho-nhac-cu-bieu-dien-transhine-dt-01-hang-chinh-hang-p72339752.html?spid=72339753,phụ kiện nhạc cụ,Nhạc cụ,2,TRANSHINE,Binaishop,Nhà Cửa - Đời Sống,"Đáp ứng nhu cầu chân đế cho micro thu âm nhạc cụ, Transhine DT-01 có khả năng tùy chỉnh chiều cao, phù hợp với nhiều loại nhạc cụ từ trống, guitar, organ, piano và các loại nhạc cụ biểu diễn khác.BỘ ..."
2406587,Combo Bộ phụ kiện đàn Ukulele (Bao da 3 lớp + Máy lên dây + Capo + Bộ dây dự phòng + Phím gảy),370000,0.0,0,Việt Hoàng Phong,,https://tiki.vn/combo-bo-phu-kien-dan-ukulele-bao-da-3-lop-may-len-day-capo-bo-day-du-phong-phim-gay-p2406587.html?spid=2584715,phụ kiện nhạc cụ,Nhạc cụ,2,Việt Hoàng Phong,Piano Lovers,Nhà Cửa - Đời Sống,"Combo 5 phụ kiện đàn Ukulele - hết sức tiện lợi cho người chơi đàn! Đàn ukulele có một đặc điểm thế mạnh là nhỏ gọn, dễ dàng mang theo, thuận tiện cho những người thích giao du, hay đi du lịch, hay p..."
134829240,Phụ kiện móc cài dụng cụ đa năng Leatherman Free Pocket Clip,300000,0.0,0,Leatherman,,https://tiki.vn/phu-kien-moc-cai-dung-cu-da-nang-leatherman-free-pocket-clip-p134829240.html?spid=134829241,phụ kiện nhạc cụ,Nhạc cụ,2,Leatherman,Quân Camp,Đồ dùng dã ngoại khác,"Leatherman Free Lanyard Ring & Pocket Clip có cấu tạo bằng thép không gỉ chắc chắn với lớp hoàn thiện bằng sa tanh và lỗ buộc dây. Bao gồm hai vít T6 và một cờ lê Torx T6.Tương thích: FREE K2, FRE..."
278764755,Phụ kiện móc cài dụng cụ đa năng Leatherman Pocket Clip & Lanyard Ring,348000,5.0,1,Leatherman,,https://tiki.vn/phu-kien-moc-cai-dung-cu-da-nang-leatherman-pocket-clip-lanyard-ring-p278764755.html?spid=148549560,phụ kiện nhạc cụ,Nhạc cụ,3,Leatherman,Quân Camp,Thể Thao - Dã Ngoại,"THÔNG TIN SẢN PHẨM:- Thương hiệu: Leatherman- Kích thước: 4 x 1 x 1 inches- Màu sắc: Bạc- Tương thích với: Charge AL, Charge ALX, Charge Ti, Charge TTi, Charge XTi, Original Surge, Surge và Wave Multi..."
108897447,"Ghim cài áo vest cưới - Ghim nhạc cụ đèn Guitar , tặng kèm hộp",99000,0.0,0,OEM,,https://tiki.vn/ghim-cai-ao-vest-cuoi-ghim-nhac-cu-den-guitar-tang-kem-hop-p108897447.html?spid=108897459,phụ kiện nhạc cụ,Nhạc cụ,3,OEM,Shophukienam,Root,       - Một phụ kiện cho chú rể không thể thiếu cho 1 bộ ảnh đẹp   - Chụp ảnh Kỷ yếu chia tay giảng đường   CHI TIẾT SẢN PHẨM:   Chất liệu: Hợp kim + đính đá hoa văn kèm lông vũ   Thích hợp l...
796009,Phụ Kiện Đàn Guitar Capo Vines PBA106 - Đen,80000,5.0,3,Vines,,https://tiki.vn/phu-kien-dan-guitar-capo-vines-pba106-den-p796009.html?spid=1077496,phụ kiện nhạc cụ,Nhạc cụ,3,Vines,Sol.g,Nhà Cửa - Đời Sống,"Phụ Kiện Đàn Guitar Capo Vines PBA106 đây là sản phẩm được làm bằng chất liệu hợp kim cao cấp với thiết kế hướng đến tính khả dụng cao, đó là dễ s..."
86406630,Đồ chơi nhạc cụ- Đàn gõ Xylophone hình cú mèo đáng yêu Toyshouse C601 - Dụng cụ phát triển năng khiếu âm nhạc dành cho bé yêu,72000,4.6,12,Toys House,,https://tiki.vn/do-choi-nhac-cu-dan-go-xylophone-hinh-cu-meo-dang-yeu-toyshouse-c601-dung-cu-phat-trien-nang-khieu-am-nhac-danh-cho-be-yeu-p86406630.html?spid=86406634,phụ kiện nhạc cụ,Nhạc cụ,3,Toys House,Shop Mẹ Và Bé UnMei,Đồ Chơi - Mẹ & Bé,        Bộ đàn gõ Xylophone hình cú mèo đáng yêu đến từ thương hiệu Toys House sẽ là một lựa chọn lý tưởng của mẹ dành cho bé.   ️ THÔNG TIN SẢN PHẨM SẢN PHẨM:   Bộ đàn gồm 6 phím Xylophone và 2...
271450240,Thí Nghiệm Khoa Học Vui - Âm Thanh Và Nhạc Cụ,27200,0.0,0,,,https://tiki.vn/thi-nghiem-khoa-hoc-vui-am-thanh-va-nhac-cu-p271450240.html?spid=271450241,phụ kiện nhạc cụ,Nhạc cụ,3,,Nhà sách Fahasa,Root,    Thí Nghiệm Khoa Học Vui - Âm Thanh Và Nhạc Cụ   Bộ sách “Thí nghiệm khoa học vui” với chủ đề đa dạng sẽ đem đến cho các bạn nhỏ nhiều trải nghiệm thú vị. Không chỉ cung cấp kiến thức khoa học ...
8014516,Sách All Story - Musical Instruments - Nhạc Cụ - Trình Độ 2 (Tập 5),30100,0.0,0,,,https://tiki.vn/sach-all-story-musical-instruments-nhac-cu-trinh-do-2-tap-5-p8014516.html?spid=20478334,phụ kiện nhạc cụ,Nhạc cụ,3,,Nhà sách Fahasa,Sách tiếng Việt,"Nào, giờ đã đến lúc chúng ta bắt đầu hành trình kiến tạo nên điều kì diệu rồi. Sau mỗi hoạt động, bạn hãy tự đánh giá khả năng của mình, vào bảng bên cạnh nhé. Hãy dán các miếng dán (sticker) ở cuối s..."
191642683,Phụ kiện cưới Giang - khăn Đống cổ điển chất liệu vải 35 tầng,190000,0.0,0,OEM,,https://tiki.vn/phu-kien-cuoi-giang-khan-dong-co-dien-chat-lieu-vai-35-tang-p191642683.html?spid=191642693,phụ kiện nhạc cụ,Nhạc cụ,3,OEM,Phụ kiện cưới Giang,Root,     ...
46594955,Bộ 2 móc chữ L - Phụ kiện móc treo dụng cụ Pegboard,59000,0.0,0,SMLIFE,,https://tiki.vn/bo-2-moc-chu-l-phu-kien-moc-treo-dung-cu-pegboard-p46594955.html?spid=46594956,phụ kiện nhạc cụ,Nhạc cụ,3,SMLIFE,SMLIFE,Dụng cụ sửa chữa nhà cửa khác,Móc chữ L Pegboard là một trong những phụ kiện sử dụng chung với bảng Pegboard Kim Loại được thiết kế để có thể linh hoạt tháo lắp và thay đổi vị trí nhằm đáp ứng nhu cầu sử dụng đa dạng.ĐẶC ĐIỂM SẢN...
173070933,Kệ đựng dụng cụ kim loại - Phụ kiện bảng Pegboard,70000,0.0,0,Dolahome,,https://tiki.vn/ke-dung-dung-cu-kim-loai-phu-kien-bang-pegboard-p173070933.html?spid=173070949,phụ kiện nhạc cụ,Nhạc cụ,3,Dolahome,Dola Home,Root,"       Website:    Xưởng sản xuất: 16/1q Nguyễn Ảnh Thủ, Hưng Lân, Bà Điểm, Hóc Môn, HCM   Văn phòng: 497/5 Sư Vạn Hạnh, Phường 12, Quận 10,     Chi tiết sản phẩm :   Kích thước: 156x30x230 (m..."
30837826,Móc treo đàn guitar,20000,4.3,8,OEM,,https://tiki.vn/moc-treo-dan-guitar-p30837826.html?spid=52864924,phụ kiện nhạc cụ,Nhạc cụ,3,OEM,Guitar MinMusic,Nhà Cửa - Đời Sống,"Không chỉ thích hợp cho sử dụng tại nhà hoặc phòng thu, mà còn hoàn hảo cho triển lãm.Móc treo đàn guitar nhỏ gọn, tiện dụng, bền bỉCó đệm êm quanh móc treoBảo vệ đàn tiện dụng..."
100352037,"Pickup Nhạc cụ đa dụng Piezo Adeline AD-30 - Bộ thu âm thanh dùng cho Đàn Guitar, Ukulele, Violin, Kalimba Và các loại nhạc cụ khác AD30 - Kèm Móng Gẩy DreamMaker",250000,5.0,2,Adeline,,https://tiki.vn/pickup-nhac-cu-da-dung-piezo-adeline-ad-30-bo-thu-am-thanh-dung-cho-dan-guitar-ukulele-violin-kalimba-va-cac-loai-nhac-cu-khac-ad30-kem-mong-gay-dreammaker-p100352037.html?spid=100352038,phụ kiện nhạc cụ,Nhạc cụ,4,Adeline,Tiến Mạnh Music,Phụ kiện nhạc cụ khác,"THÔNG SỐ KỸ THUẬT:- Bộ chuyển đổi mini piezo, phù hợp với Guitar Acoustic, Cổ điển, Dân gian, Ukulele, Violin, không cần pin.- Nó giúp nhạc cụ của bạn tạo ra chất lượng âm thanh tuyệt vời đồng thờ..."
796085,Phụ Kiện Đàn Guitar Dây Đàn Guitar Vines GA-A30,55000,4.0,1,Vines,,https://tiki.vn/phu-kien-dan-guitar-day-dan-guitar-ga-a30-p796085.html?spid=1077510,phụ kiện nhạc cụ,Nhạc cụ,4,Vines,Sol.g,Dây đeo Guitar,Phụ Kiện Đàn Guitar Dây Đàn Guitar Vines GA-A30 đây là sản phẩm được làm bằng chất liệu nhựa PC cao cấp với thiết kế hướng đến tính khả dụng c...
191639525,Phụ kiện cưới Giang - phụ kiện cô dâu - mút độn ngực loại tốt được các tiệm áo cưới tin dùng,70000,0.0,0,OEM,,https://tiki.vn/phu-kien-cuoi-giang-phu-kien-co-dau-mut-don-nguc-loai-tot-duoc-cac-tiem-ao-cuoi-tin-dung-p191639525.html?spid=191639535,phụ kiện nhạc cụ,Nhạc cụ,4,OEM,Phụ kiện cưới Giang,Root,     ...
45614878,Hộp nhựa Pegboard - Phụ kiện móc treo cho bảng treo dụng cụ cơ khí kim loại,69000,3.0,1,SMLIFE,,https://tiki.vn/hop-nhua-pegboard-phu-kien-moc-treo-cho-bang-treo-dung-cu-co-khi-kim-loai-p45614878.html?spid=45614879,phụ kiện nhạc cụ,Nhạc cụ,4,SMLIFE,SMLIFE,Nhà Cửa - Đời Sống,Hộp nhựa Pegboard là một trong những phụ kiện sử dụng chung với bảng Pegboard Kim Loại được thiết kế để có thể linh hoạt tháo lắp và thay đổi vị trí nhằm đáp ứng nhu cầu sử dụng đa dạng.*** ĐẶC ĐIỂM ...
191642731,Phụ kiện cưới Giang - voan quây chun kim tuyến mẫu mới,175000,0.0,0,OEM,,https://tiki.vn/phu-kien-cuoi-giang-voan-quay-chun-kim-tuyen-mau-moi-p191642731.html?spid=191642738,phụ kiện nhạc cụ,Nhạc cụ,4,OEM,Phụ kiện cưới Giang,Root,     ...
272209307,Thí Nghiệm Khoa Học Vui - Âm Thanh Và Nhạc Cụ _ML,32000,0.0,0,,,https://tiki.vn/thi-nghiem-khoa-hoc-vui-am-thanh-va-nhac-cu-_ml-p272209307.html?spid=272209308,phụ kiện nhạc cụ,Nhạc cụ,4,,NewShop Official,Kiến Thức Bách Khoa,"Thí Nghiệm Khoa Học Vui - Âm Thanh Và Nhạc CụBộ sách “Thí nghiệm khoa học vui” với chủ đề đa dạng sẽ đem đến cho các bạn nhỏ nhiều trải nghiệm thú vị. Không chỉ cung cấp kiến thức khoa học bổ ích, bộ..."
278709351,(CÓ ẢNH THẬT) Tranh treo tường trang trí decor phòng âm nhạc tranh dụng cụ âm nhạc 8,260500,0.0,0,OEM,,https://tiki.vn/co-anh-that-tranh-treo-tuong-trang-tri-decor-phong-am-nhac-tranh-dung-cu-am-nhac-8-p278709351.html?spid=278709353,phụ kiện nhạc cụ,Nhạc cụ,4,OEM,BINBIN SHOP,Các loại tranh khác,Tranh treo tường trang trí decor âm nhạc 8- Kích thước của tranh : Kích thước : 25x35cmx3 tấm - 30x45cmx3 tấm - 40x60cmx3 tấm - 50x70cmx3 tấm- Chất liệu : Tráng gương - Khách hàng muốn thay đổi sản ph...
191642913,Vòng hạt trai 2 lớp mẫu mới phụ kiện cưới Giang Sp002427,80000,0.0,0,OEM,,https://tiki.vn/vong-hat-trai-2-lop-mau-moi-phu-kien-cuoi-giang-sp002427-p191642913.html?spid=191642914,phụ kiện nhạc cụ,Nhạc cụ,4,OEM,Phụ kiện cưới Giang,Root,     ...
273915005,ỐP PHỤ KIỆN QUẠT GIÓ JANUS,155765,0.0,0,Yamaha,,https://tiki.vn/op-phu-kien-quat-gio-janus-p273915005.html?spid=273915009,phụ kiện nhạc cụ,Nhạc cụ,4,Yamaha,YAMAHA MOTOR VIỆT NAM,Phụ kiện xe máy khác,- Được nghiên cứu & phát triển bởi Yamaha Motor Việt Nam- Phù hợp với dòng xe Janus...
191641178,Cô dâu cài trán ấn độ phụ kiện cưới mới 2018,55000,0.0,0,OEM,,https://tiki.vn/co-dau-cai-tran-an-do-phu-kien-cuoi-moi-2018-p191641178.html?spid=191641186,phụ kiện nhạc cụ,Nhạc cụ,4,OEM,Phụ kiện cưới Giang,Root,       PHỤ KIỆN CƯỚI GIANG   (Cách chợ Tân Bình 500m)   ...
138173605,Phụ kiện giá đỡ bàn BBQ Naturehike NH20JJ012,288000,0.0,0,Naturehike,,https://tiki.vn/phu-kien-gia-do-ban-bbq-naturehike-nh20jj012-p138173605.html?spid=138173607,phụ kiện nhạc cụ,Nhạc cụ,5,Naturehike,Quân Camp,Đồ dùng dã ngoại khác,"THÔNG TIN SẢN PHẨM:- Thương hiệu: Naturehike- Xuất xứ: Trung Quốc- Số lượng: 1 chiếc- Kích thước:+ Giá đỡ lớn: 51x47 cm+ Giá đỡ nhỏ: 33,5×47 cm- Trọng lượng:+ Giá đỡ lớn: 1 kg/chiếc+ Giá đỡ nhỏ: 0.7kg..."
71682165,"Tô Màu Theo Từng Bước - Nghề Nghiệp, Trang Phục, Nhạc Cụ 1",12300,5.0,1,,,https://tiki.vn/to-mau-theo-tung-buoc-nghe-nghiep-trang-phuc-nhac-cu-1-p71682165.html?spid=71682166,phụ kiện nhạc cụ,Nhạc cụ,5,,Nhà sách Fahasa,Sách tiếng Việt,"Vẽ tranh bắt đầu từ việc khám phá tô màu, cuộc sống bắt đầu từ tuổi thơ đầy màu sắc kì diệu. Tô vẽ mỗi ngày giúp bé mở ra một cánh của nghệ thuật rộng lớn. Đây chính là thông điệp của bộ sách Hướng dẫ..."
275607414,Chân Đàn Piano Organ Woim U-Stand Kiểu Dáng Sang Trọng Phù Hợp Mọi Loại Đàn,719000,5.0,1,Woim,,https://tiki.vn/chan-dan-piano-organ-woim-u-stand-kieu-dang-sang-trong-phu-hop-moi-loai-dan-p275607414.html?spid=275607415,phụ kiện nhạc cụ,Nhạc cụ,5,Woim,WOIM World of Instrumental Music,Phụ kiện nhạc cụ khác,"- Chân Để Đàn Piano - Organ Chữ U là một trợ thủ đắc lực không thể thiếu cho cây đàn piano, organ yêu quý của bạn.- Sản phẩm chắc chắn chống va đập và mài mòn cao- Làm từ chất liệu Sắt dày với đường..."
96146927,Dụng cụ luyện ngón tay cho người chơi đàn guitar ,99000,4.3,9,Aroma,,https://tiki.vn/dung-cu-luyen-ngon-tay-cho-nguoi-choi-dan-guitar-p96146927.html?spid=96146932,phụ kiện nhạc cụ,Nhạc cụ,5,Aroma,Guitar MinMusic,Phụ kiện nhạc cụ khác,"Đồ tập tay giúp ngón tay khỏe mạnh khi chơi đàn guitarNhạc Cụ Âm NhạcChuyên Cung Cấp Các Loại Nhạc Cụ Cần thiết Phục Vụ Nhu Cầu Mọi Người Chơi NhạcCác Loại Phụ Kiện , Ốc Vít , Khóa ,Dây Đàn , Ngựa ..."
275606741,Chân Đàn Piano Organ Woim U-Stand Kiểu Dáng Sang Trọng Phù Hợp Mọi Loại Đàn,719000,0.0,0,Woim,,https://tiki.vn/chan-dan-piano-organ-woim-u-stand-kieu-dang-sang-trong-phu-hop-moi-loai-dan-p275606741.html?spid=275606742,phụ kiện nhạc cụ,Nhạc cụ,5,Woim,WOIM World of Instrumental Music,Phụ kiện nhạc cụ khác,"Để xem video cách lắp đặt, bạn tìm từ khoá trên mạng: Hướng Dẫn Cách Lắp Chân Đàn Woim U-Stand Cho Piano Organ Chữ U.- Chân Để Đàn Piano - Organ Chữ U là một trợ thủ đắc lực không thể thiếu cho cây đ..."
191644630,Ốp băng đô hoa mũ lưới phụ kiện cưới Giang,120000,0.0,0,OEM,,https://tiki.vn/op-bang-do-hoa-mu-luoi-phu-kien-cuoi-giang-p191644630.html?spid=191644634,phụ kiện nhạc cụ,Nhạc cụ,5,OEM,Phụ kiện cưới Giang,Root,       PHỤ KIỆN CƯỚI GIANG   (cách chợ tân bình 500m )   09.1828.1525 ( Tư vấn trên Web )   ...
261813121,Combo phụ kiện ghế xoay,100000,5.0,1,HG FURNITURE H i G,,https://tiki.vn/combo-phu-kien-ghe-xoay-p261813121.html?spid=261813125,phụ kiện nhạc cụ,Nhạc cụ,5,HG FURNITURE H i G,AnAn house,Root,"       Phụ kiện ghế xoay Bao gồm:   1. Bánh xe ghế: 5c- chất liệu: nhựa PU di chuyển đa mặt sàn, xoay 360 độ   2. Chân ghế: 1c - Chất liệu: Sắt mạ crom chống rỉ: chịu lực tốt, cân bằng chắc khỏe..."
274236915,PHỤ KIỆN PIN CHÌA KHÓA,23318,5.0,5,Yamaha,,https://tiki.vn/phu-kien-pin-chia-khoa-p274236915.html?spid=193915952,phụ kiện nhạc cụ,Nhạc cụ,5,Yamaha,YAMAHA MOTOR VIỆT NAM,Phụ kiện xe máy,"● Tên sản phẩm: Pin Chìa Khóa Xe● Mã phụ tùng: 90798CR20321 (Energizer - CR2032), 90798CR16320 (Panasonic - CR1632)● Thương hiệu: Yamaha Motor Việt Nam● Dòng xe với loại pin:90798CR20321 (Energiz..."
108412416,Túi đựng phụ kiện sạc dành cho macbook,102000,5.0,1,SG,,https://tiki.vn/tui-dung-phu-kien-sac-danh-cho-macbook-p108412416.html?spid=132841083,phụ kiện nhạc cụ,Nhạc cụ,5,SG,TIẾN PHÁT STORE,Hộp Đựng - Túi Đựng Phụ Kiện,"Túi đựng sạc Macbook kiêm đựng phụ kiện có rát nhiều ngăn. Cục sạc Macbook là thứ luôn bị đối xử tệ bạc nhất trong các món phụ kiện của Macbook, không tin anh chị nhìn cũng sạc của mình sẽ thấy nó thậ..."
