id,name,price,rating,review_count,brand,seller,url,kw,group,page,brand_detail,seller_detail,categories,short_description
100352223,"[Dây dài 3m] Pickup Nhạc cụ đa dụng Piezo Adeline AD-35 - Bộ thu âm thanh dùng cho Đàn Guitar, Ukulele, Violin, Kalimba Và các loại nhạc cụ khác AD35 - Kèm Móng Gẩy DreamMaker",250000,4.6,5,Adeline,,https://tiki.vn/day-dai-3m-pickup-nhac-cu-da-dung-piezo-adeline-ad-35-bo-thu-am-thanh-dung-cho-dan-guitar-ukulele-violin-kalimba-va-cac-loai-nhac-cu-khac-ad35-kem-mong-gay-dreammaker-p100352223.html?spid=100352224,phụ kiện nhạc cụ,Nhạc cụ,5,Adeline,Tiến Mạnh Music,Phụ kiện nhạc cụ khác,"THÔNG SỐ KỸ THUẬT:- Đầu dò pickup mini Piezo, phù hợp với Guitar Acoustic, cổ điển, folk, ukulele, violin, không cần pin. - Bộ pickup guitar Adeline AD-35 Làm cho nhạc cụ của bạn tạo ra chất lượn..."
278359758,"Chân Để Kèn Saxophone Gấp Gọn | Giá Đỡ Kèn Chuyên Dụng, Nhỏ Gọn, Chắc chắn",210000,0.0,0,OEM,,https://tiki.vn/chan-de-ken-saxophone-gap-gon-gia-do-ken-chuyen-dung-nho-gon-chac-chan-p278359758.html?spid=278359759,phụ kiện nhạc cụ,Nhạc cụ,6,OEM,Guitar MinMusic,Phụ kiện nhạc cụ khác,chân để kèn saxophone xếp gọn tiện lợiChất liệu: sắt ko rỉDễ dàng xếp gọn và mang đi------ SHOP ĐẢM BẢO ------Hình ảnh sản phẩm giống hình 100%Chất lượng sản phẩm đúng như mô tảSản phẩm được kiểm tra ...
102758616,Bông tai đá phụ kiện xinh,89000,3.5,4,OEM,,https://tiki.vn/bong-tai-da-phu-kien-xinh-p102758616.html?spid=102758617,phụ kiện nhạc cụ,Nhạc cụ,6,OEM,AUCOSTA,Bông tai,"Chất liệu hợp kim S925, đáMẫu đơn giản dễ phối đồThích hợp với lady sang trọng, người làm văn phòngHãy thêm vào bộ sưu tập của bạn nhé !Sử dụng: Không đeo khi tắmKo tiếp xúc với nước sẽ giúp ..."
191641532,Phụ kiện cưới Giang - Vương miện - Vương miện cô dâu hạt trai đẹp,99000,0.0,0,OEM,,https://tiki.vn/phu-kien-cuoi-giang-vuong-mien-vuong-mien-co-dau-hat-trai-dep-p191641532.html?spid=191641538,phụ kiện nhạc cụ,Nhạc cụ,6,OEM,Phụ kiện cưới Giang,Root,       PHỤ KIỆN CƯỚI GIANG   Vương miện cô dâu hạt trai xi mạ   ...
191644232,Quạt tròn cổ trang - phụ kiện cưới Giang - quạt tròn đính chữ hỷ,240000,0.0,0,OEM,,https://tiki.vn/quat-tron-co-trang-phu-kien-cuoi-giang-quat-tron-dinh-chu-hy-p191644232.html?spid=191644247,phụ kiện nhạc cụ,Nhạc cụ,6,OEM,Phụ kiện cưới Giang,Root,     ...
11510243,Sách Wizmaker Trình Độ 2 Tập 5 - Nhạc Cụ,49700,0.0,0,,,https://tiki.vn/sach-wizmaker-trinh-do-2-tap-5-nhac-cu-p11510243.html?spid=20471798,phụ kiện nhạc cụ,Nhạc cụ,6,,Nhà sách Fahasa,Từ Vựng Tiếng Anh,"Bộ sách rất phù hợp với các độc giả nhí từ 3 tuổi trở lên, thêm khơi gợi trí tò mò của các em, đồng thời giúp giải đáp biết bao câu hỏi “Tại sao?”, “Như thế nào”. Đặc biệt, bộ sách còn tăng cường khả ..."
262087533,"Bảng Pegboard Kim Loại & Phụ Kiện Móc Treo Dụng Cụ Cơ Khí Chuyên Nghiệp, Thương Hiệu SMLIFE",110000,5.0,5,SMLIFE,,https://tiki.vn/bang-pegboard-kim-loai-phu-kien-moc-treo-dung-cu-co-khi-chuyen-nghiep-thuong-hieu-smlife-p262087533.html?spid=262087615,phụ kiện nhạc cụ,Nhạc cụ,6,SMLIFE,SMLIFE,"Nội thất phòng học, làm việc khác",1. Mô tả sản phẩm:SMLIFE phát triển một danh mục các phụ kiện móc pegboard đầy đủ nhất giúp bạn tổ chức tất cả các loại thiết bị dụng cụ cơ khí từ nhỏ tới lớn. Với thiết kế đặc biệt và sơn tĩnh ...
191640990,Khắn đống truyền thống 35 tầng đỏ phụ kiện cưới đính hoa nhũ vàng,380000,0.0,0,OEM,,https://tiki.vn/khan-dong-truyen-thong-35-tang-do-phu-kien-cuoi-dinh-hoa-nhu-vang-p191640990.html?spid=191640995,phụ kiện nhạc cụ,Nhạc cụ,6,OEM,Phụ kiện cưới Giang,Root,     ...
102758347,Bông tai ngọc trai phụ kiện xinh ,95000,3.0,2,OEM,,https://tiki.vn/bong-tai-ngoc-trai-phu-kien-xinh-p102758347.html?spid=102758348,phụ kiện nhạc cụ,Nhạc cụ,6,OEM,AUCOSTA,Bông tai,"Chất liệu hợp kim S925, đá, nhựaMẫu đơn giản dễ phối đồThích hợp với lady sang trọng, người làm văn phòngHãy thêm vào bộ sưu tập của bạn nhé !Sử dụng: Không đeo khi tắmKo tiếp xúc với nước sẽ g..."
90654950,Hộp Đựng Phụ Kiện/ Dụng Cụ Sửa Chữa Xe Đạp Dạng Bình Nước Chất Liệu EVA dài 20cm Mailee,129000,4.0,5,Mai Lee,,https://tiki.vn/hop-dung-phu-kien-dung-cu-sua-chua-xe-dap-dang-binh-nuoc-chat-lieu-eva-loai-lon-mailee-p90654950.html?spid=90654951,phụ kiện nhạc cụ,Nhạc cụ,6,Mai Lee,Mai Lee House,Phụ tùng - Phụ kiện xe đạp khác,Hộp Đựng Phụ Kiện/ Dụng Cụ Sửa Chữa Xe Đạp Dạng Bình Nước Chất Liệu EVA (Loại Lớn) Mailee Chất liệu Vải EVA Chống thấm nước giúp đạp xe và bảo quản dụng cụ/ phụ kiện tốt hơn trong điều kiện thời ...
157213359,Túi Đựng Phụ Kiện RINGKE Pouch - Hàng Chính Hãng,250000,0.0,0,Ringke,,https://tiki.vn/tui-dung-phu-kien-ringke-pouch-hang-chinh-hang-p157213359.html?spid=157213369,phụ kiện nhạc cụ,Nhạc cụ,6,Ringke,Nhà Giả Kim,Túi xách vừa và nhỏ,Túi đựng phụ kiện RINGKE PouchVì sao nên mua sản phẩm này?Túi đựng phụ kiện RINGKE PouchThương hiệu Ringke xuất xứ Hàn QuốcGiữ mọi thứ bạn cần trong tầm tay thoải mái và sắp xếp dễ dàngTúi đự...
277389499,(ẢNH THẬT) Tranh treo tường âm nhạc 26 trang trí decor phòng nhạc cụ âm nhạc có khung,337000,0.0,0,OEM,,https://tiki.vn/anh-that-tranh-treo-tuong-am-nhac-26-trang-tri-decor-phong-nhac-cu-am-nhac-co-khung-p277389499.html?spid=277389507,phụ kiện nhạc cụ,Nhạc cụ,7,OEM,BINBIN SHOP,Tranh canvas,Tranh treo tường trang trí decor quán âm nhạc 26- Kích thước của tranh : Kích thước : Size 1 : 25x35cmx2 tấm + 18x25cmx3 tấm+ 2 khung 13x18cmSize 2 : 30x45cmx2 tấm +20x30cmx3 tấm +15x20cmx2 tấmSize 3 ...
273710758,Phụ kiện chụp kính đèn Campingmoon T-8,408000,0.0,0,CAMPINGMOON,,https://tiki.vn/phu-kien-chup-kinh-den-campingmoon-t-8-p273710758.html?spid=273710759,phụ kiện nhạc cụ,Nhạc cụ,7,CAMPINGMOON,Quân Camp,Ống nhòm dã ngoại,"THÔNG TIN SẢN PHẨM- Thương hiệu: Campingmoon- Xuất xứ: Trung Quốc- Chất liệu: Lồng kính: Thủy tinh chịu nhiệt.- Kích thước: 11 x 11 x 11,5 cm- Kích thước đóng gói: 12,5 x 12,5 x 14 cm- Trọng lượ..."
271119843,Mặt Phụ Kiện Sạc 2 Cổng 60W USB A+C I Phụ Kiện Đa Phương Tiện Line8,2189000,0.0,0,Line8,,https://tiki.vn/mat-phu-kien-sac-2-cong-60w-usb-a-c-i-phu-kien-da-phuong-tien-line8-p271119843.html?spid=271119844,phụ kiện nhạc cụ,Nhạc cụ,7,Line8,METAKING LTD,Ổ cắm & công tắc điện,PHỤ KIỆN SẠC 2 CỔNG 60W USB A+C- Được cung cấp theo kích thước thanh ray Line8.- Dễ dàng lắp đặt vào liền lạc và thẩm mỹ.- Toàn bộ dây có thể đấu nối và giấu phía sau thanh ray. ...
191640783,Nơ chú rể chấm bi phụ kiện cưới,45000,0.0,0,OEM,,https://tiki.vn/no-chu-re-cham-bi-phu-kien-cuoi-p191640783.html?spid=191640791,phụ kiện nhạc cụ,Nhạc cụ,7,OEM,Phụ kiện cưới Giang,Root,       PHỤ KIỆN CƯỚI GIANG   (Cách chợ Tân Bình 500m)   Địa chỉ cửa hàng 2 : 36 Năm Châu Phường 11 Quận Tân Bình   09.1828.1525 ( Tư vấn trên Web )   ...
186605957,Phụ kiện Cụm đầu đốt đèn bão Feuerhand Hurricane Lantern Baby Special 276,540000,0.0,0,Feuerhand,,https://tiki.vn/phu-kien-cum-dau-dot-den-bao-feuerhand-hurricane-lantern-baby-special-276-p186605957.html?spid=186605958,phụ kiện nhạc cụ,Nhạc cụ,7,Feuerhand,Quân Camp,Đồ dùng dã ngoại khác,THÔNG TIN SẢN PHẨM- Thương hiệu: PETROMAX - FEUERHAND (thương hiệu Đức)- Nơi sản xuất: Đức- Chất liệu: thép không gỉ.- Kích thước: Kích thước sử dụng: H1.4 x W3 x D3cm- Trọng lượng:Trọng lượng sản phẩ...
274140069,PHỤ KIỆN CẮT BỤI RẬM M18 FOPH-BCA - HÀNG CHÍNH HÃNG,2352000,0.0,0,Milwaukee,,https://tiki.vn/phu-kien-cat-bui-ram-m18-foph-bca-hang-chinh-hang-p274140069.html?spid=274140071,phụ kiện nhạc cụ,Nhạc cụ,7,Milwaukee,THIẾT BỊ XÂY DỰNG VÀ GIA ĐÌNH,Các loại máy khác," Sản phẩm phụ kiện cắt bụi rậm M18 FOPH-BCA này tương thích với đầu nguồn ngoài trời M18 FUEL với QUIK-LOK, mang lại khả năng linh hoạt trong sử dụng. Tấm che lưỡi dao được thiết kế đặc biệt để hiệu ..."
191646872,Nơ cao cấp chú rể phụ kiện cưới,96000,0.0,0,OEM,,https://tiki.vn/no-cao-cap-chu-re-phu-kien-cuoi-p191646872.html?spid=191646888,phụ kiện nhạc cụ,Nhạc cụ,7,OEM,Phụ kiện cưới Giang,Root,       PHỤ KIỆN CƯỚI GIANG   Nơ cổ nam đính đá chất liệu vải đá   thích hợp chụp hình đi bar   Địa chỉ cửa hàng 2 : 36 Năm Châu Phường 11 Quận Tân Bình   ...
50323635,Giá để sách nhạc Woim G49 giá rẻ ( Màu đen),148000,5.0,2,Woim,,https://tiki.vn/gia-de-sach-nhac-woim-g49-cao-cap-mau-den-p50323635.html?spid=52111967,phụ kiện nhạc cụ,Nhạc cụ,7,Woim,WOIM World of Instrumental Music,Phụ kiện nhạc cụ khác,"Giá để sách nhạc Woim G49Chi tiết sản phẩm:– Giá để sách nhạc Để được nhiều dụng cụ như bút viết , tài liệu .– Giá có thể điều chỉnh nâng hạ độ cao tùy ý,– Giá để sách nhạc sử dụng được ch..."
191644721,Phụ kiện cưới Giang - khăn Đống cô dâu 35 tầng trắng kem,290000,0.0,0,OEM,,https://tiki.vn/phu-kien-cuoi-giang-khan-dong-co-dau-35-tang-trang-kem-p191644721.html?spid=191644724,phụ kiện nhạc cụ,Nhạc cụ,7,OEM,Phụ kiện cưới Giang,Root,     ...
54035822,Phụ Kiện Cài Áo TiTiShop - Mã PKV117VANG,124000,0.0,0,Titishop,,https://tiki.vn/phu-kien-cai-ao-titishop-ma-pkv117vang-p54035822.html?spid=54035823,phụ kiện nhạc cụ,Nhạc cụ,7,Titishop,TitiShop,Cài Áo,"Chất liệu:Sang trọng hợp thời trangMầu sắc sang đẹp Phù hợp sử dụng cài áo, áo vest , áo sơ mi trang phục cho đáng mày râu ..."
278038257,PHỤ KIỆN NỮ HANDMADE MÃ 02 NHIỀU MÀU SIÊU ĐẸP,11500,0.0,0,OEM,,https://tiki.vn/phu-kien-nu-handmade-ma-02-nhieu-mau-sieu-dep-p278038257.html?spid=278038259,phụ kiện nhạc cụ,Nhạc cụ,8,OEM,BEE TP STORE,Phụ kiện thời trang nữ khác,"NHẪN HANDMADE NGỌC TRAI NHỰA MÃ 02 NHIỀU MÀU SIÊU ĐẸPThiết kế : Viên ngọc trai dạng tròn màu đa dạng, sáng lấp lánhKích cỡ ngón tay đeo nhẫn : 5-7CMSử dụng : Thời trang đeo tayHướng dẫn đo s..."
54016358,Phụ Kiện Cài Áo TiTiShop - Mã PKV133VANG,124000,0.0,0,Titishop,,https://tiki.vn/phu-kien-cai-ao-titishop-ma-pkv133vang-p54016358.html?spid=54016359,phụ kiện nhạc cụ,Nhạc cụ,8,Titishop,TitiShop,Cài Áo,"Chất liệu:Sang trọng hợp thời trangMầu sắc sang đẹp Phù hợp sử dụng cài áo, áo vest , áo sơ mi trang phục cho đáng mày râu ..."
251553139,"Pickup Nhạc Cụ 1 Đầu Thu Adeline AD81 - Bộ Thu Âm Thanh Cho Đàn Guitar, Ukulele, Violin, Kalimba, Drum, Erhu AD-81 Hàng Chính Hãng - Kèm Móng Gẩy DreamMaker",650000,0.0,0,Adeline,,https://tiki.vn/pickup-nhac-cu-1-dau-thu-adeline-ad81-bo-thu-am-thanh-cho-dan-guitar-ukulele-violin-kalimba-drum-erhu-ad-81-hang-chinh-hang-kem-mong-gay-dreammaker-p251553139.html?spid=251553140,phụ kiện nhạc cụ,Nhạc cụ,8,Adeline,Tiến Mạnh Music,Nhà Cửa - Đời Sống,"THÔNG SỐ KỸ THUẬT:- Chất liệu: Gỗ + Nhựa- Đầu ra: Giắc cắm 3.5mm- Trọng lượng sản phẩm: 20g- Có dây 6ly dài 3m - Nút Volume- Bộ sản phẩm gồm: Pickup AD-81, 1 Dây cáp 6ly dài 3m, 1 Miếng dán, 1 Túi..."
169576637,"Aroma AHF-03 - Dụng Cụ Tập Tay Luyện Ngón Chơi Guitar, Piano, Organ AHF03 AHF3 Hàng Chính Hãng - Kèm Móng Gẩy DreamMaker",98000,4.0,1,Aroma,,https://tiki.vn/aroma-ahf-03-dung-cu-tap-tay-luyen-ngon-choi-guitar-piano-organ-ahf03-ahf3-hang-chinh-hang-kem-mong-gay-dreammaker-p169576637.html?spid=169576639,phụ kiện nhạc cụ,Nhạc cụ,8,Aroma,Tiến Mạnh Music,Nhà Cửa - Đời Sống,"THÔNG SỐ KỸ THUẬT:- Được thiết kế nhỏ gọn, dễ dàng mang theo- Dụng cụ luyện tập ngón tay, bàn tay và cánh tay.- Phát triển chiều dài ngón tay và sức nắm của bàn tay.- Duy trì cảm giác và sự khé..."
274054942,BỘ 11 MÓN PHỤ KIỆN MÀI MINI WRR2011 WADFOW - HÀNG CHÍNH HÃNG,77050,0.0,0,Wadfow,,https://tiki.vn/bo-11-mon-phu-kien-mai-mini-wrr2011-wadfow-hang-chinh-hang-p274054942.html?spid=274054944,phụ kiện nhạc cụ,Nhạc cụ,8,Wadfow,THIẾT BỊ XÂY DỰNG VÀ GIA ĐÌNH,Dụng cụ sửa chữa nhà cửa khác,"Bộ 11 Món Phụ Kiện Mài Mini WadFow WRR2011 là sự lựa chọn hoàn hảo cho những người làm việc cần các công cụ để mài thủy tinh và đá. Với đa dạng các loại phụ kiện bao gồm mũi khắc, mũi khoan hợp kim và..."
278595570,"(HCM)Tranh treo tường tráng gương hoạt hình, tranh sự kiện âm nhạc kèm đinh treo",140000,0.0,0,OEM,,https://tiki.vn/hcm-tranh-treo-tuong-trang-guong-hoat-hinh-tranh-su-kien-am-nhac-kem-dinh-treo-p278595570.html?spid=278595580,phụ kiện nhạc cụ,Nhạc cụ,8,OEM,BINBIN SHOP,Các loại tranh khác,"Tranh treo tường hoạt hình- Kích thước của tranh : Kích thước : 45x65cm - 55x80cm - 60x90cm- Chất liệu : Tráng gương - Khách hàng muốn thay đổi sản phẩm , kích thước,in thêm hình theo ý, …. Vui lòng l..."
4444665,Phụ Kiện Cài Theo Nón Trái Chuối 077/3 U&Yaby - Vàng,58000,0.0,0,U & YABY,,https://tiki.vn/phu-kien-cai-theo-non-trai-chuoi-077-3-u-yaby-vang-p4444665.html?spid=4669273,phụ kiện nhạc cụ,Nhạc cụ,8,U & YABY,U&YABY,Phụ kiện tóc cho bé,"Phụ Kiện Cài Theo Nón Trái Chuối 077/3 U&Yaby với 100% bông polyester mềm mại, an toàn, cùng kiểu dáng thời trang, là sự lựa chọn cho nhiều người.Bông polyster có độ đàn hồi cao, giữ dáng lâu. Bên ng..."
105797837,Bộ phụ kiện cốt xoay AT180 + phụ kiện trên dưới dùng cho cửa có khung bao,368500,0.0,0,Glaze,,https://tiki.vn/bo-phu-kien-cot-xoay-at180-phu-kien-tren-duoi-dung-cho-cua-co-khung-bao-p105797837.html?spid=105797840,phụ kiện nhạc cụ,Nhạc cụ,8,Glaze,GLAZE OFFICIAL STORE,"Thùng đồ nghề, túi công cụ",       Bộ phụ kiện dùng cho 1 cánh cửa có khung bao   - Tải trọng Max: 80kg   - Phụ kiện gồm 1 cốt sàn AT-180-Glaze + 1 bộ phụ kiện bắt váo cánh có khung   ...
274054965,BỘ 21 MÓN PHỤ KIỆN MÀI MINI WRR3021 WADFOW - HÀNG CHÍNH HÃNG,66700,0.0,0,Wadfow,,https://tiki.vn/bo-21-mon-phu-kien-mai-mini-wrr3021-wadfow-hang-chinh-hang-p274054965.html?spid=274054966,phụ kiện nhạc cụ,Nhạc cụ,8,Wadfow,THIẾT BỊ XÂY DỰNG VÀ GIA ĐÌNH,Dụng cụ sửa chữa nhà cửa khác,"Bộ 21 Món Phụ Kiện Mài Cắt Mini WadFow WRR3021 là sự lựa chọn lý tưởng cho những người làm việc cần các công cụ cắt. Với đa dạng các loại phụ kiện bao gồm đĩa cắt và trục, sản phẩm này mang đến sự hiệ..."
173070963,Hộp đựng bút kim loại - Phụ kiện bảng Pegboard,105000,0.0,0,Dolahome,,https://tiki.vn/hop-dung-but-kim-loai-phu-kien-bang-pegboard-p173070963.html?spid=274890476,phụ kiện nhạc cụ,Nhạc cụ,8,Dolahome,Dola Home,Root,"Website:Xưởng sản xuất: 16/1q Nguyễn Ảnh Thủ, Hưng Lân, Bà Điểm, Hóc Môn, HCMChi tiết sản phẩm :++ Hộp bút lớn: 9.5 x 6.5 x 4.5 (cm)++ Hộp bút nhỏ: 10.5*5.5*9.5 (cm)Chất liệu: Sắt sơn tĩnh điện..."
5923961,Giá để sách nhạc cao cấp ( Màu đen),225000,4.5,29,OEM,,https://tiki.vn/gia-de-sach-nhac-cao-cap-mau-den-p5923961.html?spid=46206835,phụ kiện nhạc cụ,Nhạc cụ,9,OEM,Guitar MinMusic,Nhà Cửa - Đời Sống,"Giá để sách được thiết kế cứng cáp, nhỏ gọn, bền, dễ xếp.1 cây guitar và 1 giá sách để nhạc là có thể vừa đánh vừa xem bài hát, thật tiện lợi và dễ dàng.Giá sách thường dùng nhiều trong hợp xướng, ..."
274054904,BỘ 39 MÓN PHỤ KIỆN MÀI MINI WRR1039 WADFOW - HÀNG CHÍNH HÃNG,69000,0.0,0,Wadfow,,https://tiki.vn/bo-39-mon-phu-kien-mai-mini-wrr1039-wadfow-hang-chinh-hang-p274054904.html?spid=274054905,phụ kiện nhạc cụ,Nhạc cụ,9,Wadfow,THIẾT BỊ XÂY DỰNG VÀ GIA ĐÌNH,Nhà Cửa - Đời Sống,"Bộ 39 Món Phụ Kiện Làm Mộc Mini WadFow WRR1039 là sự lựa chọn hoàn hảo cho những người làm việc cần các công cụ làm mộc. Với đa dạng các loại phụ kiện bao gồm mũi khắc, băng mài, đĩa mài, mũi khoan, t..."
191646378,Phụ kiện cưới Giang - cài tóc cô dâu cổ trang,450000,0.0,0,OEM,,https://tiki.vn/phu-kien-cuoi-giang-cai-toc-co-dau-co-trang-p191646378.html?spid=191646381,phụ kiện nhạc cụ,Nhạc cụ,9,OEM,Phụ kiện cưới Giang,Root,     ...
54016332,Phụ Kiện Cài Áo TiTiShop - Mã PKV149VANG,124000,0.0,0,Titishop,,https://tiki.vn/phu-kien-cai-ao-titishop-ma-pkv149vang-p54016332.html?spid=54016333,phụ kiện nhạc cụ,Nhạc cụ,9,Titishop,TitiShop,Cài Áo,"Chất liệu:Sang trọng hợp thời trangMầu sắc sang đẹp Phù hợp sử dụng cài áo, áo vest , áo sơ mi trang phục cho đáng mày râu ..."
274054958,BỘ 13 MÓN PHỤ KIỆN MÀI MINI WRR2013 WADFOW - HÀNG CHÍNH HÃNG,67850,0.0,0,Wadfow,,https://tiki.vn/bo-13-mon-phu-kien-mai-mini-wrr2013-wadfow-hang-chinh-hang-p274054958.html?spid=274054959,phụ kiện nhạc cụ,Nhạc cụ,9,Wadfow,THIẾT BỊ XÂY DỰNG VÀ GIA ĐÌNH,Nhà Cửa - Đời Sống,"Bộ 13 Món Phụ Kiện Mài Mini WadFow WRR2013 là sự lựa chọn hoàn hảo cho những người làm việc với thủy tinh và đá. Với đa dạng các loại mũi khoan hợp kim, đá mài cà rem, bánh mài và trục, sản phẩm này m..."
54016334,Phụ Kiện Cài Áo TiTiShop - Mã PKV137VANG,124000,0.0,0,Titishop,,https://tiki.vn/phu-kien-cai-ao-titishop-ma-pkv137vang-p54016334.html?spid=54016335,phụ kiện nhạc cụ,Nhạc cụ,9,Titishop,TitiShop,Root,"Chất liệu:Sang trọng hợp thời trangMầu sắc sang đẹp Phù hợp sử dụng cài áo, áo vest , áo sơ mi trang phục cho đáng mày râu ..."
191645921,Phụ kiện cưới Giang - cà vạt ông sui ngang 6cm hàng xuất Camphuchia,60000,0.0,0,OEM,,https://tiki.vn/phu-kien-cuoi-giang-ca-vat-ong-sui-ngang-6cm-hang-xuat-camphuchia-p191645921.html?spid=191645924,phụ kiện nhạc cụ,Nhạc cụ,9,OEM,Phụ kiện cưới Giang,Cà vạt,     ...
247818447,Kệ đồ nghề Sata 95222B Xe Đẩy Dụng Cụ Linh Kiện 3 Tầng,2450000,0.0,0,Sata,,https://tiki.vn/ke-do-nghe-sata-95222b-xe-day-dung-cu-linh-kien-3-tang-p247818447.html?spid=247818449,phụ kiện nhạc cụ,Nhạc cụ,9,Sata,Trung Tâm Công Cụ,Root,Kệ đồ nghề Sata 95222B thiết kế 4 bánh xe nên việc di chuyển cực kỳ nhẹ và linh hoạt là sản phẩm đến từ thương hiệu Sata - MỹThông số kỹ thuật:Tên sản phẩm: Kệ đồ nghề Sata 95222B - có bánh xeThươn...
276653917,Kẹp Gấp Sau Đính Đá - Phụ Kiện Sang Trọng Dành Cho Người Phụ Nữ Yêu Thương,89000,0.0,0,OEM,,https://tiki.vn/kep-gap-sau-dinh-da-phu-kien-sang-trong-danh-cho-ban-p276653917.html?spid=276653923,phụ kiện nhạc cụ,Nhạc cụ,9,OEM,AUCOSTA,Phụ kiện tóc khác,...
251575673,"Pickup Nhạc Cụ 2 Đầu Thu Adeline AD88 - Bộ Thu Âm Thanh Cho Đàn Guitar, Ukulele, Violin, Kalimba, Drum, Erhu AD-88 Hàng Chính Hãng - Kèm Móng Gẩy DreamMaker",650000,0.0,0,Adeline,,https://tiki.vn/pickup-nhac-cu-2-dau-thu-adeline-ad88-bo-thu-am-thanh-cho-dan-guitar-ukulele-violin-kalimba-drum-erhu-ad-88-hang-chinh-hang-kem-mong-gay-dreammaker-p251575673.html?spid=251575674,phụ kiện nhạc cụ,Nhạc cụ,9,Adeline,Tiến Mạnh Music,Nhà Cửa - Đời Sống,"THÔNG SỐ KỸ THUẬT:- Chất liệu: Red Cherry + Gỗ Mahogany + Kim loại- Không có dây 6ly, có lỗ 6ly cái - Không Nút Volume- Khối lượng: 37g- Bộ thu âm thanh cho guitar classic, guitar acoustic, ukulel..."
252106125,"BỘ 3 SẢN PHẨM DOREMON ĐÀN ORGAN, ĐIỆN THOẠI BÀN VÀ ĐIỆN THOẠI PIN - 1229A",150000,0.0,0,OEM,,https://tiki.vn/bo-3-san-pham-doremon-dan-organ-dien-thoai-ban-va-dien-thoai-pin-1229a-p252106125.html?spid=276459311,phụ kiện nhạc cụ,Nhạc cụ,10,OEM,HAPPY KIDS Shop đồ chơi cho bé,Nhà Cửa - Đời Sống,"       BỘ 3 SẢN PHẨM DOREMON ĐÀN ORGAN, ĐIỆN THOẠI BÀN VÀ ĐIỆN THOẠI PIN - 1229A   Thông tin sản phẩm:    Bộ 3 món đồ chơi DOREMON gồm có   - Đàn organ   - Điện thoại bàn   - Điện thoại pin ..."
54016354,Phụ Kiện Cài Áo TiTiShop - Mã PKV140VANG,124000,0.0,0,Titishop,,https://tiki.vn/phu-kien-cai-ao-titishop-ma-pkv140vang-p54016354.html?spid=54016355,phụ kiện nhạc cụ,Nhạc cụ,10,Titishop,TitiShop,Cài Áo,"Chất liệu:Sang trọng hợp thời trangMầu sắc sang đẹp Phù hợp sử dụng cài áo, áo vest , áo sơ mi trang phục cho đáng mày râu ..."
57542451,Behringer C-2 - Cặp Micro Thu Âm Nhạc Cụ - Hàng chính hãng,1889680,5.0,1,Behringe,,https://tiki.vn/behringer-c-2-cap-micro-thu-am-nhac-cu-hang-chinh-hang-p57542451.html?spid=57542452,phụ kiện nhạc cụ,Nhạc cụ,10,Behringe,Binaishop,Thiết Bị Số - Phụ Kiện Số,"Behringer C-2 là cặp micro thu âm nhạc cụ chất lượng cao với màng thu condenser low-mass diaphragm, cho dải đáp ứng tần số động siêu rộng, mang lại khả năng tái tạo âm thanh vô cùng trung thực. ..."
274054864,BỘ 10 MÓN PHỤ KIỆN MÀI MINI WRR5010 WADFOW - HÀNG CHÍNH HÃNG,70150,0.0,0,Wadfow,,https://tiki.vn/bo-10-mon-phu-kien-mai-mini-wrr5010-wadfow-hang-chinh-hang-p274054864.html?spid=274054865,phụ kiện nhạc cụ,Nhạc cụ,10,Wadfow,THIẾT BỊ XÂY DỰNG VÀ GIA ĐÌNH,Nhà Cửa - Đời Sống,"Bộ 10 Món Phụ Kiện Đánh Bóng và Mài Mini WadFow WRR5010 là lựa chọn tốt cho những người làm việc cần các công cụ để đánh bóng và mài. Với đa dạng các loại phụ kiện bao gồm bàn chải nhám, bàn chải đánh..."
191645853,Phụ kiện cưới Giang - Bộ cài tóc cô dâu hoa voan hạt,79000,0.0,0,OEM,,https://tiki.vn/phu-kien-cuoi-giang-bo-cai-toc-co-dau-hoa-voan-hat-p191645853.html?spid=191645859,phụ kiện nhạc cụ,Nhạc cụ,10,OEM,Phụ kiện cưới Giang,Root,       PHỤ KIỆN CƯỚI GIANG   (Cách chợ Tân Bình 500m)   ...
277164872,Phụ kiện trang trí hình thần tài bằng nhựa acrylic,18000,0.0,0,Tiecxinh,,https://tiki.vn/phu-kien-trang-tri-hinh-than-tai-bang-nhua-acrylic-p277164872.html?spid=277164880,phụ kiện nhạc cụ,Nhạc cụ,10,Tiecxinh,tiecxinh,Trang trí nhà cửa khác,"Phụ kiện trang trí hình thần tài bằng nhựa acrylic Chất liệu: nhựa acrylic Kích thước: 6 x 7,5 cm (+/- 0,3 cm) Hình thần tài biểu tượng cho tài lộc, cát tường Màu sắc, hình ảnh chi tiết sắc nétTh..."
197744363,Phụ kiện kính chuỗi đeo mắt kiếng nhiều lớp phụ kiện hip hop Âu Mỹ xu hướng mới trend,98600,0.0,0,ROSAVAN,,https://tiki.vn/phu-kien-kinh-chuoi-deo-mat-kieng-nhieu-lop-phu-kien-hip-hop-au-my-xu-huong-moi-trend-p197744363.html?spid=197744365,phụ kiện nhạc cụ,Nhạc cụ,10,ROSAVAN,MUANHANH,Phụ kiện kính,Phụ kiện kính chuỗi đeo mắt kiếng nhiều lớp phụ kiện hip hop Âu Mỹ xu hướng mới trend bạn hoàn toàn có thể mix and match phụ kiện đa phong cách tạo điểm nhấn riêng cho cá nhân mà không đụng hàng với b...
191643376,Phụ kiện cưới Giang - hoa cài áo hai họ nhà gái và nhà trai ( 10 bông),40000,0.0,0,OEM,,https://tiki.vn/phu-kien-cuoi-giang-hoa-cai-ao-hai-ho-nha-gai-va-nha-trai-10-bong-p191643376.html?spid=191643378,phụ kiện nhạc cụ,Nhạc cụ,10,OEM,Phụ kiện cưới Giang,Root,     ...
181096368,Dụng cụ ép đáy đồng hồ chất liệu cao câp - Phụ kiện đồng hồ,178999,0.0,0,OEM,,https://tiki.vn/dung-cu-ep-day-dong-ho-chat-lieu-cao-cap-phu-kien-dong-ho-p181096368.html?spid=192898128,phụ kiện nhạc cụ,Nhạc cụ,10,OEM,Siêu Thị Linh Kiện,Root,    Bộ dụng cụ ép đáy đồng hồ cơ bản bao gồm bàn ép và các đĩa nhựa cỡ khác nhau có đường kính từ 18mm đến 52mm Bộ dụng cụ giúp bạn có thể: - Ép đáy đồng hồ - Ép kính đồng hồ Máy ép dành cho mọi lo...
