id,name,price,rating,review_count,brand,seller,url,kw,group,page,brand_detail,seller_detail,categories,short_description
277745836,Bát Hương Bát Nhang Thảo Mộc Yên Bằng Sứ Cao Cấp Cao 5cm Size Vừa Màu Sắc Phong Thủy Trang Trí Bàn Thờ Dâng Hương,156322,0.0,0,yên,,https://tiki.vn/bat-huong-bat-nhang-thao-moc-yen-bang-su-cao-cap-cao-5cm-size-vua-mau-sac-phong-thuy-trang-tri-ban-tho-dang-huong-p277745836.html?spid=277745858,kỷ chén thờ,Đồ thờ cúng,7,yên,Yên thảo mộc official,Nhà Cửa - Đời Sống,I.Thông tin sản phẩm Bát Hương Bát Nhang Thảo Mộc Bằng Sứ Cao Cấp Cao 5cm Size VừaXuất xứ: Việt NamChất liệu: Sứ Cao Cấp (vân rạn đẹp mắt) Kích thước: Chiều cao 4.8cm x chiều ngang 8.5cmQuà tặng kèm: ...
263252787,Án thờ mít hàng đẹp,14000000,0.0,0,OEM,,https://tiki.vn/an-tho-mit-hang-dep-p263252787.html?spid=278542743,kỷ chén thờ,Đồ thờ cúng,7,OEM,MỘC CHÂM,Root,     ...
263251831,Phản thờ gỗ gụ,23200000,0.0,0,OEM,,https://tiki.vn/phan-tho-go-gu-p263251831.html?spid=278542717,kỷ chén thờ,Đồ thờ cúng,7,OEM,MỘC CHÂM,Root,       **** NỘI THẤT BÌNH LONG rất hân hạnh được phục vụ quý khách!***   Làm bằng gỗ gụ tự nhiên   ...
263190262,Án thờ gỗ gụ giá thật,13000000,0.0,0,OEM,,https://tiki.vn/an-tho-go-gu-gia-that-p263190262.html?spid=278542546,kỷ chén thờ,Đồ thờ cúng,7,OEM,MỘC CHÂM,Root,       Chỉ giao hàng khu vực miền bắc.   ...
263189968,Án gian thờ bàn thờ tủ thờ gỗ hương giá thật,35000000,0.0,0,OEM,,https://tiki.vn/an-gian-tho-ban-tho-tu-tho-go-huong-gia-that-p263189968.html?spid=278542331,kỷ chén thờ,Đồ thờ cúng,7,OEM,MỘC CHÂM,Root,"       -Giao hàng tận nơi, thanh toán khi đã kiểm tra và nhận hàng   -Miễn phí vận chuyển   -Bảo hành 5 năm.   ----------------------//   ..."
263167014,Bàn thờ và cúng cơm gỗ mít,10204000,0.0,0,OEM,,https://tiki.vn/ban-tho-va-cung-com-go-mit-p263167014.html?spid=278542896,kỷ chén thờ,Đồ thờ cúng,7,OEM,MỘC CHÂM,Root,     ...
263188644,thờ tủ thờ gỗ mít,5890000,0.0,0,OEM,,https://tiki.vn/tho-tu-tho-go-mi-t-p263188644.html?spid=278542776,kỷ chén thờ,Đồ thờ cúng,7,OEM,MỘC CHÂM,Root,     ...
263252629,"Sập Thờ,Ban Thờ",46000000,0.0,0,OEM,,https://tiki.vn/sap-tho-ban-tho-p263252629.html?spid=278542872,kỷ chén thờ,Đồ thờ cúng,8,OEM,MỘC CHÂM,Root,       Sập thờ tứ linh. Gỗ gụ 100%   Chân vuông 25cm. Kích thước Dài 2m17 Rộng 1m07 Cao 1m27.   Đ/c Cao Xá. Cao Dương. Thanh Oai. Hà Nội   ...
263252412,Tủ thờ gỗ gụ,8640000,0.0,0,OEM,,https://tiki.vn/tu-tho-go-gu-p263252412.html?spid=278542734,kỷ chén thờ,Đồ thờ cúng,8,OEM,MỘC CHÂM,Root,       **** NỘI THẤT BÌNH LONG rất hân hạnh được phục vụ quý khách!***   Tủ thờ gỗ gụ tự nhiên 100%   ...
263251426,bộ án thờ gỗ mít,17000000,0.0,0,OEM,,https://tiki.vn/bo-an-tho-go-mit-p263251426.html?spid=278542486,kỷ chén thờ,Đồ thờ cúng,8,OEM,MỘC CHÂM,Root,"       **** NỘI THẤT BÌNH LONG rất hân hạnh được phục vụ quý khách!***   Xưởng sản xuất đồ gỗ giới thiệu sản phẩm Bàn thờ triện đặc gỗ gụ đủ kích thước   - Hàng có sẵn, được kiểm tra mộc trước k..."
263251429,bộ án thờ gỗ mít,17000000,0.0,0,OEM,,https://tiki.vn/bo-an-tho-go-mit-p263251429.html?spid=278543203,kỷ chén thờ,Đồ thờ cúng,8,OEM,MỘC CHÂM,Root,"       Xưởng sản xuất đồ gỗ giới thiệu sản phẩm Bàn thờ triện đặc gỗ gụ đủ kích thước   - Hàng có sẵn, được kiểm tra mộc trước khi hoàn thiện, còn nhiều mẫu khác, xin mời khách đến tham quan   G..."
263188930,tu thờ ...,3900000,0.0,0,OEM,,https://tiki.vn/tu-tho-p263188930.html?spid=278542598,kỷ chén thờ,Đồ thờ cúng,8,OEM,MỘC CHÂM,Root,     ...
263192493,Sập thờ gỗ gụ,30000000,0.0,0,OEM,,https://tiki.vn/sap-tho-go-gu-p263192493.html?spid=278542570,kỷ chén thờ,Đồ thờ cúng,8,OEM,MỘC CHÂM,Root,     ...
263173046,Sập thờ gỗ gụ,24800000,0.0,0,OEM,,https://tiki.vn/sap-tho-go-gu-p263173046.html?spid=278542284,kỷ chén thờ,Đồ thờ cúng,8,OEM,MỘC CHÂM,Root,     ...
263254000,Sập thờ gỗ gụ,20000000,0.0,0,OEM,,https://tiki.vn/sap-tho-go-gu-p263254000.html?spid=278542830,kỷ chén thờ,Đồ thờ cúng,8,OEM,MỘC CHÂM,Root,"       Làng nghề truyền thống Cao Dương là một trong những nơi sản xuất đồ thờ, tượng phật, hàng đầu tại Việt Nam.   Sản phẩm của chúng tôi gồm:TƯỢNG PHẬT NỘI THẤT ĐÌNH CHÙA, Đồ thờ Cao Dương, Li..."
263167670,Sập thờ gỗ gụ,29800000,0.0,0,OEM,,https://tiki.vn/sap-tho-go-gu-p263167670.html?spid=278542870,kỷ chén thờ,Đồ thờ cúng,8,OEM,MỘC CHÂM,Root,     ...
263167168,Sập thờ gỗ gụ,25000000,0.0,0,OEM,,https://tiki.vn/sap-tho-go-gu-p263167168.html?spid=278542899,kỷ chén thờ,Đồ thờ cúng,8,OEM,MỘC CHÂM,Root,"       Sập thờ gỗ gụ - sập thờ Tứ Linh   Trong mỗi gia đình Việt hiện nay, không thể thiếu được bàn thờ hay sập thờ gia tiên. Đây đã trở thành một nét đẹp văn hóa không thể thiếu đối với người Vi..."
89421149,Bộ đồ thờ men rạn vẽ rồng phượng gốm sứ Bát Tràng,2150000,0.0,0,Bát Tràng,,https://tiki.vn/bo-do-tho-men-ran-ve-rong-phuong-gom-su-bat-trang-p89421149.html?spid=89421155,kỷ chén thờ,Đồ thờ cúng,9,Bát Tràng,Gốm sứ Gia Hưng Bát tràng,Root,       Bộ đồ thờ gồm:   01 bát hương phi 18   02 bát hương phi 16   1 tam cấp ghỗ   6 bát thờ   Bộ kỷ 3 chén   03 chóe thờ   1 ống cắm hương   1 lọ hoa thờ   10 đôi đũa thờ   1 mâm bồng ...
45122076,Bộ đồ thờ men rong cổ Bát Tràng (LAXRS05),3420000,0.0,0,Bát Tràng Việt Nam,,https://tiki.vn/bo-do-tho-men-rong-co-bat-trang-laxrs05-p45122076.html?spid=51070163,kỷ chén thờ,Đồ thờ cúng,9,Bát Tràng Việt Nam,Bát Tràng Ceramic,Nhà Cửa - Đời Sống,"Bộ sản phẩm bao gồm:1 Bát hương vẽ rồng trầu Φ201 Chân đế bát hương bằng gỗ1 Mâm bồng Φ25 vẽ rồng, phượng2 Lọ lục bình vẽ hoa sen 45 cm1 Lọ huệ 23cm vẽ sen1 Ống hương 22cm vẽ sen2 Chóe 16cm vẽ ..."
14647200,"Đèn thờ dầu men cổ khắc nổi hoa Phù Dung gốm sứ Bát Tràng (đèn dầu, đèn thờ cúng)",450000,2.0,1,Bát Tràng,,https://tiki.vn/den-tho-dau-men-co-khac-noi-hoa-phu-dung-gom-su-bat-trang-den-dau-den-tho-cung-p14647200.html?spid=57656597,kỷ chén thờ,Đồ thờ cúng,9,Bát Tràng,Cửa hàng gốm sứ Bát Tràng,Nhà Cửa - Đời Sống,Sản phẩm: Đèn thờ dầu men cổ khắc nổi hoa Phù Dung chính hãng gốm sứ Bát Tràng - dòng sản phẩm đèn thờ cúng cao cấpChất liệu: gốm sứ cao cấp Bát TràngHọa tiết: khắc nổi nghệ thuật tinh xảoThiết kế:...
263261617,Sập Thờ Gỗ Gụ,31500000,0.0,0,OEM,,https://tiki.vn/sap-tho-go-gu-p263261617.html?spid=278543072,kỷ chén thờ,Đồ thờ cúng,9,OEM,MỘC CHÂM,Root,       Hàng Có Các Loại Kích Thước và giá :   Chân 16 - 1m97 x 97 = 25.000.000   Chân 18 - 2m17 x 1m07 = 26.000.000   Chân 20 - 2m17 x 1m07 = 28.000.000   Chân 22 - 2m17 x 1m07 = 31.000.000  ...
263185590,Sập Thờ Gỗ Gụ,35000000,0.0,0,OEM,,https://tiki.vn/sap-tho-go-gu-p263185590.html?spid=278542357,kỷ chén thờ,Đồ thờ cúng,9,OEM,MỘC CHÂM,Root,       Hàng Có Các Loại Kích Thước và giá :   Chân 16 - 1m97 x 97 = 25.000.000   Chân 18 - 2m17 x 1m07 = 26.000.000   Chân 20 - 2m17 x 1m07 = 28.000.000   Chân 22 - 2m17 x 1m07 = 31.000.000  ...
263251041,Sập Thờ Gỗ Gụ,28800000,0.0,0,OEM,,https://tiki.vn/sap-tho-go-gu-p263251041.html?spid=278542901,kỷ chén thờ,Đồ thờ cúng,9,OEM,MỘC CHÂM,Root,"       **** NỘI THẤT BÌNH LONG rất hân hạnh được phục vụ quý khách!***   Sập thờ gỗ, Án gian thờ gỗ, Án Gian gỗ   Giá Bán Chưa Đã Gồm Sơn Pu Hoàn Thiện.   ~~~ Miễn phí giao hàng bán kính 30km ~..."
186168173,Bát gà bát thuyền gốm Bát Tràng đựng gà cúng trang trí ban thờ cao cấp,435000,0.0,0,Gốm Sứ Bát Tràng,,https://tiki.vn/bat-ga-bat-thuyen-gom-bat-trang-dung-ga-cung-trang-tri-ban-tho-cao-cap-p186168173.html?spid=195775580,kỷ chén thờ,Đồ thờ cúng,9,Gốm Sứ Bát Tràng,Cửa hàng gốm sứ Bát Tràng,Chén,"  Bát gà bát thuyền gốm Bát Tràng đựng gà cúng trang trí ban thờ cao cấp   - Bát gà bát thuyền gốm Bát Tràng gồm: 1 Bát như trên hình   - Kích thước: cao 11cm, miệng bát dài 31cm, rộng 17cm   - Ch..."
33546459,"Bộ đồ thờ sứ men trắng ( TR16 ) cho ban thờ treo tường, cỡ nhỏ 81×48cm",700000,0.0,0,Bát Tràng Việt Nam,,https://tiki.vn/bo-do-tho-su-men-trang-tr16-cho-ban-tho-treo-tuong-co-nho-81-48cm-p33546459.html?spid=53736889,kỷ chén thờ,Đồ thờ cúng,9,Bát Tràng Việt Nam,Bát Tràng Ceramic,Nhà Cửa - Đời Sống,"Bộ đồ thờ sứ men trắng ( TR16 ) phù hợp với ban tho treo tuong cỡ nhỏ 81×48cm, ban thờ thần tàiBộ sản phẩm bao gồm:1 bát hương vẽ rồng Φ161 Chân đế bát hương bằng gỗ1 mâm bồng Φ221 Chân nến cao1..."
263255110,án thờ gỗ gụ,22000000,0.0,0,OEM,,https://tiki.vn/an-tho-go-gu-p263255110.html?spid=278543070,kỷ chén thờ,Đồ thờ cúng,9,OEM,MỘC CHÂM,Root,"       Xưởng sản xuất đồ gỗ giới thiệu sản phẩm Bàn thờ triện đặc gỗ gụ đủ kích thước   - Hàng có sẵn, được kiểm tra mộc trước khi hoàn thiện, còn nhiều mẫu khác, xin mời khách đến tham quan   G..."
263255373,án thờ gỗ gụ,17000000,0.0,0,OEM,,https://tiki.vn/an-tho-go-gu-p263255373.html?spid=278543115,kỷ chén thờ,Đồ thờ cúng,9,OEM,MỘC CHÂM,Root,"       Xưởng sản xuất đồ gỗ giới thiệu sản phẩm Bàn thờ triện đặc gỗ gụ đủ kích thước   - Hàng có sẵn, được kiểm tra mộc trước khi hoàn thiện, còn nhiều mẫu khác, xin mời khách đến tham quan   G..."
91274273,"Bộ đồ thờ men rạn cổ,ban treo 81cm",950000,0.0,0,Bát Tràng,,https://tiki.vn/product-p91274273.html?spid=93270210,kỷ chén thờ,Đồ thờ cúng,10,Bát Tràng,Cửa hàng gốm sứ Bát Tràng,Vật phẩm phong thủy khác,"       Thông tin sản phẩm:   Tên sản phẩm: Bộ đồ thờ   Chất men: rạn cổ   Hoạ tiết: vẽ Sen, rồng   Kích thước phù hợp ban treo/thần linh: 81cm.   Chi tiết:   2 lọ sen: H24cm   1 Mâm bồng ph..."
169473904,Đôi lọ lục bình thờ men rạn đắp công đào nổi h32cm gốm sứ Bát Tràng,1100000,0.0,0,Bát Tràng,,https://tiki.vn/doi-lo-luc-binh-tho-men-ran-dap-cong-dao-noi-h32cm-gom-su-bat-trang-p169473904.html?spid=175647466,kỷ chén thờ,Đồ thờ cúng,10,Bát Tràng,Cửa hàng gốm sứ Bát Tràng,Vật dụng trang trí,"Đôi lọ lục bình thờ men rạn đắp công đào nổi h32cm gốm sứ Bát Tràng,lọ cao 32cm,hoạ tiết công đào đắp sắc nét ..."
263253461,án thờ gỗ gụ,15000000,0.0,0,OEM,,https://tiki.vn/an-tho-go-gu-p263253461.html?spid=278543221,kỷ chén thờ,Đồ thờ cúng,10,OEM,MỘC CHÂM,Root,"       án thờ gỗ gụ   mẫu trên ảnh quý khách vui lòng chọn mẫu và inbox cho shop ak   hàng nhà em 100% gỗ gụ không dính rác, không pha gỗ   làm theo kích thước theo yêu cầu quý khách   kích th..."
263248259,án thờ gỗ gụ,12000000,0.0,0,OEM,,https://tiki.vn/an-tho-go-gu-p263248259.html?spid=278542597,kỷ chén thờ,Đồ thờ cúng,10,OEM,MỘC CHÂM,Root,"       **** NỘI THẤT BÌNH LONG rất hân hạnh được phục vụ quý khách!***   án thờ gỗ gụ   mẫu trên ảnh quý khách vui lòng chọn mẫu và inbox cho shop ak   hàng nhà em 100% gỗ gụ không dính rác, kh..."
92091749,Bộ đồ ăn thờ cúng thắp hương gia tiên,550000,0.0,0,Bát Tràng,,https://tiki.vn/bo-do-an-tho-cung-thap-huong-gia-tien-p92091749.html?spid=109426992,kỷ chén thờ,Đồ thờ cúng,10,Bát Tràng,Cửa hàng gốm sứ Bát Tràng,Root,"       Ngày rằm, mồng một , ngày giỗ chạp, ngày tất niên , ngày tết không thể thiếu được mâm cơm cúng ông bà tổ tiên & thần linh thổ địa . Để bày tỏ lòng tôn kính với chư vị thần linh , chư vị..."
20845110,ấm chén men lam lã vọng - bát tràng,225000,0.0,0,Bát Tràng,,https://tiki.vn/am-chen-men-lam-la-vong-bat-trang-p20845110.html?spid=59519872,kỷ chén thờ,Đồ thờ cúng,10,Bát Tràng,Cửa hàng gốm sứ Bát Tràng,Bình trà,ấm chén hồng lã vọngẤm cao 12 rộng 17Lót ấm rộng 12Chén cao 4 rộng 7...
263253166,Bộ án thờ cúng cơm gỗ thông Đức,6700000,0.0,0,OEM,,https://tiki.vn/bo-an-tho-cung-com-go-thong-duc-p263253166.html?spid=278542698,kỷ chén thờ,Đồ thờ cúng,10,OEM,MỘC CHÂM,Root,       Miễn phí giao hàng.   Được phép kiểm hàng khi nhận.   ...
263253881,Bộ án thờ cúng cơm gỗ thông Đức,6700000,0.0,0,OEM,,https://tiki.vn/bo-an-tho-cung-com-go-thong-duc-p263253881.html?spid=278543230,kỷ chén thờ,Đồ thờ cúng,10,OEM,MỘC CHÂM,Root,       • Được phép kiểm tra khi nhận hàng.   ...
185970461,"Bát vàng, Bát Tụ Tài, Bát Tụ Bảo đá ngọc cẩm thạch vàng Hút Tài, Hút Lộc, Chiêu tài lộc trang trí bàn thờ ông thần tài thổ địa - Cao 24 cm",1920000,0.0,0,Thủy Hòa,,https://tiki.vn/bat-vang-bat-tu-tai-bat-tu-bao-da-ngoc-cam-thach-vang-hut-tai-hut-loc-chieu-tai-nap-loc-trang-tri-ban-tho-ong-than-tai-tho-dia-cao-18cm-p185970461.html?spid=185970462,kỷ chén thờ,Đồ thờ cúng,10,Thủy Hòa,Thủy Hòa Official Store,Vật phẩm phong thủy khác,"Chất liệu: Đá ngọc cẩm thạch vàngKích thước: Bát Cao 24 cm, Đường kính bát 22 cmBao gồm: 1 Bát tụ bảo, 5 thỏi ngân lượng nhỏ và 1 thỏi ngân lượng lớn kèm đá thạch anh vụn trong bátKhối lượng: 7,9 kgB..."
142002664,"Cặp hũ đựng muối, gạo thờ cúng đặt bàn thờ ông thần tài thổ địa đá cẩm thạch trắng",230000,0.0,0,Thủy Hòa,,https://tiki.vn/bo-2-ly-nuoc-tho-cung-ong-than-tai-tho-dia-da-cam-thach-trang-p142002664.html?spid=142002665,kỷ chén thờ,Đồ thờ cúng,10,Thủy Hòa,Thủy Hòa Official Store,Phụ kiện thờ cúng,"Kích thước: Cao 11cm; Đường kính 7cmKhối lượng: 1,35 kgChất liệu: Đá cẩm thạch trắng..."
