id,name,price,rating,review_count,brand,seller,url,kw,group,page,brand_detail,seller_detail,categories,short_description
78486795,"Máy lên dây đàn Joyo JT-01 -  JOYO tunner JT-01 ( dùng cho guitar, ukulele, violin) - Hàng chính hãng",89000,4.2,5,Joyo,,https://tiki.vn/may-len-day-dan-joyo-jt-01-joyo-tunner-jt-01-dung-cho-guitar-ukulele-violin-hang-chinh-hang-p78486795.html?spid=78486796,phụ kiện đàn,Nhạc cụ,10,Joyo,Thăng Long Music,Nhà Cửa - Đời Sống,"- Máy lên dây (tuner) điện tử có màn hình hiển thị trợ giúp cho người chơi guitar lên dây đàn nhanh chóng và chính xác.- Tự động mở khi để máy đứng,tự động tắt khi để máy nằm.- Nguồn cấp: Pin 3V (C..."
90119083,"Bộ dây đàn Guitar Classic/ Classical Guitar String Set - Alice AC106/ A106 - Clear Nylon Plain String, Silver Plated Copper Alloy Winding - Hàng chính hãng",35000,4.5,17,Alice,,https://tiki.vn/bo-day-dan-guitar-classic-classical-guitar-string-set-alice-ac106-a106-clear-nylon-plain-string-silver-plated-copper-alloy-winding-hang-chinh-hang-p90119083.html?spid=98127882,phụ kiện đàn,Nhạc cụ,10,Alice,Guitar MinMusic,Dây đàn,"Bộ dây đàn guitar classic cao cấp Alice A106 - Hàng nguyên hộp - Hàng chính hãngGiữa rất nhiều dây guitar, có thể sẽ rất khó để lựa chọn loại dây nào phù hợp nhất với chiếc đàn guitar. Chọn đúng loạ..."
984008,Bộ Dây Đàn Violin Alice A708,250000,4.7,9,Alice,,https://tiki.vn/bo-day-dan-violin-alice-a708-p984008.html?spid=984334,phụ kiện đàn,Nhạc cụ,10,Alice,Tiến Mạnh Music,Dây đàn,"   Bộ Dây Đàn Violin Alice A708  được chế tác bằng kỹ thuật hiện đại, đảm bảo độ căng theo tiêu chuẩn của hãng Alice, giúp người chơi kiểm soát tốt từng nốt nhạc khi trình diễn.  Sản phẩm gồm 5 dây có..."
1066912,Máy Lên Dây Đàn Guitar Stagg CTU-C5BK,220000,5.0,3,Stagg,,https://tiki.vn/may-len-day-dan-guitar-staggctu-c5bk-p1066912.html?spid=1077082,phụ kiện đàn,Nhạc cụ,10,Stagg,Sol.g,"Máy lên dây, tuner","Máy Lên Dây Đàn Guitar Stagg CTU-C5BK có độ chính xác cao, được nhiều nghệ sĩ tin dùng.Thiết kể nhỏ gọn, dễ di chuyển và m..."
9944916,Bộ ngựa lược đàn bằng xương Vines cho đàn guitar acoustic,110000,4.7,7,Vines,,https://tiki.vn/bo-ngua-luoc-dan-bang-xuong-vines-cho-dan-guitar-acoustic-p9944916.html?spid=9944917,phụ kiện đàn,Nhạc cụ,10,Vines,Sol.g,Nhà Cửa - Đời Sống,"Chất liệu xương động vật cứng cáp, bền bỉNgựa lược đàn guitar acoustic được làm từ vật liệu hữu cơ, xương ở đây thường được lấy từ xương trâu, xương bò. Kết cấu vững chắc từ mặt phân tử, cứng tạo nên ..."
