id,name,price,rating,review_count,brand,seller,url,kw,group,page,brand_detail,seller_detail,categories,short_description
178472170,COMBO đèn tường - phòng khách - phòng ngủ- cầu thang ,300000,0.0,0,HH HA HIEP LIGHTING,,https://tiki.vn/combo-den-tuong-phong-khach-phong-ngu-cau-thang-thinhphat-p178472170.html?spid=178472172,phụ kiện phòng ngủ,Đồ dùng phòng ngủ,5,HH HA HIEP LIGHTING,ĐÈN TRANG TRÍ HÀ HIỆP,Root,"  Combo đèn tường   chất liệu: Hợp kim mạ + chóa thủy tinh   Kích thước: 31*15cm   Thân đèn làm từ kim loại sơn tĩnh điện mạ vàng cao cấp không bay màu   Chóa đèn làm từ thủy tinh trong, dày dặn,..."
96743744,BỘ KỆ TREO TƯỜNG PHÒNG KHÁCH - KỆ GỖ LÕI XANH CHỐNG ẨM + PHỤ KIỆN LẮP ĐẶT,515000,0.0,0,Nội Thất Lắp Ráp VIENDONGADV,,https://tiki.vn/bo-ke-treo-tuong-pho-ng-kha-ch-ke-go-lo-i-xanh-cho-ng-a-m-phu-kie-n-la-p-dat-p96743744.html?spid=96743774,phụ kiện phòng ngủ,Đồ dùng phòng ngủ,5,Nội Thất Lắp Ráp VIENDONGADV,Nội thất lắp ráp Viễn Đông,Kệ & Tủ phòng khách,BỘ KỆ TREO TƯỜNG PHÒNG KHÁCH Gỗ MDF Lõi Xanh Chống ẨmBộ bao gồm:- Tặng phụ kiện lắp đặt chuyên dụng.- Màu sắc: Trắng đen ( vui lòng nhắn tin cho shop nếu khách muốn đổi sang màu ...
278226146,KHÔNG VIỀN 1mx1.8m Chiếu Ngủ Văn Phòng Cao Cấp Cá Nhân Chiếu Cách Nhiệt Thảm Ngủ Trưa Tấm Lót Đa Năng Du Lịch Dã Ngoại,98000,0.0,0,LuckyJQR,,https://tiki.vn/chieu-ngu-van-phong-cao-cap-ca-nhan-chieu-cach-nhiet-tham-ngu-trua-tam-lot-da-nang-du-lich-da-ngoai-p278226146.html?spid=278226147,phụ kiện phòng ngủ,Đồ dùng phòng ngủ,5,LuckyJQR,OM LUCKY WAHIK,Chiếu ngủ văn phòng,"Mô tả sản phẩmChiếu ngủ văn phòng cao cấp Chất liệu nhựa 2 lớp: lớp mút và lớp bạc êm ái Gọn nhẹ, dễ dàng mang theo khi đi dã ngoại, văn phòng Xếp gọn và vệ sinh dễ dàng Cho giấc ngủ trưa ngon, k..."
278067839,"Đồ Dùng Phòng Ngủ -  Màn Mùng Chụp Rút Dây - Mùng Chụp Em Bé Voan In Bông Đẹp , Gấp gọn",129000,0.0,0,LYNUSAN,,https://tiki.vn/do-dung-phong-ngu-man-mung-chup-rut-day-mung-chup-em-be-voan-in-bong-dep-gap-gon-p278067839.html?spid=278067840,phụ kiện phòng ngủ,Đồ dùng phòng ngủ,6,LYNUSAN,CORAN STORE,Phụ kiện phòng ngủ khác,"-Đồ Dùng Phòng Ngủ - Màn Mùng Chụp Rút Dây - Mùng Chụp Em Bé Voan In Bông Đẹp , Gấp gọn-Kích thước khi gấp gọn: 90 cm-Chất liệu màn:  Ren, khung sắt-Kích thước :   129cm  X  80 cm.  X  60 cm.-Màu ..."
199957798,"Đèn LED Neon Trang Trí KUNBE Treo Tường Decor Phòng Làm Việc, Phòng Ngủ, Sự Kiện Đa Dạng Kiểu Dáng Màu Sắc",109000,4.8,4,KUNBE,,https://tiki.vn/den-led-neon-trang-tri-kunbe-treo-tuong-decor-phong-lam-viec-phong-ngu-su-kien-da-dang-kieu-dang-mau-sac-p199957798.html?spid=271103188,phụ kiện phòng ngủ,Đồ dùng phòng ngủ,6,KUNBE,chat24h,Đèn khác,"Đèn LED Neon Trang Trí KUNBE Treo Tường Decor Phòng Làm Việc, Phòng Ngủ, Sự Kiện Đa Dạng Kiểu Dáng 1. THÔNG TIN SẢN PHẨM:- Chất liệu: nhựa PVC Model 005 chống thấm nước- Nguồn điện 3 pin AA + ..."
277540503,Đèn thả phòng ngủ decor phòng khách phòng ngủ SuperVilighting phong cách cổ điển trần bàn ăn bảo hành 24 tháng,529880,0.0,0,SuperVilighting,,https://tiki.vn/den-tha-phong-ngu-decor-phong-khach-phong-ngu-supervilighting-phong-cach-co-dien-tran-ban-an-bao-hanh-24-thang-p277540503.html?spid=277540525,phụ kiện phòng ngủ,Đồ dùng phòng ngủ,6,SuperVilighting,CHIẾU SÁNG SUPERVILIGHTING,Đèn chùm/ Đèn thả trần,Đèn thả phòng ngủ decor phòng khách phòng ngủ SuperVilighting phong cách cổ điển trần bàn ăn bảo hành 24 thángThông Số kỹ thuậtMàu sắc: Thân trắng- Chóp trắngThân trắng- chóp đenThân trắng- chóp...
178478574,"Đèn ốp trần,đèn phòng bé,đèn phòng ngủ DT",1520000,0.0,0,HH HA HIEP LIGHTING,,https://tiki.vn/den-op-tran-den-phong-be-den-phong-ngu-dt-p178478574.html?spid=178478577,phụ kiện phòng ngủ,Đồ dùng phòng ngủ,6,HH HA HIEP LIGHTING,ĐÈN TRANG TRÍ HÀ HIỆP,Đèn ốp trần,"       DT LUXURY   Chất liệu: khung là nhôm trắng ,mặt là mika   Mầu sắc:mầu trắng   Số lượng :01b   Nguồn điện: 220v   Kích thước: fi 50cm   Phong cách: châu âu   Nguồn sáng:tích hợp led n..."
12608591,Bịt mắt ngủ,28000,4.8,34,OEM,,https://tiki.vn/bit-mat-ngu-p12608591.html?spid=12608592,phụ kiện phòng ngủ,Đồ dùng phòng ngủ,6,OEM,AUCOSTA,Phụ kiện phòng ngủ khác,"Dạng phom 3D, vải mềm mịnGiúp che ánh sáng khi nghỉ trưa, nghỉ ngơi khi đang đi xe du lịch, đi công tác,đi máy bayDùng tốt khi nghỉ trưa trong văn phòng - một món đồ tiện ích cho dân công sở ..."
274884670,Phụ Kiện Tiểu Cảnh- 1 miếng thảm cỏ nhân tạo 30cmx30cm Made in Jpan,40000,0.0,0,CONDOR,,https://tiki.vn/phu-kien-tieu-canh-1-mieng-tham-co-nhan-tao-30cmx30cm-made-in-jpan-p274884670.html?spid=274884671,phụ kiện phòng ngủ,Đồ dùng phòng ngủ,6,CONDOR,CLEANAID AKICO,Trang trí nhà cửa khác,PHỤ KIỆN TIỂU CẢNH: kích thước 1 tấm 30cmx30cmX 2cm có mắc cài giúp lắp ghép và tháo ra dễ dàng cho từng diện tích.Thảm cỏ nhân tạo bằng nhựa EVA được nhập khẩu trực tiếp từ Nhật Bản.- Thảm cỏ nhân t...
242673910,Kệ tivi để các phòng khách phòng ngủ giá thật,2800000,0.0,0,OEM,,https://tiki.vn/ke-tivi-de-ca-c-pho-ng-kha-ch-pho-ng-ngu-gia-that-p242673910.html?spid=278550067,phụ kiện phòng ngủ,Đồ dùng phòng ngủ,6,OEM,MỘC CHÂM,Root,     ...
261851248,Kệ tivi để các phòng khách phòng ngủ giá thật,2800000,0.0,0,OEM,,https://tiki.vn/ke-tivi-de-ca-c-pho-ng-kha-ch-pho-ng-ngu-gia-that-p261851248.html?spid=278547857,phụ kiện phòng ngủ,Đồ dùng phòng ngủ,6,OEM,MỘC CHÂM,Root,     ...
110652530,"Máy hỗ trợ giấc ngủ cầm tay Minh House, sạc USB cho người mất ngủ, khó ngủ",285000,4.6,16,Minh House,,https://tiki.vn/may-ho-tro-giac-ngu-cam-tay-minh-house-sac-usb-cho-nguoi-mat-ngu-kho-ngu-p110652530.html?spid=110652534,phụ kiện phòng ngủ,Đồ dùng phòng ngủ,6,Minh House,Minh House,Phụ kiện phòng ngủ khác,"Máy hỗ trợ giấc ngủ cầm tay Minh House, sạc USB cho người mất ngủ, khó ngủMất ngủ LÀ ÁC MỘNG không chỉ ở người già, người có tuổi mà cả với người trẻ. Xã hội ngày càng phát triển, bệnh lý mất ngủ cà..."
59407845,Giá treo tường Wellex WH đủ phụ kiện - WH4108-O,970000,0.0,0,Wellex,,https://tiki.vn/gia-treo-tuong-wellex-wh-du-phu-kien-p59407845.html?spid=275121467,phụ kiện phòng ngủ,Đồ dùng phòng ngủ,6,Wellex,Telovietnam,"Giá, kệ phơi quần áo","Giá treo tường Wellex WH đủ phụ kiện sử dụng đa chức năng như kệ, giàn phơi và mắc treoKhi không cần sử dụng có thể gập lại để tiết kiệm diện tích không gianThanh phơi không gỉ thiết kế thời trang..."
178473322,"Đèn tường - phòng khách, cầu thang, phòng ngủ DTV48",145000,0.0,0,HH HA HIEP LIGHTING,,https://tiki.vn/den-tuong-phong-khach-cau-thang-phong-ngu-dtv48-p178473322.html?spid=178473328,phụ kiện phòng ngủ,Đồ dùng phòng ngủ,7,HH HA HIEP LIGHTING,ĐÈN TRANG TRÍ HÀ HIỆP,Root,"       Nguồn : AC 220V   - Chất liệu : Gỗ, chao sứ cao cấp   - Loại đui : E27   - Không gian thích hợp : trang trí phòng ngủ, cầu thang.   - Bóng: LED 3W   - Màu sắc : Trắng, đen   ..."
155186594,"Hộp Đựng Trang Sức, Phụ Kiện Thiết Kế Hiện Đại - Chọn Màu - Hàng Chính Hãng",257040,5.0,4,PaKaSa,,https://tiki.vn/hop-dung-trang-suc-phu-kien-thiet-ke-hien-dai-chon-mau-hang-chinh-hang-p155186594.html?spid=155186603,phụ kiện phòng ngủ,Đồ dùng phòng ngủ,7,PaKaSa,Phụ Kiện Store 76,Phụ kiện phòng ngủ khác,"Hộp Đựng Trang Sức, Phụ Kiện Thiết Kế Hiện Đại - Chọn Màu - Hàng Chính Hãng Hộp đựng trang sức da pu 17x12x5cm bọc da PU sang trọng, lịch lãm, kiểu dáng classic cổ điển, da PU chống thấm nướcCấu tr..."
87959612,Bộ 6 Hộp Vải Oxford Đựng Đồ Lót Phụ Kiện,142500,4.8,65,OEM,,https://tiki.vn/bo-6-hop-vai-oxford-dung-do-lot-phu-kien-p87959612.html?spid=87959614,phụ kiện phòng ngủ,Đồ dùng phòng ngủ,7,OEM,Ghế Nam Việt,Phụ kiện phòng ngủ khác,"Bộ 6 Hộp Vải Oxford Đựng Đồ Lót Phụ KiệnLà giải pháp cho các vật dụng nhỏ trong gia đình như đồ lót, đồ em bé, mắt kính, khăn, vớMột bộ gồm 2 hộp nhỏ, 2 hộp cỡ vừa, và 2 hộp lớn phù hợp đựng đồ lót, ..."
191644630,Ốp băng đô hoa mũ lưới phụ kiện cưới Giang,120000,0.0,0,OEM,,https://tiki.vn/op-bang-do-hoa-mu-luoi-phu-kien-cuoi-giang-p191644630.html?spid=191644634,phụ kiện phòng ngủ,Đồ dùng phòng ngủ,7,OEM,Phụ kiện cưới Giang,Root,       PHỤ KIỆN CƯỚI GIANG   (cách chợ tân bình 500m )   09.1828.1525 ( Tư vấn trên Web )   ...
178477078,"Đèn tường- Phòng khách, cầu thang, phòng ngủ DT01",250000,0.0,0,HH HA HIEP LIGHTING,,https://tiki.vn/den-tuong-phong-khach-cau-thang-phong-ngu-dt01-p178477078.html?spid=178477091,phụ kiện phòng ngủ,Đồ dùng phòng ngủ,7,HH HA HIEP LIGHTING,ĐÈN TRANG TRÍ HÀ HIỆP,Root,"       Nguồn : AC 220V   - Chất liệu :kim loại sơn tĩnh điện, vải sứ cao cấp   - Loại đui : E27   - Không gian thích hợp : trang trí phòng ngủ, cầu thang.   - Bóng: LED 3W   - Màu sắc : Trắng..."
105798500,Bộ phụ kiện phòng tắm kính cửa mở 90o- SWH-102-Glaze,1450000,0.0,0,Glaze,,https://tiki.vn/bo-phu-kien-phong-tam-kinh-cua-mo-90o-swh-102-glaze-p105798500.html?spid=105798501,phụ kiện phòng ngủ,Đồ dùng phòng ngủ,7,Glaze,GLAZE OFFICIAL STORE,Thiết bị phòng tắm khác,       - Phòng tắm kính được kết hợp giữa phụ kiện cao cấp GLAZE và kính cường lực đem đến một không gian hiện đại và phù hợp với mọi kiến trúc.   - Nhãn hiệu:Glaze   - Mô tả chi tiết   + Phòng...
143226572,Set 6 Tròn Phụ Kiện Kim Loại,19000,0.0,0,Kềm Nhật,,https://tiki.vn/set-6-tron-phu-kien-kim-loai-p143226572.html?spid=143226600,phụ kiện phòng ngủ,Đồ dùng phòng ngủ,7,Kềm Nhật,Kềm Nhật,"Bộ dụng cụ, phụ kiện làm móng","       SET PHỤ KIỆN TRANG TRÍ MÓNG   1. Phụ kiện trang trí móng nghệ thuật này được làm bằng chất liệu hợp kim cao cấp, bền, hình dạng đẹp mắt với bề mặt cắt đẹp, thích hợp cho làm móng nghệ ..."
102758616,Bông tai đá phụ kiện xinh,89000,3.5,4,OEM,,https://tiki.vn/bong-tai-da-phu-kien-xinh-p102758616.html?spid=102758617,phụ kiện phòng ngủ,Đồ dùng phòng ngủ,7,OEM,AUCOSTA,Bông tai,"Chất liệu hợp kim S925, đáMẫu đơn giản dễ phối đồThích hợp với lady sang trọng, người làm văn phòngHãy thêm vào bộ sưu tập của bạn nhé !Sử dụng: Không đeo khi tắmKo tiếp xúc với nước sẽ giúp ..."
194104831,"đèn trần, đèn trang trí, đèn phòng khách, phòng ngủ",2500000,0.0,0,HH HA HIEP LIGHTING,,https://tiki.vn/den-tran-den-trang-tri-den-phong-khach-phong-ngu-p194104831.html?spid=194104835,phụ kiện phòng ngủ,Đồ dùng phòng ngủ,7,HH HA HIEP LIGHTING,ĐÈN TRANG TRÍ HÀ HIỆP,Root,"       Đèn thích hợp trang trí mọi nơi để tạo không gian lung linh, sang trọng.   * Mã sản phẩm:   * Kích thước: fi 900   * Tuổi thọ: 50000h   * Màu ánh sáng: trắng, vàng,trung tính   * Xuất ..."
178477482,"Đèn tường phale tô điểm phòng khách, phòng ngủ DT",792000,0.0,0,HH HA HIEP LIGHTING,,https://tiki.vn/den-tuong-phale-to-diem-phong-khach-phong-ngu-dt-p178477482.html?spid=178477484,phụ kiện phòng ngủ,Đồ dùng phòng ngủ,7,HH HA HIEP LIGHTING,ĐÈN TRANG TRÍ HÀ HIỆP,Root,"       Mô tả sản phẩm   Chất liệu: khung kim khí sơn tĩnh điện mầu vàng,kết phù hợp với thanh phale mầu trắng   Mầu sắc:vàng phối hợp trắng   Số lượng : 01c   Nguồn điện: 220v   Kích thước: f..."
271119843,Mặt Phụ Kiện Sạc 2 Cổng 60W USB A+C I Phụ Kiện Đa Phương Tiện Line8,2189000,0.0,0,Line8,,https://tiki.vn/mat-phu-kien-sac-2-cong-60w-usb-a-c-i-phu-kien-da-phuong-tien-line8-p271119843.html?spid=271119844,phụ kiện phòng ngủ,Đồ dùng phòng ngủ,8,Line8,METAKING LTD,Ổ cắm & công tắc điện,PHỤ KIỆN SẠC 2 CỔNG 60W USB A+C- Được cung cấp theo kích thước thanh ray Line8.- Dễ dàng lắp đặt vào liền lạc và thẩm mỹ.- Toàn bộ dây có thể đấu nối và giấu phía sau thanh ray. ...
249593130,Kệ Tv phòng khách - nội thất phòng khách - nội thất phòng ngủ,6900000,0.0,0,OEM,,https://tiki.vn/ke-tv-phong-khach-noi-that-phong-khach-noi-that-phong-ngu-p249593130.html?spid=278548504,phụ kiện phòng ngủ,Đồ dùng phòng ngủ,8,OEM,MỘC CHÂM,Root,     ...
178480862,"Đèn ốp trần,đèn phòng bé,đèn ốp trần phòng ngủ, đèn trang trí, đèn gắn trần, đèn phòng ngủ DT",1562000,0.0,0,HH HA HIEP LIGHTING,,https://tiki.vn/den-op-tran-den-phong-be-den-op-tran-phong-ngu-den-trang-tri-den-gan-tran-den-phong-ngu-dt-p178480862.html?spid=178480869,phụ kiện phòng ngủ,Đồ dùng phòng ngủ,8,HH HA HIEP LIGHTING,ĐÈN TRANG TRÍ HÀ HIỆP,Đèn ốp trần,"       Đèn trẻ con , đèn trần tô điểm phòng bé từ lâu được biết bao mái ấm mua lắp ráp trong ngôi nhà riêng phòng các bé , đèn vừa giúp sức năng lượng cho căn phòng, vừa giúp cho phòng ở của những..."
178472929,"Đèn ốp trần,đèn phòng bé,đèn ốp trần phòng ngủ, đèn trang trí, đèn gắn trần, đèn phòng ngủ DT",1562000,0.0,0,HH HA HIEP LIGHTING,,https://tiki.vn/den-op-tran-den-phong-be-den-op-tran-phong-ngu-den-trang-tri-den-gan-tran-den-phong-ngu-dt-p178472929.html?spid=178472939,phụ kiện phòng ngủ,Đồ dùng phòng ngủ,8,HH HA HIEP LIGHTING,ĐÈN TRANG TRÍ HÀ HIỆP,Đèn ốp trần,"       Đèn trẻ con , đèn trần tô điểm phòng bé từ lâu được biết bao mái ấm mua lắp ráp trong ngôi nhà riêng phòng các bé , đèn vừa giúp sức năng lượng cho căn phòng, vừa giúp cho phòng ở của những..."
261850404,Kệ Tv phòng khách - nội thất phòng khách - nội thất phòng ngủ,7300000,0.0,0,OEM,,https://tiki.vn/ke-tv-phong-khach-noi-that-phong-khach-noi-that-phong-ngu-p261850404.html?spid=278548084,phụ kiện phòng ngủ,Đồ dùng phòng ngủ,8,OEM,MỘC CHÂM,Root,     ...
242682585,Kệ Tv phòng khách - nội thất phòng khách - nội thất phòng ngủ,8000000,0.0,0,OEM,,https://tiki.vn/ke-tv-phong-khach-noi-that-phong-khach-noi-that-phong-ngu-p242682585.html?spid=278549761,phụ kiện phòng ngủ,Đồ dùng phòng ngủ,8,OEM,MỘC CHÂM,Root,     ...
194105209,"Đèn tường trang trí phòng khách, phòng ngủ bằng đồng",500000,0.0,0,HH HA HIEP LIGHTING,,https://tiki.vn/den-tuong-trang-tri-phong-khach-phong-ngu-bang-dong-p194105209.html?spid=194105235,phụ kiện phòng ngủ,Đồ dùng phòng ngủ,8,HH HA HIEP LIGHTING,ĐÈN TRANG TRÍ HÀ HIỆP,Root,       Chất liệu: đồng   Mầu sắc: vàng   Số lượng :01c   Nguồn điện: 220v   Kích thước: d210   Phong cách: châu âu   Nguồn sáng: bao gồm bóng   Bảo hành :24 tháng   Xuất xứ: nhập khẩu bởi ...
242671875,Kệ Tv phòng khách - nội thất phòng khách - nội thất phòng ngủ,7300000,0.0,0,OEM,,https://tiki.vn/ke-tv-phong-khach-noi-that-phong-khach-noi-that-phong-ngu-p242671875.html?spid=278551205,phụ kiện phòng ngủ,Đồ dùng phòng ngủ,8,OEM,MỘC CHÂM,Root,     ...
261854848,Kệ Tv phòng khách - nội thất phòng khách - nội thất phòng ngủ,6900000,0.0,0,OEM,,https://tiki.vn/ke-tv-phong-khach-noi-that-phong-khach-noi-that-phong-ngu-p261854848.html?spid=278547989,phụ kiện phòng ngủ,Đồ dùng phòng ngủ,8,OEM,MỘC CHÂM,Root,     ...
261813121,Combo phụ kiện ghế xoay,100000,5.0,1,HG FURNITURE H i G,,https://tiki.vn/combo-phu-kien-ghe-xoay-p261813121.html?spid=261813125,phụ kiện phòng ngủ,Đồ dùng phòng ngủ,8,HG FURNITURE H i G,AnAn house,Root,"       Phụ kiện ghế xoay Bao gồm:   1. Bánh xe ghế: 5c- chất liệu: nhựa PU di chuyển đa mặt sàn, xoay 360 độ   2. Chân ghế: 1c - Chất liệu: Sắt mạ crom chống rỉ: chịu lực tốt, cân bằng chắc khỏe..."
212261767,"Móc gỗ treo quần áo gắn tường nhiều kích thước màu nâu rustic, kệ treo đồ trang trí Anzzar, decor phòng ngủ,móc treo quần áo, phụ kiện, giá gỗ treo quần áo",120000,4.6,5,anzzar,,https://tiki.vn/moc-go-treo-quan-ao-gan-tuong-nhieu-kich-thuoc-mau-nau-rustic-ke-treo-do-trang-tri-anzzar-decor-phong-ngu-moc-treo-quan-ao-phu-kien-gia-go-treo-quan-ao-p212261767.html?spid=212261769,phụ kiện phòng ngủ,Đồ dùng phòng ngủ,9,anzzar,ANZZAR HOME,Móc treo,"Móc gỗ treo quần áo gắn tường nhiều kích thước màu nâu Rustic, kệ treo đồ trang trí Anzzar, decor phòng ngủ,móc treo quần áo, phụ kiện, giá gỗ treo quần áoTHÔNG SỐ:- Kích thước:+ size 1: 2 móc-20cm..."
217727016,"Móc gỗ màu nâu rustic treo quần áo gắn tường, kệ treo đồ trang trí Anzzar, decor phòng ngủ,móc treo quần áo, phụ kiện, giá gỗ treo quần áo-02",80000,5.0,3,anzzar,,https://tiki.vn/moc-go-mau-nau-rustic-treo-quan-ao-gan-tuong-ke-treo-do-trang-tri-anzzar-decor-phong-ngu-moc-treo-quan-ao-phu-kien-gia-go-treo-quan-ao-02-p217727016.html?spid=217727018,phụ kiện phòng ngủ,Đồ dùng phòng ngủ,9,anzzar,ANZZAR HOME,Móc treo,"Móc gỗ treo quần áo gắn tường, kệ treo đồ trang trí Anzzar, decor phòng ngủ,móc treo quần áo, phụ kiện, giá gỗ treo quần áo THÔNG SỐ: - Kích thước: + size 1: 3 móc 30cmx5.5cm+ size 2: ..."
54016336,Phụ Kiện Cài Áo TiTiShop - Mã PKV138,124000,0.0,0,Titishop,,https://tiki.vn/phu-kien-cai-ao-titishop-ma-pkv138-p54016336.html?spid=54016337,phụ kiện phòng ngủ,Đồ dùng phòng ngủ,9,Titishop,TitiShop,Cài Áo,"Chất liệu:Sang trọng hợp thời trangMầu sắc sang đẹp Phù hợp sử dụng cài áo, áo vest , áo sơ mi trang phục cho đáng mày râu ..."
278295383,Phụ kiện kệ giỏ đựng đồ nhà bếp,300000,0.0,0,HIVE,,https://tiki.vn/phu-kien-ke-gio-dung-do-nha-bep-p278295383.html?spid=278295384,phụ kiện phòng ngủ,Đồ dùng phòng ngủ,9,HIVE,HiVE Store,Kệ nhà bếp,"Tên sản phẩm: RỔ ĐỰNG NƯỚC GIẶT HiVE INOX 304Thương hiệu: HiVEXuất xứ: Việt NamChất liệu: Inox 304 cao cấp, chống gỉ tuyệt đốiKích thước: W30 x D16 x H23 cmMàu sắc: Inox bạc sáng bóngƯu điểm nổi bật+ ..."
191646872,Nơ cao cấp chú rể phụ kiện cưới,96000,0.0,0,OEM,,https://tiki.vn/no-cao-cap-chu-re-phu-kien-cuoi-p191646872.html?spid=191646888,phụ kiện phòng ngủ,Đồ dùng phòng ngủ,9,OEM,Phụ kiện cưới Giang,Root,       PHỤ KIỆN CƯỚI GIANG   Nơ cổ nam đính đá chất liệu vải đá   thích hợp chụp hình đi bar   Địa chỉ cửa hàng 2 : 36 Năm Châu Phường 11 Quận Tân Bình   ...
275875109,"Bịt Mắt Ngủ Kèm Bịt Tai Miếng Bịt Mắt 3D Khi Ngủ, Mặt Nạ Ngủ Nam Nữ Thoáng Khí Và Mềm Mại, Nhỏ Gọn, Tiện Dụng Ngủ Trưa Văn Phòng. Giao Mầu Ngẫu Nhiên",98000,4.8,4,LuckyJQR,,https://tiki.vn/man-p275875109.html?spid=275875110,phụ kiện phòng ngủ,Đồ dùng phòng ngủ,9,LuckyJQR,OM LUCKY WAHIK,Phụ kiện phòng ngủ khác,"Mô tả sản phẩmBộ Bịt Mắt Ngủ 3D + Bịt Tai làm từ chất liệu xốp, mềm mịn, đàn hồi tốt, thấm hút mồ hôi tốt, chất liệu này rất nhẹ tạo cảm giác như không mang gì khi sử dụng, dễ dàng làm sạch và p..."
275906216,Chiếu Ngủ Văn Phòng Cao Cấp Cá Nhân Chiếu Cách Nhiệt Thảm Ngủ Trưa Tấm Lót Đa Năng Du Lịch Dã Ngoại,107800,5.0,4,LuckyJQR,,https://tiki.vn/chieu-ngu-van-phong-cao-cap-ca-nhan-chieu-cach-nhiet-tham-ngu-trua-tam-lot-da-nang-du-lich-da-ngoai-p275906216.html?spid=275906217,phụ kiện phòng ngủ,Đồ dùng phòng ngủ,9,LuckyJQR,OM LUCKY WAHIK,Chiếu ngủ văn phòng,"Mô tả sản phẩmChiếu ngủ văn phòng cao cấp Chất liệu nhựa 2 lớp: lớp mút và lớp bạc êm ái Gọn nhẹ, dễ dàng mang theo khi đi dã ngoại, văn phòng Xếp gọn và vệ sinh dễ dàng Cho giấc ngủ trưa ngon, k..."
191645219,Băng đô tuần lộc phụ kiện giáng sinh 2019,30000,0.0,0,OEM,,https://tiki.vn/bang-do-tuan-loc-phu-kien-giang-sinh-2019-p191645219.html?spid=191645229,phụ kiện phòng ngủ,Đồ dùng phòng ngủ,9,OEM,Phụ kiện cưới Giang,Root,"       Bên cạnh những bộ trang phục Noel xinh xắn thì không thể thiếu được một chiếc cài tóc hay băng đô xinh xắn dễ thương trên mái tóc của các bé gái, bạn gái. các cô gái trẻ   Nhân dịp giáng s..."
191646663,Băng đô phụ kiện tóc thời trang nữ 2022 Giangpkc TP HCM Phụ kiện cưới Giang,45000,0.0,0,OEM,,https://tiki.vn/bang-do-phu-kien-toc-thoi-trang-nu-2022-giangpkc-tp-hcm-phu-kien-cuoi-giang-p191646663.html?spid=191646668,phụ kiện phòng ngủ,Đồ dùng phòng ngủ,9,OEM,Phụ kiện cưới Giang,Root,"        Là khách hàng của Giangpkc, chúng tôi cam kết bạn được :   - Đảm bảo chất lượng 100%. - Hoàn tiền ngay nếu sản phẩm không giống với mô tả.   - Đảm bảo về chất lượng ảnh thật 100% không q..."
277448944,Chiếu Ngủ Văn Phòng Cao Cấp Cá Nhân Chiếu Cách Nhiệt Thảm Ngủ Trưa Tấm Lót Đa Năng Du Lịch Dã Ngoại - PaKaSa ( Viền màu ngẫu nhiên),69690,5.0,1,PaKaSa,,https://tiki.vn/chieu-ngu-van-phong-cao-cap-ca-nhan-chieu-cach-nhiet-tham-ngu-trua-tam-lot-da-nang-du-lich-da-ngoai-pakasa-vien-mau-ngau-nhien-p277448944.html?spid=277448946,phụ kiện phòng ngủ,Đồ dùng phòng ngủ,9,PaKaSa,Phụ Kiện Store 76,Chiếu ngủ văn phòng,"– Chiếu bạc dùng để lót nằm nghỉ trưa tại văn phòng hoặc dùng làm tấm lót ngồi khi đi cắm trại,…– Chiếu gấp gọn nhẹ, dễ lau chùi– Bề mặt sáng bóng– Màu sắc: màu bạc– Có 2loại:  + Chiếu bạc đơn (0m6x1m..."
275088891,"Thảm ngủ trưa văn phòng, tấm lót, chiếu ngủ trưa văn phòng đa năng EMA",61000,4.5,4,Ema,,https://tiki.vn/tham-ngu-trua-van-phong-tam-lot-chieu-ngu-trua-van-phong-da-nang-ema-p275088891.html?spid=275088893,phụ kiện phòng ngủ,Đồ dùng phòng ngủ,10,Ema,Gối nêm Hi-Sleep Store,Chiếu ngủ văn phòng,"ĐẶC ĐIỂM NỔI BẬT- Bề mặt tráng nhôm cách nhiệt tốt cho sức khỏe của người sử dụng, ruột EPE cách nhiệt tốt, nằm không lạnh lưng- Không thấm nước, dễ lau sạch bằng khăn ướt, không cần giặt- Sử dụn..."
277438575,"Màn dây Funu có cửa, cao cấp, chống muỗi an toàn, giúp giấc ngủ ngon - Hàng chính hãng",180000,4.8,41,FuNu,,https://tiki.vn/man-day-funu-co-cua-cao-cap-chong-muoi-an-toan-giup-giac-ngu-ngon-hang-chinh-hang-p277438575.html?spid=277438580,phụ kiện phòng ngủ,Đồ dùng phòng ngủ,10,FuNu,Moonuji,Nhà Cửa - Đời Sống,"Màn dây Funu ngăn muỗi lẻn vào tuyệt đối, mắt màn nhỏ ngăn côn trùng bò vào trong✅Thông tin sản phẩm:- Tên sản phẩm: màn tuyn- Xuất xứ: Việt Nam- Quy cách sản phẩm:- Chất liệu: 100% polyester..."
191639525,Phụ kiện cưới Giang - phụ kiện cô dâu - mút độn ngực loại tốt được các tiệm áo cưới tin dùng,70000,0.0,0,OEM,,https://tiki.vn/phu-kien-cuoi-giang-phu-kien-co-dau-mut-don-nguc-loai-tot-duoc-cac-tiem-ao-cuoi-tin-dung-p191639525.html?spid=191639535,phụ kiện phòng ngủ,Đồ dùng phòng ngủ,10,OEM,Phụ kiện cưới Giang,Root,     ...
89421151,"Bộ phụ kiện nhà tắm bằng gốm sứ Bát Tràng: bình xịt, ống cắm bàn chải, khay đựng xà phòng",320000,0.0,0,Bát Tràng,,https://tiki.vn/bo-phu-kien-nha-tam-bang-gom-su-bat-trang-binh-xit-ong-cam-ban-chai-khay-dung-xa-phong-p89421151.html?spid=89421161,phụ kiện phòng ngủ,Đồ dùng phòng ngủ,10,Bát Tràng,Gốm sứ Gia Hưng Bát tràng,Nhà Cửa - Đời Sống,       .**********************************************************      ...
191640783,Nơ chú rể chấm bi phụ kiện cưới,45000,0.0,0,OEM,,https://tiki.vn/no-chu-re-cham-bi-phu-kien-cuoi-p191640783.html?spid=191640791,phụ kiện phòng ngủ,Đồ dùng phòng ngủ,10,OEM,Phụ kiện cưới Giang,Root,       PHỤ KIỆN CƯỚI GIANG   (Cách chợ Tân Bình 500m)   Địa chỉ cửa hàng 2 : 36 Năm Châu Phường 11 Quận Tân Bình   09.1828.1525 ( Tư vấn trên Web )   ...
