id,name,price,rating,review_count,brand,seller,url,kw,group,page,brand_detail,seller_detail,categories,short_description
52907240,Set Bộ 10 Khăn Lau Đa Năng,15000,0.0,0,OEM,,https://tiki.vn/set-bo-10-khan-lau-da-nang-p52907240.html?spid=67031570,miếng dán đa năng,Dụng cụ & Thiết bị tiện ích,9,OEM,Smarthome29,Nhà Cửa - Đời Sống,"Kích thước : 16cm x 28cmĐược dệt từ 100% sợi cotton cao cấpChất liệu cao cấp siêu thắm nướcNhuộm màu hoàn nguyên không phai, không độc hạiDễ dàng giặt và nhanh khôKhông gây mùi ẩm mốcMàu sắc phố..."
275920541,"Keo Nước Hồ Dán Đa Năng X2000 Siêu Dính Keo Dán Đa Năng Dán Gỗ, Dán Giày Dép, Dán Thủy Tính, Dán Nhựa, Dán Gốm Sứ",29000,0.0,0,fofaHome,,https://tiki.vn/keo-nuoc-x2000-sieu-dinh-keo-dan-da-nang-dan-go-dan-giay-dep-dan-thuy-tinh-dan-nhua-dan-gom-su-p275920541.html?spid=275920593,miếng dán đa năng,Dụng cụ & Thiết bị tiện ích,9,fofaHome,Hadu Home,Dụng cụ sửa chữa nhà cửa khác,"- Keo x2000 đa năng siêu dính- Keo x2000 vo cùng đa năng dán được mọi vật liệu như dán gỗ, dán giày dép, dán thủy tính, dán nhựa, dán gốm sứ, ngoài ra keo có thể dán kết hợp tốt các loại vật liệu nh..."
277878759,Thanh Treo đa năng đồ dán tường E23153 3 móc 6 móc cong chịu lực di chuyển tiện lợi không khoan tường,90000,0.0,0,JIDOSA,,https://tiki.vn/thanh-treo-da-nang-do-dan-tuong-e23153-3-moc-6-moc-cong-chiu-luc-di-chuyen-tien-loi-khong-khoan-tuong-p277878759.html?spid=277878848,miếng dán đa năng,Dụng cụ & Thiết bị tiện ích,10,JIDOSA,JIDOSA STORE,"Giá, móc, cây treo","THÔNG TIN SẢN PHẨM :- Kích thước:+ 3 MÓC: 50 x 180 mm+ 6 MÓC: 50 x 400 mm- Mã Sản Phẩm E23153 (Thanh treo 3 móc), E23154 (Thanh treo 6 móc)• Chất liệu: ABS cao cấp- Phân Loại:• Móc Cong: Treo N..."
23141824,Kéo Đa Năng Thông Minh ,76000,0.0,0,OEM,,https://tiki.vn/keo-da-nang-thong-minh-p23141824.html?spid=67035521,miếng dán đa năng,Dụng cụ & Thiết bị tiện ích,10,OEM,Smarthome29,Kéo các loại,"Kéo Đa Năng Thông Minh thay thế cho cả dao và thớt giúp bạn thái cắt tất cả các thực phẩm như rau, củ, quả, thịt, cá️ Sản phẩm tiết kiệm tối đa thời gian cho công việc bếp núc. ️ Cắt nhanh hơn, rửa ..."
275432530,Keo Dán Silicone đa dụng 20ml - BOSTIK,68600,0.0,0,Bostik,,https://tiki.vn/keo-dan-silicone-da-dung-20ml-bostik-p275432530.html?spid=275432531,miếng dán đa năng,Dụng cụ & Thiết bị tiện ích,10,Bostik,ESPP,Keo - Băng keo chuyên dụng,"Mô Tả Sản PhẩmKeo Dán Silicone đa dụng 20ml - BOSTIK silicone trung tính với mô đun thấp, đóng rắn bằng cách phản ứng với độ ẩm để tạo thành một miếng đệm cao su đàn hồi bền.Sản phẩm có khả năng kh..."
19771693,Khăn lau đa năng siêu thấm hút,56000,5.0,1,OEM,,https://tiki.vn/khan-lau-da-nang-sieu-tham-hut-p19771693.html?spid=67034658,miếng dán đa năng,Dụng cụ & Thiết bị tiện ích,10,OEM,Smarthome29,Khăn/ Giấy ăn,"Siêu thấm, siêu hút nước, có khả năng thấm nước gấp 7 lần trọng lượng của nó.Khô nhanh gấp 3 lần các khăn lau thông thường khácHiệu quả hơn, lau sạch hơn gấp 4 lần so với loại khác, lau sạch hầu như..."
58546285,"Keo dán giày, gỗ, nhựa đa năng siêu dính 3M Scotch 3M-3M-AD113",25000,4.5,5,3M,,https://tiki.vn/keo-dan-giay-go-nhua-da-nang-sieu-dinh-3m-scotch-3m-3m-ad113-p58546285.html?spid=173539734,miếng dán đa năng,Dụng cụ & Thiết bị tiện ích,10,3M,De Blur Auto,Keo dán đa năng,"Giới thiệu Keo dán giày, gỗ, nhựa đa năng siêu dính 3M Scotch AD113Nhờ những đặc tính siêu dính, siêu chắc, khô nhanh nên Keo dán giày, gỗ, nhựa đa năng siêu dính 3M Scotch AD113 thường dùng dán đồ t..."
276295491,Giá Để Điện Thoại Dán Tường Đa Năng Đựng Điều Khiển Remote Màu Trắng Keo Siêu Dính Tiện Lợi,35000,5.0,1,GUANG MING,,https://tiki.vn/gia-de-dien-thoai-dan-tuong-da-nang-dung-dieu-khien-remote-mau-trang-keo-sieu-dinh-tien-loi-p276295491.html?spid=276295493,miếng dán đa năng,Dụng cụ & Thiết bị tiện ích,10,GUANG MING,Hamart Gia Dụng Tiện Lợi,"Giá, móc, cây treo","️ Kệ Dán Tường Để Điện Thoại Điều Khiển Hamart là giải pháp lưu trữ điện thoại, điều khiển remote trên cùng 1 khu vực, tiện lợi tìm kiếm & sử dụng, đồng thời là giải pháp cho vấn đề bể vỡ điện tho..."
27920769,Giỏ Treo Đựng Đồ Đạc Quần Áo Đa Năng Dán Tường,67000,5.0,2,OEM,,https://tiki.vn/gio-treo-dung-do-dac-quan-ao-da-nang-dan-tuong-p27920769.html?spid=108906556,miếng dán đa năng,Dụng cụ & Thiết bị tiện ích,10,OEM,Smarthome29,Giỏ đựng quần áo,"Giỏ treo gấp gọn đựng đồ đa năng để quần áo giặt là được làm từ chất liệu Plastic bóng cao cấp, bền đẹp, không mùi và có khả năng chịu được nhiệt độ cao, rất cứng cáp, không dễ bị nứt vỡ, thủng tron..."
204052191,"Miếng dán nâng ngực cho nữ - cuộn dán ngực vô hình tiện dụng tạo được nhiều kiểu nâng ngực đa năng, Miếng dán nâng ngực cho nữ - cuộn dán ngực vô hình tiện dụng tạo được nhiều kiểu nâng ngực đa năng, Băng keo dán ngực, nâng ngực quyến rũ - Hãng dododios",47000,0.0,0,dododios,,https://tiki.vn/mieng-dan-nang-nguc-cho-nu-cuon-dan-nguc-vo-hinh-tien-dung-tao-duoc-nhieu-kieu-nang-nguc-da-nang-mieng-dan-nang-nguc-cho-nu-cuon-dan-nguc-vo-hinh-tien-dung-tao-duoc-nhieu-kieu-nang-nguc-da-nang-bang-keo-dan-nguc-nang-nguc-quyen-ru-hang-dododios-p204052191.html?spid=204052193,miếng dán đa năng,Dụng cụ & Thiết bị tiện ích,10,dododios,DoDoDios Official Store,Áo nâng ngực,"Miếng dán nâng ngực cho nữ - cuộn dán ngực vô hình tiện dụng tạo được nhiều kiểu nâng ngực đa năng, Miếng dán nâng ngực cho nữ - cuộn dán ngực vô hình tiện dụng tạo được nhiều kiểu nâng ngực đa năng, ..."
114573429,Miếng dán tủ lạnh nhiều mẫu,40000,5.0,2,Thuận Dung,,https://tiki.vn/mieng-dan-tu-lanh-nhieu-mau-p114573429.html?spid=114573441,miếng dán đa năng,Dụng cụ & Thiết bị tiện ích,10,Thuận Dung,VẬT TƯ ĐIỆN LẠNH THUẬN DUNG,Decal dán kính,"ĐIỆN LẠNH THUẬN DUNG Cam KếtTất cả sản phẩm đều được test và đóng gói nghiêm chỉnh trước khi chuyển cho kháchHình sản phẩm là hình thật Shop chụp 100% không sao chép hình trên mạng , không lấy hìn..."
44936859,"Móc Dán Tường Đa Năng Treo Cây Lau Nhà, Chổi, Đồ Dùng Phòng Tắm MDTCLN001",31000,0.0,0,OEM,,https://tiki.vn/moc-dan-tuong-da-nang-treo-cay-lau-nha-choi-do-dung-phong-tam-mdtcln001-p44936859.html?spid=108913154,miếng dán đa năng,Dụng cụ & Thiết bị tiện ích,10,OEM,Smarthome29,Miếng dán đa năng,"Móc Dán Tường Đa Năng Treo Cây Lau Nhà, Chổi, Đồ Dùng Phòng TắmSản phẩm được thiết kế theo tiêu chuẩn Châu Âu, phù hợp với hầu hết các dụng cụ vệ sinh như: chổi, cây lau nhà, cây cọ bồn cầu, Với móc ..."
