id,name,price,rating,review_count,brand,seller,url,kw,group,page,brand_detail,seller_detail,categories,short_description
122521450,Sách - Organ mùa xuân (TB 2021),54000,0.0,0,,,https://tiki.vn/sach-organ-mua-xuan-tb-2021-p122521450.html?spid=122521452,"đàn organ, keyboard",Nhạc cụ,9,,info book,Truyện ngắn - Tản văn - Tạp Văn Nước Ngoài,"       Tác giả: Kazumi Yumoto   Dịch giả: Nguyễn Hà Trang   Nhà xuất bản: Văn học   Số trang: 181   Kích thước: 14 x 20,5cm   Ngày phát hành: 07-2021   Kiriki Tomomi bước vào kỳ nghỉ xuân tr..."
203846570,Sách - Organ Mùa Xuân,53900,0.0,0,,,https://tiki.vn/sach-organ-mua-xuan-p203846570.html?spid=263751515,"đàn organ, keyboard",Nhạc cụ,9,,HỆ THỐNG NHÀ SÁCH ABC,Tiểu Thuyết Phương Đông,  Công ty phát hành: Nhã Nam   Nhà xuất bản: Nhà Xuất Bản Văn Học   Tác giả :Kazumi Yumoto   Ngày xuất bản: 06-2016   Kích thước :14 x 20.5 cm   Loại bìa :Bìa mềm   Số trang: 181   GIỚI THIỆU ...
270715912,Học Đàn Piano (Tái bản năm 2022),125000,0.0,0,,,https://tiki.vn/hoc-dan-piano-tai-ban-nam-2022-p270715912.html?spid=270715913,"đàn organ, keyboard",Nhạc cụ,10,,Nhà Sách Phương Nam,Sách tiếng Việt,    Học Đàn Piano (Tái bản năm 2022)      Nhà xuất bản : Nhà Xuất Bản Hồng Đức.  Công ty phát hành : Văn Lang.  Tác giả : Brad Hill.  Kích thước : 19 x 27 cm.  Số trang : 207.  Ngày xuất bả...
14072907,Đàn Piano điện YAMAHA YDP-164R,29400000,0.0,0,Yamaha,,https://tiki.vn/dan-piano-dien-yamaha-ydp-164r-p14072907.html?spid=49310994,"đàn organ, keyboard",Nhạc cụ,10,Yamaha,NHẠC CỤ LÊ MINH,Đàn piano điện tử,"Thông Tin Chi Tiết Về Đàn Piano Yamaha YDP-164YAMAHA YDP 144 -Một trải nghiệm tuyệt vời từ một cây đàn piano gia đình nhỏ gọnĐắm chìm trong âm thanh bạn tạo ra, cho dù hoàn toàn là cho vui hoặc k..."
270488390,[Có Loa] Akai MPK Mini Play MK3 25 Phím - Midi Compact Keyboard Controller Bàn Phím Sáng Tác Sản Xuất Âm Nhạc Producer Hàng Chính Hãng,3599000,0.0,0,AKAI,,https://tiki.vn/akai-mpk-mini-play-midi-compact-keyboard-controller-ban-phim-sang-tac-san-xuat-am-nhac-producer-hang-chinh-hang-kem-mong-gay-dreammaker-p270488390.html?spid=270488391,"đàn organ, keyboard",Nhạc cụ,10,AKAI,Tiến Mạnh Music,Nhà Cửa - Đời Sống,"THÔNG SỐ KỸ THUẬT:- Thiết kế nhỏ gọn, dễ dàng mang theo để biểu diễn- Số phím: 25 phím- Nâng cấp bệ phím đàn thế hệ 2 và dải âm loa tích hợp- Tích hợp module với 128 tiếng và drum kit- Pin hoạt động..."
206673055,Nektar Impact LX61+ - Keyboard Nhạc Điện Tử- Hàng chính hãng,6410000,0.0,0,Nektar,,https://tiki.vn/nektar-impact-lx61-keyboard-nhac-dien-tu-hang-chinh-hang-p206673055.html?spid=206673056,"đàn organ, keyboard",Nhạc cụ,10,Nektar,Binaishop,Nhà Cửa - Đời Sống,"Keyboard MIDI Nektar Impact LX61+ là phiên bản nâng cấp với nhiều tính năng hơn so với GX61. Sử dụng kết nối USB không cần nguồn cấp, được trang bị cổng sustain pedal (6.35 mm), 8 núm chiết áp, 9 phím..."
94728051,Đồ chơi âm nhạc cho bé Đàn organ điện tử cho bé kèm Mic  thu âm và bàn DJ  Winfun 2068 phát triển năng khiếu âm nhạc,1390000,5.0,2,Winfun,,https://tiki.vn/do-choi-am-nhac-cho-be-dan-organ-dien-tu-cho-be-kem-mic-thu-am-va-ban-dj-winfun-2068-phat-trien-nang-khieu-am-nhac-tang-do-choi-tam-p94728051.html?spid=94728055,"đàn organ, keyboard",Nhạc cụ,10,Winfun,4Babies,Nhạc cụ đàn Piano,Đàn ORGAN đi kèm một micro với khả năng thu âm làm bé càng thêm thích thú khi nghe lại những bản nhạc mình đã trình bày.ĐÀN ORGAN WINFUN LÀ SẢN PHẨM ĐƯỢC CÁC BÉ YÊU THÍCH NHẤT*Đặc điểm nổi bật của s...
102739257,Nektar LX49+ Midi Keyboard Controller 61 Phím Cảm ứng lực Bàn phím sáng tác - Sản xuất âm nhạc Producer LX49 Hàng Chính Hãng - Kèm Móng Gẩy DreamMaker,4899000,5.0,2,Nektar,,https://tiki.vn/nektar-lx49-midi-keyboard-controller-61-phim-cam-ung-luc-ban-phim-sang-tac-san-xuat-am-nhac-producer-lx49-hang-chinh-hang-kem-mong-gay-dreammaker-p102739257.html?spid=102739258,"đàn organ, keyboard",Nhạc cụ,10,Nektar,Tiến Mạnh Music,Nhà Cửa - Đời Sống,"THÔNG SỐ KỸ THUẬT:- Bàn Phím: 49 Phím- 8 Hyper-Sensitive Backlit Pads cho phép gán lệnh các nhạc cụ đặc biệt như Trống, Kèn...- 8 performance pads (Green/Orange/Yellow/Red) có thể dễ dàng gán lện..."
102817852,Nektar LX88+ Midi Keyboard Controller 88 Phím Cảm ứng lực Bàn phím sáng tác - Sản xuất âm nhạc Producer LX88 Hàng Chính Hãng - Kèm Móng Gẩy DreamMaker,8999000,5.0,1,Nektar,,https://tiki.vn/nektar-lx88-midi-keyboard-controller-88-phim-cam-ung-luc-ban-phim-sang-tac-san-xuat-am-nhac-producer-lx88-hang-chinh-hang-kem-mong-gay-dreammaker-p102817852.html?spid=102817853,"đàn organ, keyboard",Nhạc cụ,10,Nektar,Tiến Mạnh Music,Nhà Cửa - Đời Sống,"THÔNG SỐ KỸ THUẬT:- Bàn Phím: 88 Phím- Điều khiển chuyển cung: Play, Stop, Record, Rewind and Fast Forward- Tính năng chuyển cung nâng cao: Loop on / off, click on / off, Go To Locator and Undo.-..."
206676900,Nektar Impact GX49 - Đàn MIDI Keyboard Controller- Hàng chính hãng,3336000,0.0,0,Nektar,,https://tiki.vn/nektar-impact-gx49-dan-midi-keyboard-controller-hang-chinh-hang-p206676900.html?spid=206676901,"đàn organ, keyboard",Nhạc cụ,10,Nektar,Binaishop,Nhà Cửa - Đời Sống,"TÍNH NĂNG CƠ BẢN- 49 Phím cảm nhận lực full size với tính năng ""Synth Action"".- Tổng cộng 14 phím MIDI có khả năng gán lệnh.- Điều khiển chuyển cung: Play, Stop, Record, Rewind and Fast Forwa..."
101470399,Novation Launchkey Mini MK3 Bàn phím sáng tác - Sản xuất âm nhạc Producer Keyboard Controller for Ableton Live - Kèm Móng Gẩy DreamMaker,2990000,5.0,10,Novation,,https://tiki.vn/novation-launchkey-mini-mk3-ban-phim-sang-tac-san-xuat-am-nhac-producer-keyboard-controller-for-ableton-live-kem-mong-gay-dreammaker-p101470399.html?spid=101470400,"đàn organ, keyboard",Nhạc cụ,10,Novation,Tiến Mạnh Music,Nhà Cửa - Đời Sống,THÔNG SỐ KỸ THUẬT:- Cải tiến độ nảy và cảm ứng lực siêu nhạy giúp cho việc sáng tác tạo giai điệu một cách chính xác vào đúng cung bật âm- Tính năng Pitch và Modulation được thiết kế ở dạng touch...
278358856,"Miếng dán nốt nhạc màu trắng cho đàn organ, piano | Sticker Dán nốt nhạc cho đàn melodica, organ, piano,...",60000,0.0,0,OEM,,https://tiki.vn/mieng-dan-not-nhac-mau-trang-cho-dan-organ-piano-sticker-dan-not-nhac-cho-dan-melodica-organ-piano-p278358856.html?spid=278358857,"đàn organ, keyboard",Nhạc cụ,10,OEM,Guitar MinMusic,Các loại đàn khác,"------ SHOP ĐẢM BẢO ------ Hình ảnh sản phẩm giống hình 100% Chất lượng sản phẩm đúng như mô tả Sản phẩm được kiểm tra kĩ càng, nghiêm ngặt trước khi giao hàng Đóng gói và giao hàng ngay khi nhận được..."
