id,name,price,rating,review_count,brand,seller,url,kw,group,page,brand_detail,seller_detail,categories,short_description
278750149,"Vỉ 9 móc dán tường chịu lực siêu chắc, móc dán tường đa năng chịu nặng tốt",35000,0.0,0,OEM,,https://tiki.vn/vi-9-moc-dan-tuong-chiu-luc-sieu-chac-moc-dan-tuong-da-nang-chiu-nang-tot-p278750149.html?spid=278750151,miếng dán đa năng,Dụng cụ & Thiết bị tiện ích,5,OEM,Siêu Thị Xanh Của Mọi Nhà,"Giá, móc, cây treo"," Vỉ 9 móc dán tường chịu lực siêu chắc, móc dán tường đa năng chịu nặng tốt * Thông tin móc dao thớt:- Chất liệu: Nhựa cao cấp- Màu sắc: trắng., vàng ( giao ngẫu nhiên màu tuỳ lô hàng ) * Đặc đ..."
119007194,"Thanh 4 Móc Treo Dán Tường, Móc Treo Đồ Đa Năng Parroti Handy HD41",39000,4.8,242,Parroti,,https://tiki.vn/thanh-4-moc-treo-dan-tuong-moc-treo-do-da-nang-parroti-handy-hd41-p119007194.html?spid=119007195,miếng dán đa năng,Dụng cụ & Thiết bị tiện ích,5,Parroti,Parroti Store,Miếng dán đa năng,"Thanh 4 Móc treo dán tường đa năng Parroti Handy HD41 là sản phẩm tiện ích giúp cho không gian nhà bạn gọn gàng và ngăn nắp hơn, miếng dán chắc chắn và dính trên mọi loại bề mặt sàn như sàn gạch, sàn..."
278481973,Bộ Sticker Đa Năng - Teenage CTE-064,32700,0.0,0,Teenage,,https://tiki.vn/bo-sticker-da-nang-teenage-cte-064-p278481973.html?spid=278481974,miếng dán đa năng,Dụng cụ & Thiết bị tiện ích,5,Teenage,Nhà sách Fahasa,Quà lưu niệm,    Bộ Sticker Đa Năng - Teenage CTE-064   - Bộ sticker chống nước - giữ màu tốt - Để lau chùi - Độ dính bên trên nhiều vật liệu.   - Chất liệu: Decal nhựa cao cấp   - Cách dùng: Dùng để trang t...
278567371,Sticker Đa Năng - Teenage CTE-065 - Cuisine,32700,0.0,0,Teenage,,https://tiki.vn/sticker-da-nang-teenage-cte-065-cuisine-p278567371.html?spid=278567372,miếng dán đa năng,Dụng cụ & Thiết bị tiện ích,5,Teenage,Nhà sách Fahasa,Quà lưu niệm,    Sticker Đa Năng - Teenage CTE-065 - Cuisine   - Bộ sticker chống nước - giữ màu tốt - Để lau chùi - Độ dính bên trên nhiều vật liệu.   - Chất liệu: Decal nhựa cao cấp   - Cách dùng: Dùng để ...
275872620,"Combo 5 Miếng Dán Thay Thế Cho Các Loại Kệ Góc Dán Tường, Miếng Dán Tường Gài, Móc Dính Tường Dự Phòng Đôi Thần Thánh Chịu Lực Siêu Dính",17850,4.5,2,fofaHome,,https://tiki.vn/combo-5-mieng-dan-thay-the-cho-cac-loai-ke-goc-dan-tuong-mieng-dan-tuong-gai-moc-dinh-tuong-du-phong-doi-than-thanh-chiu-luc-sieu-dinh-p275872620.html?spid=275872621,miếng dán đa năng,Dụng cụ & Thiết bị tiện ích,5,fofaHome,Tổng Kho MB,Miếng dán đa năng,Gia đình bạn có rất nhiều đồ đạc nhưng lại không biết treo ở đâu để tiết kiệm diện tích? Bạn muốn tận dụng mảng trống sau cửa hay tủ để treo nhưng lại ngại việc đóng đinh gây mất mỹ quan? Móc Dán Tườn...
120294693,Keo dán giày dán nhựa dán gỗ dán đa năng siêu dính 3M Scotch AD113 2GRAM,28000,4.5,2,3M,,https://tiki.vn/keo-dan-giay-dan-nhua-dan-go-dan-da-nang-sieu-dinh-3m-scotch-ad113-2gram-p120294693.html?spid=120294695,miếng dán đa năng,Dụng cụ & Thiết bị tiện ích,5,3M,De Blur Auto,Băng keo,"        HOT ! HOT ! THEO DÕI GIAN HÀNG DE' BLUR NGAY GIẢM 5% CHO KHÁCH HÀNG MỚI     ƯU ĐÃI TỐT CHO KHÁCH HÀNG CŨ , INB SHOP ĐỂ BIẾT THÊM    Keo dán đa năng nhanh khô siêu dính 3M Scotch AD113. ..."
277929115,"Băng Dính Dán Mép Tường, Cạnh Bếp Chống Thấm, Siêu Dính (3,2m) - Băng Dán Cạnh Tường Đa Năng",33000,0.0,0,OEM,,https://tiki.vn/bang-dinh-dan-mep-tuong-canh-bep-chong-tham-sieu-dinh-3-2m-bang-dan-canh-tuong-da-nang-p277929115.html?spid=277929116,miếng dán đa năng,Dụng cụ & Thiết bị tiện ích,6,OEM,Gia dụng tiện ích HH,Nội thất,"      Băng Dính Dán Mép Tường, Cạnh Bếp Chống Thấm, Siêu Dính (3,2m) - Băng Dán Cạnh Tường Đa Năng là sản phẩm được thiết kế để dán mép tường, cạnh bếp và các khu vực khác trong nhà. Với kích thước..."
278567311,Sticker Đa Năng - Teenage CTE-067 - Flower,32700,0.0,0,Teenage,,https://tiki.vn/sticker-da-nang-teenage-cte-067-flower-p278567311.html?spid=278567312,miếng dán đa năng,Dụng cụ & Thiết bị tiện ích,6,Teenage,Nhà sách Fahasa,Quà lưu niệm,    Sticker Đa Năng - Teenage CTE-067 - Flower   - Bộ sticker chống nước - giữ màu tốt - Để lau chùi - Độ dính bên trên nhiều vật liệu.   - Chất liệu: Decal nhựa cao cấp   - Cách dùng: Dùng để t...
277867329,"Băng Dính Dán Mép Tường, Cạnh Bếp Chống Thấm, Siêu Dính (3,2m) - Băng Dán Cạnh Tường Đa Năng",29000,0.0,0,OEM,,https://tiki.vn/bang-dinh-dan-mep-tuong-canh-bep-chong-tham-sieu-dinh-3-2m-bang-dan-canh-tuong-da-nang-p277867329.html?spid=277867330,miếng dán đa năng,Dụng cụ & Thiết bị tiện ích,6,OEM,Kho hàng Hạnh Phạm SG,Nội thất,"    Băng Dính Dán Mép Tường, Cạnh Bếp Chống Thấm, Siêu Dính (3,2m) - Băng Dán Cạnh Tường Đa Năng là sản phẩm được thiết kế để dán mép tường, cạnh bếp và các khu vực khác trong nhà. Với kích thước r..."
277914464,"Băng Dính Dán Mép Tường, Cạnh Bếp Chống Thấm, Siêu Dính (3,2m) - Băng Dán Cạnh Tường Đa Năng",33000,0.0,0,OEM,,https://tiki.vn/bang-dinh-dan-mep-tuong-canh-bep-chong-tham-sieu-dinh-3-2m-bang-dan-canh-tuong-da-nang-p277914464.html?spid=277914465,miếng dán đa năng,Dụng cụ & Thiết bị tiện ích,6,OEM,emartgiadung247,Nội thất,"      Băng Dính Dán Mép Tường, Cạnh Bếp Chống Thấm, Siêu Dính (3,2m) - Băng Dán Cạnh Tường Đa Năng là sản phẩm được thiết kế để dán mép tường, cạnh bếp và các khu vực khác trong nhà. Với kích thước..."
277375941,Keo Siêu Dính Đa Năng 20ml,98000,5.0,2,LuckyJQR,,https://tiki.vn/keo-sieu-dinh-da-nang-20ml-p277375941.html?spid=277375942,miếng dán đa năng,Dụng cụ & Thiết bị tiện ích,6,LuckyJQR,OM LUCKY WAHIK,Keo hồ dán đa năng,"Mô tả sản phẩmTÍNH NĂNG SẢN PHẨM:️Chỉ cần 1 lớp keo mỏng đã tạo được mối nối trong suốt siêu chắc và tự nhiên, không tì vết.️Bề mặt keo nhẵn mịn ngay sau khi khô.️Keo dính cực mạnh, dính chắc và s..."
23818057,Keo dán đa năng nhanh khô siêu dính 3M Scotch AD113 2gram,25000,3.8,5,3M,,https://tiki.vn/keo-dan-da-nang-nhanh-kho-sieu-dinh-3m-scotch-ad113-2gram-p23818057.html?spid=173577804,miếng dán đa năng,Dụng cụ & Thiết bị tiện ích,6,3M,De Blur Auto,Keo hồ dán đa năng,"Keo dán đa năng nhanh khô siêu dính 3M Scotch AD113 2gramKeo dán đa năng nhanh khô siêu dính 3M Scotch AD113 2gram là keo dạng gel khô nhanh, không chảy keo khi sử dụng. Rất dễ sử dụng, phù hợp cho g..."
278000196,"Băng Dính Dán Mép Tường, Cạnh Bếp Chống Thấm, Siêu Dính (3,2m) - Băng Dán Cạnh Tường Đa Năng",35000,0.0,0,OEM,,https://tiki.vn/bang-dinh-dan-mep-tuong-canh-bep-chong-tham-sieu-dinh-3-2m-bang-dan-canh-tuong-da-nang-p278000196.html?spid=278000198,miếng dán đa năng,Dụng cụ & Thiết bị tiện ích,6,OEM,gia dụng online 91,Nội thất,"      Băng Dính Dán Mép Tường, Cạnh Bếp Chống Thấm, Siêu Dính (3,2m) - Băng Dán Cạnh Tường Đa Năng là sản phẩm được thiết kế để dán mép tường, cạnh bếp và các khu vực khác trong nhà. Với kích thước..."
278437687,"Băng Dính Dán Mép Tường, Cạnh Bếp Chống Thấm, Siêu Dính (3,2m) - Băng Dán Cạnh Tường Đa Năng",39000,0.0,0,OEM,,https://tiki.vn/bang-dinh-dan-mep-tuong-canh-bep-chong-tham-sieu-dinh-3-2m-bang-dan-canh-tuong-da-nang-p278437687.html?spid=278437689,miếng dán đa năng,Dụng cụ & Thiết bị tiện ích,6,OEM,Bách Hóa Online 897,Nội thất,"      Băng Dính Dán Mép Tường, Cạnh Bếp Chống Thấm, Siêu Dính (3,2m) - Băng Dán Cạnh Tường Đa Năng là sản phẩm được thiết kế để dán mép tường, cạnh bếp và các khu vực khác trong nhà. Với kích thước..."
274374517,"Cuộn Khăn Giấy Đa Năng Lau Bếp, Lau Tay, Cuộn Giấy Đa Năng Có Thể Tái Sử Dụng",9000,0.0,0,fofaHome,,https://tiki.vn/cuon-khan-giay-da-nang-lau-bep-lau-tay-cuon-giay-da-nang-co-the-tai-su-dung-p274374517.html?spid=274374519,miếng dán đa năng,Dụng cụ & Thiết bị tiện ích,6,fofaHome,Tổng Kho MB,Khăn lau bếp,Khăn giấy lau đa năng lau bếp 40 miếng hình thú cute có thể giặt được và tái sử dụng Chất liệu 100% Rayon cực an toàn và ưu việt Thấm hút cực tốt Kích thước: 20 x 20 cm; 25 x 25 cmCuộn Giấy Lau N...
278567367,Sticker Đa Năng - Teenage CTE-073 - Softloop,32700,0.0,0,Teenage,,https://tiki.vn/sticker-da-nang-teenage-cte-073-softloop-p278567367.html?spid=278567368,miếng dán đa năng,Dụng cụ & Thiết bị tiện ích,6,Teenage,Nhà sách Fahasa,Quà lưu niệm,    Sticker Đa Năng - Teenage CTE-073 - Softloop   - Bộ sticker chống nước - giữ màu tốt - Để lau chùi - Độ dính bên trên nhiều vật liệu.   - Chất liệu: Decal nhựa cao cấp   - Cách dùng: Dùng để...
13225553,Móc khóa đa năng 6in1,39000,0.0,0,OEM,,https://tiki.vn/moc-khoa-da-nang-6in1-p13225553.html?spid=278496386,miếng dán đa năng,Dụng cụ & Thiết bị tiện ích,7,OEM,Luckky Shop,Móc Khóa,Cũng tương tự như những sản phẩm công nghệ trước đó về chiếc móc khóa dụng cụ đa năng 10in1. Thì với chiếc móc khóa SWISS + TECH 6in1 này cũng có rất nhiều chức năng kèm theo đó.Bạn có thể tận dụng n...
176660966,"Băng keo vải đa năng chuyên dán che sơn, che chắn, bó ống 47.7mm x 45.7m 3M 1900 - dán bịt kín, dán thanh dài, dán cố định, nhiều màu sắc",86000,4.8,4,3M,,https://tiki.vn/bang-keo-vai-da-nang-chuyen-dan-che-son-che-chan-bo-ong-47-7mm-x-45-7m-3m-1900-dan-bit-kin-dan-thanh-dai-dan-co-dinh-nhieu-mau-sac-p176660966.html?spid=176660970,miếng dán đa năng,Dụng cụ & Thiết bị tiện ích,7,3M,Tốc Độ 247,Băng keo khác,"Giới thiệu Băng keo vải đa năng chuyên dán che sơn, che chắn, bó ống 47.7mm x 45.7m 3M 1900Băng keo vải đa năng chuyên dán che sơn, che chắn, bó ống 47.7mm x 45.7m 3M 1900 được cấu tạo từ màng PE, v..."
22949739,Cuộn Băng Keo Trong Suốt Chống Thấm Nước Dán Siêu Dính Đa Năng Dính Trên Mọi Bề Mặt Cao Cấp,28500,4.7,27,OEM,,https://tiki.vn/cuon-bang-keo-trong-suot-chong-tham-nuoc-dan-sieu-dinh-da-nang-dinh-tren-moi-be-mat-cao-cap-p22949739.html?spid=185711410,miếng dán đa năng,Dụng cụ & Thiết bị tiện ích,7,OEM,ShopAnZ,Keo dán đa năng,Cuộn Băng Keo Trong Suốt Chống Thấm Nước Dán Siêu Dính Đa Năng Dính Trên Mọi Bề MặtCuộn băng dán silicon trong suốt siêu dính có khả năng chịu nhiệt tốt và không bị hư hại khi tiếp xúc trực tiếp vớ...
95410054,"Miếng dán móc treo đa năng Baseus Beetle Vehicle Hook (2 PCS / Set , Aluminum Alloy, 3M Sticker Paste Holder for Car ) - Hàng Chính Hãng",168000,0.0,0,Baseus,,https://tiki.vn/mieng-dan-moc-treo-da-nang-baseus-beetle-vehicle-hook-2-pcs-set-aluminum-alloy-3m-sticker-paste-holder-for-car-hang-chinh-hang-p95410054.html?spid=114410363,miếng dán đa năng,Dụng cụ & Thiết bị tiện ích,7,Baseus,Phụ Kiện Remy,Móc Dán Đỡ Điện Thoại,"Giới thiệu Miếng dán móc treo đa năng Baseus Beetle Vehicle Hook (2 PCS / Set , Sticker Paste Holder for Car and Home)- Thiết kế nhỏ gọn- Sử dụng keo 3M siêu chắc- Phần viền được bo tròn giảm rủi r..."
84650706,Găng tay đa năng Hàn Quốc,36400,0.0,0,OEM,,https://tiki.vn/gang-tay-da-nang-han-quoc-p84650706.html?spid=84650711,miếng dán đa năng,Dụng cụ & Thiết bị tiện ích,7,OEM,QUÝ KHANG MART,Root,       Găng tay đa năng Hàn Quốc   Có thể dùng cho tất cả các mùa.   Lòng bàn tay có các hạt chống trơn (tuyệt đối không bong tróc) nên phù hợp cho các hoạt động nhỏ mà không phải tháo găng tay....
277270074,"Bộ 2 Miếng Mút Dán Khe Cửa Đa Năng Cách Âm, Chắn Gió, Bụi Bẩn Cao Cấp - Hàng Nhập Khẩu",35000,0.0,0,ROGTZ,,https://tiki.vn/bo-2-mieng-mut-dan-khe-cua-da-nang-cach-am-chan-gio-bui-ban-cao-cap-hang-nhap-khau-p277270074.html?spid=277270075,miếng dán đa năng,Dụng cụ & Thiết bị tiện ích,7,ROGTZ,Shop 24719,Bảo vệ nhà cửa khác,"Cuộn mút dán làm khíp khe hở tiện lợi dùng dán các khe cửa bị hở. Giúp chống bụi, phấn hoa, côn trùng... xâm nhập vào nhà qua khe hở.Làm kín các khe hở giữa các cánh cửa, dưới chân cửa, không gây tổn..."
147099820,móc khóa đa năng 20in1,65000,0.0,0,OEM,,https://tiki.vn/moc-khoa-da-nang-20in1-p147099820.html?spid=277936678,miếng dán đa năng,Dụng cụ & Thiết bị tiện ích,7,OEM,STAYTOWN,Móc Khóa,"       Móc khóa đa năng 20in1 với 5 kích cỡ vặn ốc ,3 kích cỡ vít dẹp ,2 kích cỡ vít chữ thập ,nhổ đinh ,khui bia rượu,thước đo ,lưỡi cưa ,dao bén ,móc chìa khóa & móc dây khi leo núi ,mài giũ..."
277568577,"Combo 4 Móc Dán Chữ Nhật Siêu Bền - Móc Nhựa Xoay Đa Năng Dán Tường, Chịu Lực Tố - HÀNG CHÍNH HÃNG MINIIN",29000,0.0,0,MINIIN,,https://tiki.vn/combo-4-moc-dan-chu-nhat-sieu-ben-moc-nhua-xoay-da-nang-dan-tuong-chiu-luc-to-hang-chinh-hang-miniin-p277568577.html?spid=277568578,miếng dán đa năng,Dụng cụ & Thiết bị tiện ích,7,MINIIN,Smarthome29,"Giá, móc, cây treo","Combo 4 Móc Dán Chữ Nhật Siêu Bền - Móc Nhựa Xoay Đa Năng Dán Tường, Chịu Lực TốCombo 4 Móc Dán Chữ Nhật là giải pháp lý tưởng giúp bạn tổ chức không gian sống gọn gàng và tiện lợi hơn. Với..."
53232038,Keo Dán Tường Đa Năng - Trám Vết Nứt Tường Thông Minh,48900,4.6,28,OEM,,https://tiki.vn/keo-dan-tuong-da-nang-tram-vet-nut-tuong-thong-minh-p53232038.html?spid=100293092,miếng dán đa năng,Dụng cụ & Thiết bị tiện ích,7,OEM,Smart Trading,Keo dán đa năng,"Keo Dán Tường Đa Năng - Trám Vết Nứt Tường Thông MinhKích thước: 18 * 7 cmDung tích: 250gAn toàn 100 % cho sức khỏe.Không thấm nước, Giúp tường luôn tươi mới.Bám dính chắc, chịu nước, chống thấm ..."
277384913,Móc Dán Tường Treo Quần Áo Hamart Móc Dán Tường Treo Đồ Đa Năng Acrylic Polyme Dày Siêu Chắc,12500,5.0,1,OEM,,https://tiki.vn/moc-dan-tuong-treo-quan-ao-hamart-moc-dan-tuong-treo-do-da-nang-acrylic-polyme-day-sieu-chac-p277384913.html?spid=277384915,miếng dán đa năng,Dụng cụ & Thiết bị tiện ích,7,OEM,Hamart Gia Dụng Tiện Lợi,"Giá, móc, cây treo","MÔ TẢ SẢN PHẨM:- Móc treo quần áo dán tường Hamart, Móc dán tường treo đồ đa năng keo acrylic polyme tiện dụng- Màu sắc: Vàng, bạc, đồng- Kích thước: 6 * 6 cm ĐẶC ĐIỂM NỔI BẬT:+ Dòng dán tường ..."
90117006,COMBO 3 CUỘN GIẤY DÁN BẾP TRÁNG NHÔM CHỊU NHIỆT ĐA NĂNG ,118000,0.0,0,HBH,,https://tiki.vn/combo-3-cuon-giay-dan-bep-trang-nhom-chiu-nhiet-da-nang-p90117006.html?spid=90117009,miếng dán đa năng,Dụng cụ & Thiết bị tiện ích,8,HBH,Shop HBH247,Giấy dán tường,"       Cuộn Giấy Dán Bếp Tráng Nhôm Cách Nhiệt   - Cuộn giấy dán bếp tráng nhôm cách nhiệt không cần keo khổ lớn dễ dàng dán lên bề mặt tường bếp, gạch men mà không làm bong tróc tường.   - Chất..."
272457843,Băng keo dán chiếu sợi đay tre cói dán mép sửa chiếu chống bung dính chặt chống nước đa năng Legaxi,38000,0.0,0,Legaxi,,https://tiki.vn/bang-keo-dan-chieu-soi-day-tre-coi-dan-mep-sua-chieu-chong-bung-dinh-chat-chong-nuoc-da-nang-legaxi-p272457843.html?spid=272457845,miếng dán đa năng,Dụng cụ & Thiết bị tiện ích,8,Legaxi,Legaxi Official,Băng keo khác,"THÔNG TIN SẢN PHẨM- Kích thước sản phẩm: Chiều rộng 5cm, Dày 0.2mm.- Độ dài: Cuộn 10 mét.- Màu sắc: Nâu vàng.- Cấu tạo: Lớp keo siêu dính + lớp giấy có gân.ƯU ĐIỂMLớp keo siêu chắc, dính trên nhiều b..."
277352416,Băng Keo Dán Băng Dính 2 Mặt Nano Trong Suốt Đa Năng Siêu Dính Chống Nước - Nhiều Kích Cỡ HỘP 20 MIẾNG NHỎ 28x28x1mm,98000,5.0,1,LuckyJQR,,https://tiki.vn/bang-keo-dan-bang-dinh-2-mat-nano-trong-suot-da-nang-sieu-dinh-chong-nuoc-nhieu-kich-co-hop-20-mieng-nho-28x28x1mm-p277352416.html?spid=277352417,miếng dán đa năng,Dụng cụ & Thiết bị tiện ích,8,LuckyJQR,OM LUCKY WAHIK,Băng keo hai mặt,"Mô tả sản phẩmTÍNH NĂNG SẢN PHẨM:️ Độ dính cao độ dính lâu dài và mạnh mẽ.️ Độ trong suốt cao vẫn có thể nhìn thấy rõ ràng sau lớp băng dính, tăng cường lực dính và độ dẻo dai của băng.️ Có khả n..."
179994349,"Keo Đa Năng NAVIVU Dán Vải, Mô Hình, Da, Kim Loại - Keo Trong Suốt, Mềm Dẻo",33250,4.5,53,NAVIVU,,https://tiki.vn/keo-dan-da-nang-navivu-dan-vai-dan-mo-hinh-dan-da-kim-loai-keo-trong-suot-mem-deo-p179994349.html?spid=179994351,miếng dán đa năng,Dụng cụ & Thiết bị tiện ích,8,NAVIVU,Ghế Nam Việt,Keo hồ dán đa năng,"Keo đa năng NAVIVU rất dễ sử dụng, trong suốt mềm dẻo, không bị lem như keo nến hay bị khô cứng như keo 502.Keo có tác dụng dán nhiều loại vật liệu khác nhau, có tác dụng tốt trong việc định hình trư..."
39690823,"Giấy dán tường, dán bếp đa năng chống dầu mỡ, chống nước, tráng nhôm cách nhiệt tiện ích (3 Mét Dài x 0.6 Mét Rộng)",34000,3.6,28,OEM,,https://tiki.vn/giay-dan-tuong-dan-bep-da-nang-chong-dau-mo-chong-nuoc-trang-nhom-cach-nhiet-tien-ich-3-met-dai-x-0-6-met-rong-p39690823.html?spid=278293793,miếng dán đa năng,Dụng cụ & Thiết bị tiện ích,8,OEM,Tổng Kho MB,Giấy dán tường,"Giấy dán tường, dán bếp đa năng chống dầu mỡ, chống nước, tráng nhôm cách nhiệt tiện ích (3 Mét Dài x 0.6 Mét Rộng)Nấu ăn hằng ngày đã trở thành công việc quen thuộc của nhiều chị em phụ nữ thể hiện ..."
62238697,Bộ 3 tẩy rửa đa năng,125000,0.0,0,Hando,,https://tiki.vn/bo-3-tay-rua-da-nang-p62238697.html?spid=62238698,miếng dán đa năng,Dụng cụ & Thiết bị tiện ích,8,Hando,Handomart,Bộ sản phẩm vệ sinh nhà cửa,Bộ sản phẩm bao gồm 3 chai :1.Làm sạch dầu mỡ: là sản phẩm làm sạch dầu mỡ nhà bếp cũng như dầu mỡ công nghiệp cực hiệu quả được sản xuất theo công nghệ phân hủy dầu mỡ của Nga làm biến đổi dầumỡ làm...
277856807,Keo Dán Đa Năng T-8000 110ml,81000,0.0,0,OEM,,https://tiki.vn/keo-dan-da-nang-t-8000-110ml-p277856807.html?spid=277856809,miếng dán đa năng,Dụng cụ & Thiết bị tiện ích,8,OEM,Kho hàng Hạnh Phạm SG,Nội thất,"                   #keodandanang #keo #keodan #danang #dungcutienich  Keo dán đa năng T-8000 110ml chuyên dùng dán ốp lưng điện thoại, keo có đặc tính kết dính mạnh như keo 502 nhưng lại kh..."
277999262,Keo Dán Đa Năng T-8000 110ml,87000,0.0,0,OEM,,https://tiki.vn/keo-dan-da-nang-t-8000-110ml-p277999262.html?spid=277999263,miếng dán đa năng,Dụng cụ & Thiết bị tiện ích,8,OEM,gia dụng online 91,Nội thất,"                            #keodandanang #keo #keodan #danang #dungcutienich   Keo dán đa năng T-8000 110ml chuyên dùng dán ốp lưng điện thoại, keo có đặc tính kết dính mạnh như keo 502 nh..."
277913597,Keo Dán Đa Năng T-8000 110ml,85000,0.0,0,OEM,,https://tiki.vn/keo-dan-da-nang-t-8000-110ml-p277913597.html?spid=277913598,miếng dán đa năng,Dụng cụ & Thiết bị tiện ích,8,OEM,emartgiadung247,Nội thất,"                            #keodandanang #keo #keodan #danang #dungcutienich   Keo dán đa năng T-8000 110ml chuyên dùng dán ốp lưng điện thoại, keo có đặc tính kết dính mạnh như keo 502 nh..."
277928252,Keo Dán Đa Năng T-8000 110ml,85000,0.0,0,OEM,,https://tiki.vn/keo-dan-da-nang-t-8000-110ml-p277928252.html?spid=277928254,miếng dán đa năng,Dụng cụ & Thiết bị tiện ích,8,OEM,Gia dụng tiện ích HH,Nội thất,"                            #keodandanang #keo #keodan #danang #dungcutienich   Keo dán đa năng T-8000 110ml chuyên dùng dán ốp lưng điện thoại, keo có đặc tính kết dính mạnh như keo 502 nh..."
278436801,Keo Dán Đa Năng T-8000 110ml,91000,0.0,0,OEM,,https://tiki.vn/keo-dan-da-nang-t-8000-110ml-p278436801.html?spid=278436802,miếng dán đa năng,Dụng cụ & Thiết bị tiện ích,9,OEM,Bách Hóa Online 897,Nội thất,"                            #keodandanang #keo #keodan #danang #dungcutienich   Keo dán đa năng T-8000 110ml chuyên dùng dán ốp lưng điện thoại, keo có đặc tính kết dính mạnh như keo 502 nh..."
212920958,Cuộn Băng Dán Nâng Ngực Tạo Nhiều Kiểu Đa Năng 5cmx5M,60107,0.0,0,OEM,,https://tiki.vn/cuon-bang-dan-nang-nguc-tao-nhieu-kieu-da-nang-5cmx5m-p212920958.html?spid=278536235,miếng dán đa năng,Dụng cụ & Thiết bị tiện ích,9,OEM,Muasam247,Áo nâng ngực,"MÔ TẢ SẢN PHẨM- Cuộn Băng Dính Dán Ngực quá phù hợp với bạn nào ko thích khó chịu của việc mặc áo ngực, mà thả rông thì ko phải lúc nào cũng phù hợp- Cuộn Băng Dính Dán Ngực có thể tự cắt, thiết kế ..."
275332542,Băng Dính 2 Mặt Đa Năng Keo Trong Suốt Dày 2mm Băng Dính Nano Dán Tường Siêu Dính,19000,5.0,1,GUANG MING,,https://tiki.vn/bang-dinh-2-mat-da-nang-keo-trong-suot-day-2mm-bang-dinh-nano-dan-tuong-sieu-dinh-p275332542.html?spid=275332544,miếng dán đa năng,Dụng cụ & Thiết bị tiện ích,9,GUANG MING,Hamart Gia Dụng Tiện Lợi,Băng keo trong suốt,"️ HÀNG LOẠI TỐT ĐỘ DÀY & KÍCH THƯỚC ĐA DẠNG 1mm 2mm Phục Vụ Đa Dạng Nhu Cầu, TỐI ƯU ĐỘ BÁM DÍNH & CHỊU LỰC - Phân Phối Bởi HamartMÔ TẢ SẢN PHẨM:- Băng Dính 2 Mặt Đa Năng Keo Trong Suốt Ha..."
58903229,300 Miếng Bóc Dán Thông Minh - Khả Năng Sáng Tạo,29100,4.8,5,,,https://tiki.vn/300-mieng-boc-dan-thong-minh-kha-nang-sang-tao-p58903229.html?spid=58903230,miếng dán đa năng,Dụng cụ & Thiết bị tiện ích,9,,Nhà sách Fahasa,Sách tiếng Việt,"3-6 tuổi là giai đoạn bộ não của trẻ phát triển nhanh nhất để có thể nhận thức được màu sắc, hình khối, đồ vật, phát triển mạnh mẽ về cả ngôn ngữ, tư duy logic và khả năng sáng tạ Cũng bởi thế mà trẻ ..."
212323647,300 Miếng Bóc Dán Thông Minh - Khả Năng Sáng Tạo,30000,0.0,0,,,https://tiki.vn/300-mieng-boc-dan-thong-minh-kha-nang-sang-tao-p212323647.html?spid=212323648,miếng dán đa năng,Dụng cụ & Thiết bị tiện ích,9,,Nhà Sách Phương Nam,Root,    300 Miếng Bóc Dán Thông Minh - Khả Năng Sáng Tạo      Nhà xuất bản : Nhà Xuất Bản Thanh Niên.  Công ty phát hành : Đinh Tị Books.  Tác giả : Ưu Ưu Thử.  Kích thước : 17 x 24 cm.  Số tran...
276717420,"Băng Keo Dán Mép Đa Năng 3M Màu Trắng Dán Chống Thấm Bồn Rửa Chén, Mép Cửa, Mép Tường",35000,0.0,0,OEM,,https://tiki.vn/bang-keo-dan-mep-da-nang-3m-mau-trang-dan-chong-tham-bon-rua-chen-mep-cua-mep-tuong-p276717420.html?spid=276717421,miếng dán đa năng,Dụng cụ & Thiết bị tiện ích,9,OEM,MuaMuaOnline,Dụng cụ sửa chữa nhà cửa khác, Ưu điểm nổi bật băng keo mép 3M: Băng keo bằng chất liệc PVC chống thấm nước và chống bám dầu mỡ Băng keo bản to  bao phủ các mép chậu rửa giúp ngăn ngừa thấm nước hiệu quả. Chính giữa băng keo có đư...
277174189,"Keo Đa Năng Dán Vải, Mô Hình, Da, Kim Loại - Keo Trong Suốt, Mềm Dẻo 35ml",98000,4.5,2,LuckyJQR,,https://tiki.vn/x2000-keo-da-nang-dan-vai-mo-hinh-da-kim-loai-keo-trong-suot-mem-deo-35ml-p277174189.html?spid=277174190,miếng dán đa năng,Dụng cụ & Thiết bị tiện ích,9,LuckyJQR,OM LUCKY WAHIK,Keo hồ dán đa năng,"Đặc điểm: trong suốt, độ bám dính cao, bền, nhanh khô, không nhỏ giọt, dễ sử dụng, thân thiện với môi trường nên sản phẩm keo UHU được sử dụng trong rất nhiều lĩnh vực...- Keo trong suốt UHU đa năn..."
151523914,"Dán Nâng Ngực Đa Năng AOLIKES 630 - Định Hình Vòng 1 Tự Nhiên, Dễ Dàng",139000,3.3,3,Aolikes,,https://tiki.vn/bang-dan-dinh-hinh-nguc-boob-tape-aolikes-a-630-p151523914.html?spid=151523923,miếng dán đa năng,Dụng cụ & Thiết bị tiện ích,9,Aolikes,YEBISU VIET NAM,Áo nâng ngực,Băng dán định hình ngực Boob Tape AOLIKES A-630Catelyn Bra Boob Tape Breast​ Lifting Tape Sticker For Nipples Body Booby Tape Fashion Chest Breast Adhesive Push Up Sticky BraBoob Tape còn được gọi #...
