id,name,price,rating,review_count,brand,seller,url,kw,group,page,brand_detail,seller_detail,categories,short_description
263063963,Vật Phẩm Phong Thủy - Ban Phúc Lộc Bình An - Áp Dụng Cho Gia Đình Và Công Sở,86000,5.0,1,,,https://tiki.vn/vat-pham-phong-thuy-ban-phuc-loc-binh-an-ap-dung-cho-gia-dinh-va-cong-so-p263063963.html?spid=263063964,vật phẩm phong thủy,Trang trí nhà cửa,1,,Nhà sách Fahasa,Sách tiếng Việt,"    Vật Phẩm Phong Thủy - Ban Phúc Lộc Bình An - Áp Dụng Cho Gia Đình Và Công Sở   Phong Thuỷ có vai trò rất to lớn trong đời sống con người, được ứng dụng rộng rãi trong mọi lĩnh vực của đời sống..."
120169543,Chóp sừng trâu vật phẩm phong thủy (OTH003) HOT nhất của năm trâu vàng 2021 - giàu sang - phú quý ,150000,5.0,1,HAHANCO,,https://tiki.vn/chop-sung-trau-vat-pham-phong-thuy-hot-nhat-cua-nam-trau-vang-2021-giau-sang-phu-quy-freeship-don-50k-oth003-p120169543.html?spid=159440437,vật phẩm phong thủy,Trang trí nhà cửa,1,HAHANCO,Đức Tuấn Shop,Vật phẩm phong thủy khác,"Từ thời xa xưa đến nay, năm trâu là năm thịnh vượng nhất trong số 12 con giáp, đối với người Việt Nam còn là biểu tượng Trâu vàng, mang ý nghĩa cần cù, chịu khó, hiền lành và khỏe mạnh, sự giàu sang, ..."
67107398,Thước Đồng Phong thuỷ - Ngũ Đế - Lục Đế - Vật Phẩm Hoá Giải Vận Khí,219000,0.0,0,Diệu Tâm,,https://tiki.vn/thuoc-dong-phong-thuy-ngu-de-luc-de-vat-pham-hoa-giai-van-khi-p67107398.html?spid=67107402,vật phẩm phong thủy,Trang trí nhà cửa,1,Diệu Tâm,Shop phật giáo hoa sen,Vật phẩm phong thủy khác,"Thước Đồng Phong Thuỷ- Thước Ngũ Đế, thước Lục Đế được chế tác bằng đồng có gắn năm hoặc sáu đồng tiền tương ứng của các đời vua thịnh nhất dưới thời nhà Thanh là: Thuận Trị, Khang Hy, Ung Chính, Càn..."
75751986,Tượng Heo phong thuỷ mạ vàng size lớn - Vật phẩm phong thuỷ cho người tuổi Hợi,10450000,0.0,0,Golden Gift Việt Nam,,https://tiki.vn/tuong-heo-phong-thuy-ma-vang-size-lon-vat-pham-phong-thuy-cho-nguoi-tuoi-hoi-p75751986.html?spid=75751987,vật phẩm phong thủy,Trang trí nhà cửa,1,Golden Gift Việt Nam,Golden Gift Việt Nam,Linh vật phong thủy,"Tượng Heo phong thủy mạ vàng nằm trong BST Tượng Heo Vàng của Golden Gift Việt Nam, mang đến may mắn, thuận lợi cho cuộc sống, gia đình, sự nghiệp của gia chủ. Đây là quà tặng độc đáo cho Sếp, khách h..."
130171777,Tượng Ngựa Tài Lộc mạ vàng - Vật phẩm phong thuỷ cho người tuổi Ngọ,10450000,0.0,0,Golden Gift Việt Nam,,https://tiki.vn/tuong-ngua-tai-loc-ma-vang-24k-vat-pham-phong-thuy-cho-nguoi-tuoi-ngo-p130171777.html?spid=130171778,vật phẩm phong thủy,Trang trí nhà cửa,1,Golden Gift Việt Nam,Golden Gift Việt Nam,Linh vật phong thủy,"Ngựa tài lộc mạ vàng là quà tặng sang trọng độc đáo, nằm trong bộ 12 linh vật được Golden Gift Việt Nam chế tác đặc biệt để tặng Sếp, doanh nhân.Ý nghĩa Ngựa tài lộc mạ vàngNgựa là loài linh thú man..."
278743496,"Quả Cầu Đá Canxedon 12 Mặt Phong Thủy - Vật Phẩm Hút Vận May, Bình An (tặng chặn giấy thạch anh thô)",1379999,0.0,0,NHA SAN,,https://tiki.vn/qua-cau-da-canxedon-12-mat-phong-thuy-vat-pham-hut-van-may-binh-an-tang-chan-giay-thach-anh-tho-p278743496.html?spid=278743517,vật phẩm phong thủy,Trang trí nhà cửa,1,NHA SAN,NHA SAN,Đá phong thủy,"Quả Cầu Đá Canxedon 12 Mặt Phong Thủy - Vật Phẩm Hút Vận May, Bình AnGIỚI THIỆU SẢN PHẨMQuả Cầu Đá Canxedon 12 Mặt (hay còn gọi là Thập Nhị Diện) là vật phẩm phong thủy hội tụ năng lượng dương cực m..."
278156960,Sách - Vật Phẩm Phong Thủy – Ban phúc lộc bình an áp dụng cho gia đình và công sở,99330,0.0,0,,,https://tiki.vn/sach-vat-pham-phong-thuy-ban-phuc-loc-binh-an-ap-dung-cho-gia-dinh-va-cong-so-p278156960.html?spid=278156961,vật phẩm phong thủy,Trang trí nhà cửa,1,,Bùi Thị Anh,Lĩnh vực khác,"Sách: Vật Phẩm Phong Thủy – Ban phúc lộc bình an áp dụng cho gia đình và công sởVật phẩm phong thủy là những đồ vật được sử dụng với mong muốn mang lại may mắn, tài lộc, sức khỏe, và bình an cho gia ..."
196201529,Chóp sừng bò Châu Phi vật phẩm phong thủy (OTH022) giàu sang/phú quý/may mắn - Bày bàn làm việc hoặc trong nhà,79000,0.0,0,HAHANCO,,https://tiki.vn/chop-sung-bo-chau-phi-vat-pham-phong-thuy-oth022-giau-sang-phu-quy-may-man-bay-ban-lam-viec-hoac-trong-nha-p196201529.html?spid=196515179,vật phẩm phong thủy,Trang trí nhà cửa,1,HAHANCO,Đức Tuấn Shop,Vật phẩm phong thủy khác,"Người Việt dùng hàng Việt, ủng hộ để duy trì nghề và phát triển nghề thủ công tại các vùng quê.Chóp Sừng Vật Phẩm Phong Thủy.Từ thời xa xưa đến nay, năm trâu là năm thịnh vượng nhất trong số 12 co..."
189640918,Hang hốc phong thủy đá thạch anh vàng hút tài lộc,1770000,0.0,0,Thủy Hòa,,https://tiki.vn/hang-hoc-phong-thuy-da-thach-anh-vang-hut-tai-loc-p189640918.html?spid=189640920,vật phẩm phong thủy,Trang trí nhà cửa,1,Thủy Hòa,Thủy Hòa Official Store,Cây phong thủy,"Chất liệu: Đá thạch anh vàngKhối lương: 1,2 kg; 1,82 kg; 2,3 kg; 2,7 kg và 2,75 kgKhối lượng: 20,5 cm; 22 cm; 20 cm; 24 cm và 27 cmTặng kèm đế gỗ theo trụ đáHang đá thạch anh vàng là sự kết tinh của ..."
185889614,Hang ( Hốc ) phong thủy đá thạch anh tím hút tài lộc,3170000,0.0,0,Thủy Hòa,,https://tiki.vn/hang-hoc-phong-thuy-da-thach-anh-tim-hut-tai-loc-p185889614.html?spid=185889618,vật phẩm phong thủy,Trang trí nhà cửa,1,Thủy Hòa,Thủy Hòa Official Store,Cây phong thủy,"Chất liệu: Đá thạch anh tímKhối lương: 2,1 kg; 2,5 kg; 3 kg; 3,2 kg và 3,4 kgKích thước: Cao 19cm; 20cm; 23cm; 25,5cm và 22,5cmHốc thạch anh tím - động thạch anh tím là sự kết tinh của các tinh thể t..."
272330233,Tượng Rồng Vàng Linh Vật Phong Thủy Mai Mắn Tài Lộc_ Hàng chính hãng,99000,0.0,0,Kai Nguyễn,,https://tiki.vn/tuong-rong-vang-linh-vat-phong-thuy-mai-man-tai-loc_-hang-chinh-hang-p272330233.html?spid=272330237,vật phẩm phong thủy,Trang trí nhà cửa,2,Kai Nguyễn,Art H Store,Linh vật phong thủy,"Rồng là con vật có vượng khí nhất trong phong thủy. Rồng có sức mạnh tạo ra tiết khí, mưa giông, ánh sáng từ mặt trời, gió biển và đất đai. Đó chính là nguyên khí của đất trời, là nền tảng của phong ..."
32672705,Quả cầu phong thủy theo mệnh kèm đế,314000,4.7,11,Diệu Tâm,,https://tiki.vn/qua-cau-phong-thuy-theo-menh-kem-de-p32672705.html?spid=32672735,vật phẩm phong thủy,Trang trí nhà cửa,2,Diệu Tâm,Shop phật giáo hoa sen,Đá phong thủy,"Quả cầu phong thủy theo mệnhQuả cầu phong thủy bằng pha lê với nhiều màu sắc như màu xanh lá, màu trong suốt, đen, đỏ, vàng, hồng, xanh dương,ù hợp với từng mệnh.Quả cầu phong thủy màu hồng hợp mệnh..."
137790626,Hang ( Hốc ) phong thủy đá thạch anh tím hút tài lộc,1250000,0.0,0,Thủy Hòa,,https://tiki.vn/hang-hoc-phong-thuy-da-thach-anh-tim-hut-tai-loc-p137790626.html?spid=137790628,vật phẩm phong thủy,Trang trí nhà cửa,2,Thủy Hòa,Thủy Hòa Official Store,Cây phong thủy,"Hợp mệnh Hỏa - ThổChất liệu: Đá thạch anh tímKhối lương: 810g; 830g; 1,07 kg; 1,1 kg và 1,32 kgKích thước: Cao 14,5cm; 14,5cm; 17cm; 18,5cm và 16cmHốc thạch anh tím - động thạch anh tím là sự kết tin..."
278637994,Hồ ly phong thủy - biểu tượng may mắn trong tình yêu,16800000,0.0,0,OEM,,https://tiki.vn/ho-ly-phong-thuy-bieu-tuong-may-man-trong-tinh-yeu-p278637994.html?spid=278637995,vật phẩm phong thủy,Trang trí nhà cửa,2,OEM,Bách bán sách,Vật phẩm phong thủy khác,"Tượng Hồ ly 9 đuôi chạm khắc tinh sảo bằng đá tự nhiên Obsidian. Kích thước 14cm và 16cm Hồ ly phong thủy - biểu tượng may mắn trong tình yêu Tượng Hồ ly có thể mang lại may mắn về tình yêu, hạn..."
276704351,Mô Hình Rắn Phong Thủy Ngũ Sắc Linh Vật Trang Trí_ Hàng Chính Hãng,99000,0.0,0,Kai Nguyễn,,https://tiki.vn/mo-hinh-ran-phong-thuy-ngu-sac-linh-vat-trang-tri_-hang-chinh-hang-p276704351.html?spid=276704353,vật phẩm phong thủy,Trang trí nhà cửa,2,Kai Nguyễn,Art H Store,Vật phẩm phong thủy khác,"Mô hình Rắn phong thủy Rắn là một con vật trong 12 con giáp quan trọng, là biểu tượng cho nước, lửa, sự quyết đoán, là loài vật linh thiêng trong tín ngưỡng.Linh vật này có tác dụng hỗ trợ phong th..."
83394693,"Quả cầu phong thủy đá thạch anh vàng - Đường kính 10,3 cm",715000,0.0,0,Thủy Hòa,,https://tiki.vn/qua-cau-phong-thuy-da-thach-anh-vang-duong-kinh-10-3-cm-p83394693.html?spid=83394694,vật phẩm phong thủy,Trang trí nhà cửa,2,Thủy Hòa,Thủy Hòa Official Store,Cây phong thủy,"Hợp mệnh Thổ - KimChất liệu: Đá thạch anh vàngKích thước: Đường kính 10,3 cmKhối lượng: 1,65 kgBộ sản phẩm gồm: 1 quả cầu và 1 đế gỗQuả cầu phong thủy được làm từ những loại đá và khoáng vật quý với ..."
84651652,Bộ combo Cua phong thủy và xu tiền cầu tài lộc,340000,5.0,1,Thủy Hòa,,https://tiki.vn/bo-combo-cua-phong-thuy-va-xu-tien-cau-tai-loc-p84651652.html?spid=84651653,vật phẩm phong thủy,Trang trí nhà cửa,2,Thủy Hòa,Thủy Hòa Official Store,Linh vật phong thủy,"Chất liệu: Cua bằng bột đá đúcKích thước: Dài 23 cm x Rộng 17 cm x Cao 10 cmKhối lượng: 900gBộ sản phẩm bao gồm: 1 con cua có đá vụn thạch anh vàng, 1 thỏi vàng và 9 đôi tiền xuSự kết hợp hoàn hảo để..."
189701061,"Hang hốc phong thủy đá thạch anh tím hút tài lộc - Nặng 5,92 kg",7320000,0.0,0,Thủy Hòa,,https://tiki.vn/hang-hoc-phong-thuy-da-thach-anh-tim-hut-tai-loc-nang-5-92-kg-p189701061.html?spid=189701062,vật phẩm phong thủy,Trang trí nhà cửa,2,Thủy Hòa,Thủy Hòa Official Store,Cây phong thủy,"Hợp mệnh Hỏa - ThổChất liệu: Đá thạch anh tímKhối lương: 5,92 kgKích thước: Dài 26 cm x Rộng 12 cm x Cao 26 cmHang đá thạch anh tím hình trái timHốc thạch anh tím - động thạch anh tím là sự kết tinh ..."
278062477,"Tượng Tỳ Hưu Phong thủy 1 con to hút tài lộc màu vàng đỏ trên hủ tiền hoa đế gỗ xoay size cao 25cm đk 17cm hợp Anh Chị mệnh Kim mệnh Thổ để bàn làm việc, phòng khách trang trí ạ",1511000,0.0,0,OEM,,https://tiki.vn/tuong-ty-huu-phong-thuy-1-con-to-hut-tai-loc-mau-vang-do-tren-hu-tien-hoa-de-go-xoay-size-cao-25cm-dk-17cm-hop-anh-chi-menh-kim-menh-tho-de-ban-lam-viec-phong-khach-trang-tri-a-p278062477.html?spid=278062478,vật phẩm phong thủy,Trang trí nhà cửa,2,OEM,Godaptsunny,Vật phẩm phong thủy khác,"Tượng Tỳ Hưu Phong thủy 1 con to hút tài lộc màu vàng đỏ trên hủ tiền hoa đế gỗ xoay size cao 25cm đk 17cm hợp Anh Chị mệnh Kim mệnh Thổ để bàn làm việc, phòng khách trang trí ạMang đến sự may mắn, ..."
278719527,"Tượng Phong Thủy Thố tụ tài tứ quý tài lộc mới màu tứ quý sáng đẹp 10 thỏi xiền vàng đá lưu ly tự nhiên đế gỗ size trung đk 11cm Cao 11cm cả đế  thố cao 7,5cm Mệnh Kim Mộc Thủy Hỏa Thổ đặt bàn làm việc bàn thờ thần tài có ý nghĩa trong việc tăng tài vận ạ",830000,0.0,0,OEM,,https://tiki.vn/tuong-phong-thuy-tho-tu-tai-tu-quy-tai-loc-moi-mau-tu-quy-sang-dep-10-thoi-xien-vang-da-luu-ly-tu-nhien-de-go-size-trung-dk-11cm-cao-11cm-ca-de-tho-cao-7-5cm-menh-kim-moc-thuy-hoa-tho-dat-ban-lam-viec-ban-tho-than-tai-co-y-nghia-trong-viec-tang-tai-van-a-p278719527.html?spid=278719528,vật phẩm phong thủy,Trang trí nhà cửa,2,OEM,Godaptsunny,Vật phẩm phong thủy khác," Tượng Phong Thủy Thố tụ tài tứ quý tài lộc mới màu tứ quý sáng đẹp 10 thỏi xiền vàng đá lưu ly tự nhiên đế gỗ size trung xinh đẹp đk 11cm x Cao 11cm cả đế x thố cao 7,5cm Mệnh Kim - Mộc - Thủy - Hỏa ..."
278718264,"Tượng Phong Thủy Thố tụ tài mới miệng kiểu màu vàng anh tài lộc 10 thỏi xiền vàng đá lưu ly tự nhiên đế gỗ size trung đk 11cm x Cao 11cm cả đế x thố cao 7,5cm Hợp ANh Chị Mệnh Kim Thổ Thuỷ đặt bàn làm việc bàn thờ thần tài ạ",830000,0.0,0,OEM,,https://tiki.vn/tuong-phong-thuy-tho-tu-tai-moi-mieng-kieu-mau-vang-anh-tai-loc-10-thoi-xien-vang-da-luu-ly-tu-nhien-de-go-size-trung-dk-11cm-x-cao-11cm-ca-de-x-tho-cao-7-5cm-hop-anh-chi-menh-kim-tho-thuy-dat-ban-lam-viec-ban-tho-than-tai-a-p278718264.html?spid=278718265,vật phẩm phong thủy,Trang trí nhà cửa,3,OEM,Godaptsunny,Vật phẩm phong thủy khác,"Tượng Phong Thủy Thố tụ tài mới miệng kiểu màu vàng anh tài lộc 10 thỏi xiền vàng đá lưu ly tự nhiên đế gỗ size trung đk 11cm x Cao 11cm cả đế x thố cao 7,5cm Hợp ANh Chị Mệnh Kim Thổ Thuỷ đặt bàn làm..."
164078152,"Tượng thuận buồm xuôi gió phong thủy đá ngọc hoàng long trang trí bàn làm việc, phòng khách",7820000,0.0,0,Thủy Hòa,,https://tiki.vn/tuong-thuan-buom-xuoi-gio-phong-thuy-da-ngoc-hoang-long-trang-tri-ban-lam-viec-phong-khach-p164078152.html?spid=164078153,vật phẩm phong thủy,Trang trí nhà cửa,3,Thủy Hòa,Thủy Hòa Official Store,Vật phẩm phong thủy khác,"Kích thước: Dài 37,5 cm x Rộng 9,5 cm x Cao 31 cmKhối lượng: 4,9 kgChất liệu: Đá ngọc hoàng long* Ý nghĩa:- Trong kinh doanh, chúc cho nhau luôn gặp nhiều may mắn, suôn sẻ trong mọi vấn đề. Tránh xa ..."
278719462,Tượng Phong Thủy Thố tụ tài mới màu vàng tài lộc 10 thỏi xiền vàng đá lưu ly tự nhiên đế gỗ size nhỏ vừa xinh đẹp đk 10cm x Cao 9cm cả đế x thố cao 5cm đặt bàn làm việc bàn thờ thần tài ạ,623000,0.0,0,OEM,,https://tiki.vn/tuong-phong-thuy-tho-tu-tai-moi-mau-vang-tai-loc-10-thoi-xien-vang-da-luu-ly-tu-nhien-de-go-size-nho-vua-xinh-dep-dk-10cm-x-cao-9cm-ca-de-x-tho-cao-5cm-dat-ban-lam-viec-ban-tho-than-tai-a-p278719462.html?spid=278719463,vật phẩm phong thủy,Trang trí nhà cửa,3,OEM,Godaptsunny,Vật phẩm phong thủy khác,Tượng Phong Thủy Thố tụ tài mới màu vàng tài lộc 10 thỏi xiền vàng đá lưu ly tự nhiên đế gỗ size nhỏ vừa xinh đẹp đk 10cm x Cao 9cm cả đế x thố cao 5cm đặt bàn làm việc bàn thờ thần tài ạTượng Phong ...
74954418,Thỏi vàng Thần Tài Kim Nguyên Bảo phong thủy chiêu nạp tài lộc đá ngọc hoàng long,240000,5.0,3,Thủy Hòa,,https://tiki.vn/thoi-vang-than-tai-kim-nguyen-bao-phong-thuy-chieu-nap-tai-loc-da-ngoc-hoang-long-p74954418.html?spid=74954420,vật phẩm phong thủy,Trang trí nhà cửa,3,Thủy Hòa,Thủy Hòa Official Store,Vật phẩm phong thủy khác,"Chất liệu: Đá ngọc hoàng longKích thước: Dài 16cm, 13cm, 10cm, 8cmKhối lượng: 1,3 kg; 1 kg; 540g; 300g;Tặng kèm đế gỗThỏi vàng Thần Tài phong thủy là vật phẩm phong thủy cực kỳ may mắn về tài lộc cho..."
82529826,"Quả cầu phong thủy đá thạch anh vàng - Đường kính 14,2 cm; 14,5 cm và 15 cm",1750000,0.0,0,Thủy Hòa,,https://tiki.vn/qua-cau-phong-thuy-da-thach-anh-vang-duong-kinh-14-2-cm-14-5-cm-va-15-cm-p82529826.html?spid=96287897,vật phẩm phong thủy,Trang trí nhà cửa,3,Thủy Hòa,QUÀ LƯU NIỆM,Đá phong thủy,"Hợp mệnh Thổ - KimChất liệu: Đá thạch anh vàngKhối lượng: 4,1 kg; 4,5 kg và 4,9 kgKích thước: Đường kính 14,2 cm; 14,5 cm và 15 cmTặng kèm đế gỗ xoayQuả cầu phong thủy được làm từ những loại đá và kh..."
82404426,"Quả cầu phong thủy đá thạch anh vàng - Đường kính 16,5 cm",2820000,0.0,0,OEM,,https://tiki.vn/qua-cau-phong-thuy-da-thach-anh-vang-duong-kinh-16-5-cm-p82404426.html?spid=82404427,vật phẩm phong thủy,Trang trí nhà cửa,3,OEM,QUÀ LƯU NIỆM,Cây phong thủy,"Hợp mệnh Thổ - KimKích thước: Đường kính 16,5 cmKhối lượng: 6,4 kgBộ sản phẩm gồm: Quả cầu và đế gỗ xoayQuả cầu phong thủy được làm từ những loại đá và khoáng vật quý với hình dạng tròn là biểu tượng..."
134523115,Túi Vàng Tài Lộc Bằng Pha Lê Phong Thủy PaKaSa - Chính Hãng ,146370,4.8,6,PaKaSa,,https://tiki.vn/tui-vang-tai-loc-bang-pha-le-phong-thuy-pakasa-chinh-hang-p134523115.html?spid=134523118,vật phẩm phong thủy,Trang trí nhà cửa,3,PaKaSa,Phụ Kiện Store 76,Vật phẩm phong thủy khác,"Túi vàng pha lê phong thủy được thiết kế tinh xảo, sang trọng từ đá Thạch Anh Tự Nhiên đem lại may mắn và cát khí mạnh mẽ cho ngôi nhà, văn phòng hoặc cửa hàng kinh doanh.Là biểu tượng của sự sung t..."
214817678,Thác Nước Phong Thuỷ Sơn Thủy Mạch - Phong Thủy,899000,0.0,0,NoBrand,,https://tiki.vn/thac-nuoc-phong-thuy-son-thuy-mach-phong-thuy-p214817678.html?spid=214817683,vật phẩm phong thủy,Trang trí nhà cửa,3,NoBrand,Arthouse Shop,Vật phẩm phong thủy khác,"Thác nước Phong Thuỷ Sơn Thủy Mạch- Kích thước : 18cmx13cm- Chất liệu : Gốm - Sản phẩm gồm: Thác nước + máy bơm+ ngọc châu (không bao gồm các phụ kiện khác và cây cảnh)- “Sơn quản đinh nhân, thủy quả..."
74550409,"Quả cầu phong thủy đá mắt mèo xanh dương - Đường kính 3,5cm; 4,5cm; 5,5cm",90000,4.5,2,Thủy Hòa,,https://tiki.vn/qua-cau-phong-thuy-da-mat-meo-xanh-duong-duong-kinh-3-5cm-4-5cm-5-5cm-p74550409.html?spid=74550411,vật phẩm phong thủy,Trang trí nhà cửa,3,Thủy Hòa,Thủy Hòa Official Store,Cây phong thủy,"Hợp mệnh Thủy - KimChất liệu: Đá mắt mèoKhối lượng: 70g, 160g, 280gKích thước: Đường kính 3,5cm; 4,5cm; 5,5cmTặng kèm đế gỗQuả cầu phong thủy được làm từ những loại đá và khoáng vật quý với hình dạng..."
195973322,"Hang, hốc phong thủy đá thạch anh tím hút tài lộc - Nặng 22,5 kg",28920000,0.0,0,Thủy Hòa,,https://tiki.vn/hang-hoc-phong-thuy-da-thach-anh-tim-hut-tai-loc-nang-22-5-kg-p195973322.html?spid=195973323,vật phẩm phong thủy,Trang trí nhà cửa,3,Thủy Hòa,Thủy Hòa Official Store,Cây phong thủy,"Hợp mệnh Hỏa - ThổChất liệu: Đá thạch anh tímKhối lương: 22,5 kgKích thước: Dài 30 cm x Rộng 26,5 cm x Cao 52 cmHốc thạch anh tím - động thạch anh tím là sự kết tinh của các tinh thể thạch anh tím nh..."
275378927,Bát Tụ Bảo Chiêu Tài Phong Thủy Kai Thuỷ Tinh- Hàng Chính Hãng,90000,0.0,0,Kai Nguyễn,,https://tiki.vn/bat-tu-bao-chieu-tai-phong-thuy-kai-hang-chinh-hang-p275378927.html?spid=275378931,vật phẩm phong thủy,Trang trí nhà cửa,4,Kai Nguyễn,Art H Store,Vật phẩm phong thủy khác,"BÁT TỤ BẢO LƯU LY- Chất liệu: thủy tinh CitricBát tụ bảo hay còn gọi là tụ bảo bồn có tác dụng chiêu tài rất lớn.Bát tụ bảo tượng trưng cho sức mạnh, sự thông minh của con người. Do đó, đặt bát tụ b..."
82948321,"Quả cầu phong thủy đá thạch anh trắng - Đường kính 21,5 cm",6150000,5.0,1,OEM,,https://tiki.vn/qua-cau-phong-thuy-da-thach-anh-trang-duong-kinh-21-5-cm-p82948321.html?spid=96285526,vật phẩm phong thủy,Trang trí nhà cửa,4,OEM,QUÀ LƯU NIỆM,Cây phong thủy,"Hợp mệnh Thủy - KimChất liệu: Đá thạch anh trắngKích thước: Đường kính 21,5 cmKhối lượng: 14,7 kgBộ sản phẩm gồm: 1 quả cầu và 1 đế gỗQuả cầu phong thủy được làm từ những loại đá và khoáng vật quý vớ..."
99929825,THÁC NƯỚC PHONG THỦY MINI,825000,5.0,1,Bát Tràng,,https://tiki.vn/thac-nuoc-phong-thuy-mini-p99929825.html?spid=175647545,vật phẩm phong thủy,Trang trí nhà cửa,4,Bát Tràng,Cửa hàng gốm sứ Bát Tràng,Root,"       Dòng thác nước phong thủy luân là sự kết hợp hài hòa và ý nghĩa, bởi nguồn nước chảy liên tục, luân chuyển không ngừng nghỉ sẽ tạo ra một dòng sức mạnh được tụ hội từ vũ trụ, tạo ra nguồn n..."
91275214,"THÁC NƯỚC PHONG THỦY MINI_H23,24,25CM",880000,0.0,0,Bát Tràng,,https://tiki.vn/product-p91275214.html?spid=97887810,vật phẩm phong thủy,Trang trí nhà cửa,4,Bát Tràng,Bát Tràng Ceramic,Root,"       Dòng thác nước phong thủy luân là sự kết hợp hài hòa và ý nghĩa, bởi nguồn nước chảy liên tục, luân chuyển không ngừng nghỉ sẽ tạo ra một dòng sức mạnh được tụ hội từ vũ trụ, tạo ra nguồn n..."
74599327,Cặp cá Chép hóa Rồng phong thủy đá cẩm thạch trắng xanh - Cao 15cm,590000,4.0,1,Thủy Hòa,,https://tiki.vn/cap-ca-chep-hoa-rong-phong-thuy-da-cam-thach-trang-xanh-cao-15cm-p74599327.html?spid=74599328,vật phẩm phong thủy,Trang trí nhà cửa,4,Thủy Hòa,Thủy Hòa Official Store,Linh vật phong thủy,"Chất liệu: Đá cẩm thạch trắng xanhKích thước: Dài 9 cm x Rộng 5 cm x Cao 15 cmKhối lượng: 1,93 kgTheo quan niệm phương Đông, cá chép tượng trưng cho sức khỏe và tài lộc. Trong đường quan lộ, cá chép ..."
201893250,"Tỳ Hưu Phong Thủy, Cặp Tỳ Hưu Đá Ngọc Pakistan 10cm",850000,0.0,0,OEM,,https://tiki.vn/ty-huu-phong-thuy-cap-ty-huu-da-ngoc-pakistan-10cm-p201893250.html?spid=278095595,vật phẩm phong thủy,Trang trí nhà cửa,4,OEM,QUÀ LƯU NIỆM,Root,"       *Tỳ Hưu Phong Thủy 15cm   Chất Liệu : Đá Ngọc Pakistan tự nhiên   Kích Cỡ : Dài 10cm   Chế tác thủ công tại Làng Đá Mỹ Nghệ Non Nước   Trong Phong thủy,Tỳ Hưu là một loại mãnh thú hung ..."
23188506,Quả Cầu phong thủy Thạch Anh Trắng đá tự nhiên,500000,4.7,3,OEM,,https://tiki.vn/qua-cau-phong-thuy-thach-anh-trang-da-tu-nhien-p23188506.html?spid=72750182,vật phẩm phong thủy,Trang trí nhà cửa,4,OEM,QUÀ LƯU NIỆM,Đá phong thủy,"Ý Nghĩa đá thạch Anh Trắng:- Thạch anh trắng được mệnh danh là loại đá của trí tuệ, thường đặt tại bàn làm việc công ty hoặc tại gia đình mang đến những quyết định sáng suốt, khôn ngoan và lý trí h..."
91276065,"THÁC NƯỚC PHONG THỦY_H68,80",1850000,0.0,0,Bát Tràng,,https://tiki.vn/product-p91276065.html?spid=93271452,vật phẩm phong thủy,Trang trí nhà cửa,4,Bát Tràng,Cửa hàng gốm sứ Bát Tràng,Vật phẩm phong thủy khác,"       Dòng thác nước phong thủy luân là sự kết hợp hài hòa và ý nghĩa, bởi nguồn nước chảy liên tục, luân chuyển không ngừng nghỉ sẽ tạo ra một dòng sức mạnh được tụ hội từ vũ trụ, tạo ra nguồn n..."
6187401,La Bàn Vàng Kim Phong Thủy,76000,0.0,0,OEM,,https://tiki.vn/la-ban-vang-kim-phong-thuy-p6187401.html?spid=278496373,vật phẩm phong thủy,Trang trí nhà cửa,4,OEM,Luckky Shop,Vật phẩm phong thủy khác,"La Bàn Vàng Kim Phong ThủyLa bàn dùng để định hướng trên mặt đất (đi trong rừng), trên mặt nước (đi biển), trên không gian (trên máy bay). La bàn có từ hơn 1000 năm trước công nguyên do người khám ph..."
130448079,Túi vàng thủy tinh phong thủy [ may mắn thu hút tài lộc ],175000,0.0,0,OEM,,https://tiki.vn/tui-vang-thuy-tinh-phong-thuy-may-man-thu-hut-tai-loc-p130448079.html?spid=277915138,vật phẩm phong thủy,Trang trí nhà cửa,4,OEM,QUÀ LƯU NIỆM,Vật phẩm phong thủy khác,"MÔ TẢ SẢN PHẨMTHÔNG TIN CHI TIẾT SẢN PHẨM:Kích thước cao 10cm, rộng 8cmChất liệu túi đựng: thủy tinhChất liệu bên trong:dầu ngãi lâu năm và vàng lá được pha trộn với nhau.Xuất xứ: Trung Quốc.Sản phẩm ..."
120169704,Chóp sừng bò Châu Phi - vật phẩm phong thủy (OTH004) HOT nhất của năm trâu vàng 2021 - giàu sang/phú quý,120000,0.0,0,HAHANCO,,https://tiki.vn/chop-sung-bo-chau-phi-vat-pham-phong-thuy-hot-nhat-cua-nam-trau-vang-2021-giau-sang-phu-quy-oth004-hahanco-p120169704.html?spid=159440453,vật phẩm phong thủy,Trang trí nhà cửa,5,HAHANCO,Đức Tuấn Shop,Vật phẩm phong thủy khác,"Từ thời xa xưa đến nay, năm trâu là năm thịnh vượng nhất trong số 12 con giáp, đối với người Việt Nam còn là biểu tượng Trâu vàng, mang ý nghĩa cần cù, chịu khó, hiền lành và khỏe mạnh, sự giàu sang, ..."
