id,name,price,rating,review_count,brand,seller,url,kw,group,page,brand_detail,seller_detail,categories,short_description
276270743,Phụ Kiện Đi Dây Điện Để Bàn Thông Minh MAHPK4,320000,0.0,0,Minh Anh House,,https://tiki.vn/phu-kien-di-day-dien-de-ban-thong-minh-mahpk4-p276270743.html?spid=276270744,phụ kiện phòng ngủ,Đồ dùng phòng ngủ,10,Minh Anh House,Minh Anh House,Trang trí nhà cửa khác,"Chất liệu: thépKích thước (Dài rộng cao): 70x7x12cmLợi ích của máng đi dây dưới bàn:Giúp không gian làm việc gọn gàng: Máng đi dây giúp gom tất cả các dây cáp lại với nhau dưới bàn, tránh tình trạn..."
276328451,"Màn dây có cửa Funu, vải mềm mịn, mắt lưới nhỏ, định hình ổn định giúp thông thoáng, chống muỗi an toàn, bảo vệ giấc ngủ - Hàng chính hãng",180000,4.5,22,FuNu,,https://tiki.vn/man-cua-chong-muoi-funu-giao-mau-ngau-nhien-p276328451.html?spid=75413462,phụ kiện phòng ngủ,Đồ dùng phòng ngủ,10,FuNu,Moonuji,Nhà Cửa - Đời Sống,...
11238330,Tranh em bé ngủ say | Tranh trang trí phòng ngủ W1945,175000,0.0,0,OEM,,https://tiki.vn/tranh-em-be-ngu-say-tranh-trang-tri-phong-ngu-w1945-p11238330.html?spid=277735603,phụ kiện phòng ngủ,Đồ dùng phòng ngủ,10,OEM,BINBIN SHOP,Nhà Cửa - Đời Sống,"Tranh em bé ngủ say | Tranh trang trí phòng ngủ W1945 là chọn lựa hàng đầu khi trang trí phòng ngủ, phòng sinh hoạt gia đình. Đặc biệt là các cặp vợ chồng mới cưới, treo Tranh trẻ em sẽ mang đến nhiề..."
276965687,"Phụ kiện nhà bếp phòng ăn - Hộp 50 cây tăm chỉ nha khoa ,an toàn dễ sử dụng",79000,0.0,0,LYNUSAN,,https://tiki.vn/phu-kien-nha-bep-phong-an-hop-50-cay-tam-chi-nha-khoa-an-toan-de-su-dung-p276965687.html?spid=276965688,phụ kiện phòng ngủ,Đồ dùng phòng ngủ,10,LYNUSAN,CORAN STORE,Phụ kiện phòng ăn khác,"_Phụ kiện nhà bếp phòng ăn - Hộp 50 cây tăm chỉ nha khoa ,an toàn dễ sử dụng-Xuất xứ : Trung Quốc-Hạn dùng : 3-5 năm -Hộp 50 cây tăm chỉ nha khoa có 2 công dụng : 1 đầu là chỉ nha khoa + 1 đầu là ..."
53830664,Mùng ngủ không cửa giăng dây 4 góc truyền thống - Vải tuyn dày lỗ nhỏ chống muỗi tuyệt đối,125000,4.7,251,A,,https://tiki.vn/mung-ngu-khong-cua-giang-day-4-goc-truyen-thong-vai-tuyn-day-lo-nho-chong-muoi-tuyet-doi-hong-1m8-x-2m-p53830664.html?spid=53830672,phụ kiện phòng ngủ,Đồ dùng phòng ngủ,10,A,Shop Ánh Sao,Phụ kiện phòng ngủ khác,Mùng ngủ không cửa giăng dây 4 góc truyền thống Thương hiệu A - Vải tuyn dày lỗ nhỏ chống muỗi tuyệt đốiTHOẢI MÁI CHÌM VÀO GIẤC NGỦ VỚI MÙNG KHÔNG CỬA CAO CẤPThông tin sản phẩm:- Tên sản phẩm: Mùn...
