id,name,price,rating,review_count,brand,seller,url,kw,group,page,brand_detail,seller_detail,categories,short_description
101361035,Bộ 10 Bát thờ Bát Tràng rồng phượng đường kính 11cm,195000,4.0,1,Bát Tràng,,https://tiki.vn/bo-10-bat-tho-bat-trang-rong-phuong-duong-kinh-11cm-p101361035.html?spid=113116353,kỷ chén thờ,Đồ thờ cúng,1,Bát Tràng,Bát Tràng Ceramic,Vật dụng trang trí,"- Bát thờ Bát Tràng- Bộ sản phẩm gồm 10 cái bát thờ- Bát thờ không chỉ mang ý nghĩa cho sự đầy đủ, trang nghiêm mà còn được sử dụng cúng cơm cho các bậc bề trên vào ngày giỗ, ngày lễ, tết…..."
25491407,Bộ bát đĩa đồ thờ đầy đủ men lam 17 chi tiết,750000,4.3,3,Bát Tràng,,https://tiki.vn/bo-bat-dia-do-tho-day-du-men-lam-17-chi-tiet-p25491407.html?spid=71919201,kỷ chén thờ,Đồ thờ cúng,1,Bát Tràng,Cửa hàng gốm sứ Bát Tràng,Nhà Cửa - Đời Sống,"BỘ BÁT ĐĨA THỜ CÚNG ĐẦY ĐỦ GỒM CÁC CHI TIẾT SAU:6 bát cơm nhỏ  rộng 10 cm, cao 4 cm  kèm 1 bát nước chấm nhỏ hơn chút xíu.6 đĩa tròn có kính thước to nhỏ khác nhau và 1 đĩa bầu dục.2 bát tô nhỏ đự..."
198857395,Bộ ấm chén thờ men rạn gốm Bát Tràng,350000,0.0,0,Gốm Sứ Bát Tràng,,https://tiki.vn/bo-am-chen-tho-men-ran-gom-bat-trang-p198857395.html?spid=198857397,kỷ chén thờ,Đồ thờ cúng,1,Gốm Sứ Bát Tràng,Gốm sứ Gia Hưng Bát tràng,Bộ đồ thờ,Bộ ấm chén thờ là một trong những vật phẩm thờ cúng quan trọng và cần thiết khi muốn thiết lập một bộ đồ thờ gia tiên trong nhà. Bộ ấm trà thờ cúng được sử dụng để pha trà và dâng lên thần linh và gia...
191388466,Set Ban Thờ Men Rạn Đắp Nổi Bát Tràng 127cm,6380000,0.0,0,Gốm Sứ Bát Tràng,,https://tiki.vn/set-ban-tho-men-ran-dap-noi-bat-trang-127cm-p191388466.html?spid=195776417,kỷ chén thờ,Đồ thờ cúng,1,Gốm Sứ Bát Tràng,Cửa hàng gốm sứ Bát Tràng,Bộ đồ thờ,Set Ban Thờ Men Rạn Đắp Nổi được làm thủ công bởi bàn tay nghệ sĩ của những nghệ nhân làng gốm Bát Tràng Kích thước : 127cmBao gồm :+ Bát Hương 18cm kèm đế :1 chiếc+ Bát Hương 16cm kèm đế :2 chiếc+ C...
191389544,Set Ban Thờ Men Rạn Đắp Nổi Bát Tràng 89cm,3950000,0.0,0,Gốm Sứ Bát Tràng,,https://tiki.vn/set-ban-tho-men-ran-dap-noi-bat-trang-89cm-p191389544.html?spid=195776367,kỷ chén thờ,Đồ thờ cúng,1,Gốm Sứ Bát Tràng,Cửa hàng gốm sứ Bát Tràng,Bộ đồ thờ,Set Ban Thờ Men Rạn Đắp Nổi được làm thủ công bởi bàn tay nghệ sĩ của những nghệ nhân làng gốm Bát Tràng Kích thước : 89cmBao gồm :+Bát Hương 16cm kèm đế :1 chiếc+Chóe 16cm : 3 chiếc+Mâm Bổng 25cm : ...
101360654,Bộ ấm chén thờ men rạn đắp nổi Bát Tràng,345000,0.0,0,Bát Tràng,,https://tiki.vn/bo-am-chen-tho-men-ran-dap-noi-bat-trang-p101360654.html?spid=169691104,kỷ chén thờ,Đồ thờ cúng,1,Bát Tràng,Cửa hàng gốm sứ Bát Tràng,Bộ đồ thờ,"       - Sản phẩm bao gồm:   + 1 ấm, 3 chén, 1 đĩa kê lớn (quý khách vui lòng chọn trong bước đặt hàng)   + 1 ấm, 5 chén, 1 đĩa kê lớn (quý khách vui lòng chọn trong bước đặt hàng)   - Chất liệ..."
24531605,Kỷ Ngai 3 Chén Thờ Men Xanh Vẽ Sen,240000,0.0,0,Bát Tràng,,https://tiki.vn/ky-ngai-3-chen-tho-men-xanh-ve-sen-p24531605.html?spid=59531032,kỷ chén thờ,Đồ thờ cúng,1,Bát Tràng,Cửa hàng gốm sứ Bát Tràng,Kỷ chén thờ,"Kỷ chén thờ là gì?  Vị trí đặt lỷ chén thờ?Kỷ chén thờ là gì? Ý nghĩa của kỷ 3 chén?Muối, gạo, nước là 3 lễ cúng không thể thiếu trên ban thờ. Ngoài nước đựng trong chóe, bình thường khi dâng lễ gia..."
101360638,Bộ 6 Bát thờ Bát Tràng men rạn đắp nổi,350000,0.0,0,Bát Tràng,,https://tiki.vn/bo-6-bat-tho-bat-trang-men-ran-dap-noi-p101360638.html?spid=141496617,kỷ chén thờ,Đồ thờ cúng,1,Bát Tràng,Cửa hàng gốm sứ Bát Tràng,Bộ đồ thờ,"Bát thờ Bát Tràng- Kích thước: Đường kính bát 10cm- Sản phẩm bao gồm: 6 bát thờ- Chất liệu: Gốm men rạn Bát Tràng, họa tiết đắp nổi- Bát thờ Bát Tràng được nung ở nhiệt độ 1200 đến 1300 độ C nên c..."
89224855,Combo 10 Bát thờ cúng vẽ rồng & hoa chanh,300000,0.0,0,Bát Tràng,,https://tiki.vn/product-p89224855.html?spid=106766917,kỷ chén thờ,Đồ thờ cúng,1,Bát Tràng,Bát Tràng Ceramic,Root,"       Combo 10 Bát thờ cúng vẽ rồng , vẽ hoa chanh   Kích thước   ..."
101042910,Combo 10 Bát thờ cúng vẽ rồng & hoa chanh,175000,1.0,1,Bát Tràng,,https://tiki.vn/combo-10-bat-tho-cung-ve-rong-hoa-chanh-p101042910.html?spid=124944255,kỷ chén thờ,Đồ thờ cúng,1,Bát Tràng,Cửa hàng gốm sứ Bát Tràng,Nhà Cửa - Đời Sống,"       Combo 10 Bát thờ cúng vẽ rồng , vẽ hoa chanh   Kích thước   ..."
85044818,Combo bộ đồ thờ ban thần tài gốm sứ Bát Tràng,899000,0.0,0,Bát Tràng,,https://tiki.vn/combo-bo-do-tho-ban-than-tai-gom-su-bat-trang-p85044818.html?spid=97506780,kỷ chén thờ,Đồ thờ cúng,2,Bát Tràng,Dũng Hà 2268,Root,       Combo bộ đồ thờ ban thần tài loại 1   Gốm sứ Bát Tràng cao cấp   Sản phẩm bao gồm:   1-Bát hương   2-Mâm bồng fi 25   3-Ống hương fi20   4-Lọ cắm hoa fi20   5-Choé 3 hũ (đựng Gạo- Mu...
25733308,Bộ bát đĩa bàn thờ 17 chi tiết ( Vàng Kim),999000,0.0,0,Bát Tràng,,https://tiki.vn/bo-bat-dia-ban-tho-17-chi-tiet-vang-kim-p25733308.html?spid=25733309,kỷ chén thờ,Đồ thờ cúng,2,Bát Tràng,Dũng Hà 2268,Nhà Cửa - Đời Sống,"BỘ BÁT ĐĨA THỜ CÚNG ĐẦY ĐỦ GỒM CÁC CHI TIẾT SAU:6 bát cơm nhỏ  rộng 10 cm, cao 4 cm  kèm 1 bát nước chấm nhỏ hơn chút xíu. men mầu VàngHọa tiết của bộ này có viền kim loại ở himhf tượng Rồng Phượn..."
41882657,02 đèn thờ sứ Bát Tràng,280000,0.0,0,Bát Tràng,,https://tiki.vn/02-den-tho-su-bat-trang-p41882657.html?spid=63932036,kỷ chén thờ,Đồ thờ cúng,2,Bát Tràng,Cửa hàng gốm sứ Bát Tràng,Vật dụng trang trí,"ản phẩm gồm 02 chiếc Đèn thờ dầu men lam vẽ phong cảnh chính hãng Bát TràngChất liệu: gốm sứ cao cấp Bát TràngHọa tiết: Vẽ thủ công bằng tay, nghệ thuật tinh xảoThiết kế: tinh tế, cổ truyềnLoại me..."
174002897,Bộ Bát Đĩa Thờ Cúng Men Lam Cổ Vẽ Sen Hoặc Rồng Song Long Chầu Nguyệt,999000,0.0,0,Bát Tràng,,https://tiki.vn/bo-bat-dia-tho-cung-men-lam-co-ve-sen-hoac-rong-song-long-chau-nguyet-p174002897.html?spid=174002901,kỷ chén thờ,Đồ thờ cúng,2,Bát Tràng,Dũng Hà 2268,Bộ đồ thờ,"Bộ sản phẩm 15 món, bao gồm:- 6 đĩa hình cánh hoa- 1 bát tô đường kính 18-20cm- 6 bát cơm nhỏ xinh phù hợp dâng bầy cơm cúng- 2 bát chấmBộ size: 55cm..."
263190543,"Án thờ, tủ thờ",2500000,0.0,0,OEM,,https://tiki.vn/an-tho-tu-tho-p263190543.html?spid=278542797,kỷ chén thờ,Đồ thờ cúng,2,OEM,MỘC CHÂM,Root,"       -Giao hàng tận nơi, thanh toán khi đã kiểm tra và nhận hàng.   -Giao hàng tận nơi, thanh toán khi đã kiểm tra và nhận hàng đối với khách từ Thanh Hóa đổ ra bắc. Khách ở miền trung, miền na..."
261851725,ań thờ .,7900000,0.0,0,OEM,,https://tiki.vn/an-tho-p261851725.html?spid=278561352,kỷ chén thờ,Đồ thờ cúng,2,OEM,MỘC CHÂM,Root,          .   ...
242678371,ań thờ .,7900000,0.0,0,OEM,,https://tiki.vn/an-tho-p242678371.html?spid=278558341,kỷ chén thờ,Đồ thờ cúng,2,OEM,MỘC CHÂM,Root,          .   ...
263192617,Án thờ gỗ,5300000,0.0,0,OEM,,https://tiki.vn/a-n-tho-go-p263192617.html?spid=278542589,kỷ chén thờ,Đồ thờ cúng,2,OEM,MỘC CHÂM,Root,     ...
101361039,Đĩa thờ trầu cau men rạn đắp nổi Bát Tràng (không bao gồm chân gỗ kê),250000,0.0,0,Bát Tràng,,https://tiki.vn/dia-tho-trau-cau-men-ran-dap-noi-bat-trang-khong-bao-gom-chan-go-ke-p101361039.html?spid=113108786,kỷ chén thờ,Đồ thờ cúng,2,Bát Tràng,Cửa hàng gốm sứ Bát Tràng,Bộ đồ thờ,Đĩa trầu cau men rạn đắp nổi Bát Tràng- Sản phẩm gồm 1 cái đĩa trầu cau men rạn đắp nổi Bát Tràng (không bao gồm chân gỗ kê)- Kích thước: Đường kính đĩa 16cm- Chất liệu: Gốm men rạn đắp nổi Bát Tràng...
53833932,Phố nhà thờ,108000,0.0,0,,,https://tiki.vn/pho-nha-tho-p53833932.html?spid=252652945,kỷ chén thờ,Đồ thờ cúng,2,,info book,Truyện ngắn - Tản văn - Tạp Văn Nước Ngoài,"Thi thoảng, Nicolas vẫn ghé lại phố Nhà Thờ, để nhấm nháp lại vị ngọt ngào pha lẫn đắng đót của mối tình đã mất.Mang vẻ ngoài đẹp trai lịch lãm, có quốc tịch Pháp và tiêu tiền euro, khi mới ..."
242681654,ań thờ...,8200000,0.0,0,OEM,,https://tiki.vn/an-tho-p242681654.html?spid=278558492,kỷ chén thờ,Đồ thờ cúng,3,OEM,MỘC CHÂM,Root,     ...
261851811,ań thờ...,8200000,0.0,0,OEM,,https://tiki.vn/an-tho-p261851811.html?spid=278557651,kỷ chén thờ,Đồ thờ cúng,3,OEM,MỘC CHÂM,Root,     ...
101360873,Bát điếu men rạn Bát Tràng,520000,0.0,0,Bát Tràng,,https://tiki.vn/bat-dieu-men-ran-bat-trang-p101360873.html?spid=113104434,kỷ chén thờ,Đồ thờ cúng,3,Bát Tràng,Cửa hàng gốm sứ Bát Tràng,Đồ decor nhà cửa,"- Sản phẩm thích hợp để sử dụng hoặc trưng bày- Đường kinh bát: 20cm- Sản phẩm bao gồm: Bát điếu, quả điếu, se điếu------------------------------------------------------------------------Gốm sứ Bá..."
124695748,"Bộ ban thờ thần tài, men rạn cổ, họa tiết đắp nổi thủ công. Gốm sứ Bát Tràng cao cấp.",2450000,4.5,2,Bát Tràng,,https://tiki.vn/bo-ban-tho-than-tai-men-ran-co-hoa-tiet-dap-noi-thu-cong-gom-su-bat-trang-cao-cap-p124695748.html?spid=147763419,kỷ chén thờ,Đồ thờ cúng,3,Bát Tràng,Bát Tràng Ceramic,Root,"       Bộ đồ thờ men rạn cho ban thờ thần tài 56:   Thông tin sản phẩm:   - Loại sản phẩm Bộ đồ thờ   - Chất liệu gốm sứ men rạn   - Số món 11, bao gồm:   1 đèn dầu thờ s2, 1 lọ lộc bình cao ..."
242681434,ań thờ..,5300000,0.0,0,OEM,,https://tiki.vn/an-tho-p242681434.html?spid=278558483,kỷ chén thờ,Đồ thờ cúng,3,OEM,MỘC CHÂM,Root,     ...
261852555,ań thờ..,2800000,0.0,0,OEM,,https://tiki.vn/an-tho-p261852555.html?spid=278555734,kỷ chén thờ,Đồ thờ cúng,3,OEM,MỘC CHÂM,Root,     ...
242673252,ań thờ..,6700000,0.0,0,OEM,,https://tiki.vn/an-tho-p242673252.html?spid=278558647,kỷ chén thờ,Đồ thờ cúng,3,OEM,MỘC CHÂM,Root,     ...
242679677,ań thờ..,2800000,0.0,0,OEM,,https://tiki.vn/an-tho-p242679677.html?spid=278558237,kỷ chén thờ,Đồ thờ cúng,3,OEM,MỘC CHÂM,Root,     ...
261851817,ań thờ..,6700000,0.0,0,OEM,,https://tiki.vn/an-tho-p261851817.html?spid=278557591,kỷ chén thờ,Đồ thờ cúng,3,OEM,MỘC CHÂM,Root,     ...
263187460,tủ thờ....,3900000,0.0,0,OEM,,https://tiki.vn/tu-tho-p263187460.html?spid=278542326,kỷ chén thờ,Đồ thờ cúng,3,OEM,MỘC CHÂM,Root,     ...
261854206,ań thờ..,5300000,0.0,0,OEM,,https://tiki.vn/an-tho-p261854206.html?spid=278559987,kỷ chén thờ,Đồ thờ cúng,4,OEM,MỘC CHÂM,Root,     ...
263173688,Bàn thờ và cúng cơm,9200000,0.0,0,OEM,,https://tiki.vn/ban-tho-va-cung-com-p263173688.html?spid=278542421,kỷ chén thờ,Đồ thờ cúng,4,OEM,MỘC CHÂM,Root,     ...
263168238,bàn thờ và cúng cơm,9200000,0.0,0,OEM,,https://tiki.vn/ban-tho-va-cung-com-p263168238.html?spid=278542765,kỷ chén thờ,Đồ thờ cúng,4,OEM,MỘC CHÂM,Root,     ...
263250947,Án thờ gỗ gụ,10000000,0.0,0,OEM,,https://tiki.vn/an-tho-go-gu-p263250947.html?spid=278543216,kỷ chén thờ,Đồ thờ cúng,4,OEM,MỘC CHÂM,Root,       **** NỘI THẤT BÌNH LONG rất hân hạnh được phục vụ quý khách!***   Án thờ gỗ gụ tự nhiên 100%   ...
263168601,Án thờ và cúng cơm,9300000,0.0,0,OEM,,https://tiki.vn/an-tho-va-cung-com-p263168601.html?spid=278541021,kỷ chén thờ,Đồ thờ cúng,4,OEM,MỘC CHÂM,Root,     ...
263250673,Bộ sập thờ kèm bàn cúng cơm!,28000000,0.0,0,OEM,,https://tiki.vn/bo-sap-tho-kem-ban-cung-com-p263250673.html?spid=278542973,kỷ chén thờ,Đồ thờ cúng,4,OEM,MỘC CHÂM,Root,       Chất liệu gỗ Hương đỏ.   Sập thờ kích thước 2m17x1m07 x1m27 đế nghê.   Bàn cúng Cơm kích thước 1m07 x 61cm x61 cm.   ...
263263070,Phòng Thờ Cúng,32000000,0.0,0,OEM,,https://tiki.vn/phong-tho-cung-p263263070.html?spid=278543006,kỷ chén thờ,Đồ thờ cúng,4,OEM,MỘC CHÂM,Root,"       **** NỘI THẤT BÌNH LONG rất hân hạnh được phục vụ quý khách!***   Cơ sở sản xuất bàn thờ uy tín chất lượng.   Chuyên sản xuất các loại bàn thờ gia tiên, đồ thờ cúng, tượng phật.   :Khách..."
263247961,Phòng Thờ Cúng,32000000,0.0,0,OEM,,https://tiki.vn/phong-tho-cung-p263247961.html?spid=278542639,kỷ chén thờ,Đồ thờ cúng,4,OEM,MỘC CHÂM,Root,"       **** NỘI THẤT BÌNH LONG rất hân hạnh được phục vụ quý khách!***   Cơ sở sản xuất bàn thờ uy tín chất lượng.   Chuyên sản xuất các loại bàn thờ gia tiên, đồ thờ cúng, tượng phật.   :Khách..."
263190820,Án thờ gỗ nhãn,3200000,0.0,0,OEM,,https://tiki.vn/an-tho-go-nhan-p263190820.html?spid=278542467,kỷ chén thờ,Đồ thờ cúng,4,OEM,MỘC CHÂM,Root,     ...
263171141,Án thờ và cúng cơm gỗ gụ,13552000,0.0,0,OEM,,https://tiki.vn/an-tho-va-cung-com-go-gu-p263171141.html?spid=278541034,kỷ chén thờ,Đồ thờ cúng,4,OEM,MỘC CHÂM,Root,     ...
89421217,Bộ đồ thờ men rạn cổ gốm sứ Bát Tràng,850000,5.0,2,Bát Tràng,,https://tiki.vn/bo-do-tho-men-ran-co-gom-su-bat-trang-p89421217.html?spid=89421224,kỷ chén thờ,Đồ thờ cúng,5,Bát Tràng,Gốm sứ Gia Hưng Bát tràng,Root,       Bộ sản phẩm bao gồm:   Tên sản phẩm Số lượng   Bát hương phi 14 1   Đế bát hương (bằng gỗ hương) 1   Lọ cắm hoa thọ đào cao 26cm 1   Ống đựng hương cao 18cm 1   Chóe thờ cao 15cm 1  ...
14516585,"Đèn thờ dầu men rạn Bát Úp cổ gốm sứ Bát Tràng (đèn dầu, đèn thờ cúng)",420000,5.0,1,Bát Tràng,,https://tiki.vn/den-tho-dau-men-ran-bat-up-co-gom-su-bat-trang-den-dau-den-tho-cung-p14516585.html?spid=54582633,kỷ chén thờ,Đồ thờ cúng,5,Bát Tràng,Bát Tràng Ceramic,Vật dụng trang trí,"Chất liệu: gốm sứ cao cấp Bát TràngHọa tiết: Vẽ thủ công bằng tay, nghệ thuật tinh xảoThiết kế: tinh tế, cổ truyềnLoại men: Men rạn cổĐèn thờ cúng là sản phẩm quan trọng và không thể thiếu trên bấ..."
14431924,Bộ đồ thờ Bát Tràng men rong cổ SX03,2650000,0.0,0,Bát Tràng Việt Nam,,https://tiki.vn/bo-do-tho-bat-trang-men-rong-co-sx03-p14431924.html?spid=53738272,kỷ chén thờ,Đồ thờ cúng,5,Bát Tràng Việt Nam,Bát Tràng Ceramic,Nhà Cửa - Đời Sống,"Bộ đồ thờ XS03 men rong cổ là sản phẩm sứ Bát Tràng được sản xuất bằng loại đất sét cao cấp tạo lên xương gốm cứng chắc, bên ngoài được phủ một lớp men bóng đặc trưng của Bát Tràng, Sản phẩm được nun..."
101360649,Nậm thờ Bát Tràng men rạn đắp nổi,280000,0.0,0,Bát Tràng,,https://tiki.vn/nam-tho-bat-trang-men-ran-dap-noi-p101360649.html?spid=169691490,kỷ chén thờ,Đồ thờ cúng,5,Bát Tràng,Cửa hàng gốm sứ Bát Tràng,Bộ đồ thờ,"       Nậm thờ Bát Tràng   - Sản phẩm bao gồm: 1 cái nậm thờ   - Kích thước:   + Cao 23cm, đường kính bầu to 11cm   - Nậm thờ Bát Tràng được nung ở nhiệt độ 1200 đến 1300 độ C nên có độ bền rấ..."
56367404,Bộ đồ thờ đầy đủ gốm sứ Bát Tràng,700000,0.0,0,Bát Tràng,,https://tiki.vn/bo-do-tho-day-du-gom-su-bat-trang-p56367404.html?spid=62329417,kỷ chén thờ,Đồ thờ cúng,5,Bát Tràng,Bát Tràng Ceramic,Nhà Cửa - Đời Sống,"Bộ đồ thờ sứ cho ban thờ gia tiên tiêu chuẩnChất liệu : sứHọa tiết : RồngSản xuất tại : Bát Tràng, Hà Nội, Việt Nam..."
49175655,Bộ 02 đèn thờ gốm sứ Bát Tràng,295000,0.0,0,Bát Tràng,,https://tiki.vn/bo-02-den-tho-gom-su-bat-trang-p49175655.html?spid=63931726,kỷ chén thờ,Đồ thờ cúng,5,Bát Tràng,Cửa hàng gốm sứ Bát Tràng,Vật dụng trang trí,"ản phẩm gồm 02 chiếc Đèn thờ dầu men lam vẽ phong cảnh chính hãng Bát TràngChất liệu: gốm sứ cao cấp Bát TràngHọa tiết: Vẽ thủ công bằng tay, nghệ thuật tinh xảoThiết kế: tinh tế, cổ truyềnLoại me..."
168090100,"Bát hương thờ gia tiên men rạn giả cổ, họa tiết đắp nổi thủ công. Gốm sứ Bát Tràng cao cấp",420000,0.0,0,Bát Tràng,,https://tiki.vn/bat-huong-tho-gia-tien-men-ran-gia-co-hoa-tiet-dap-noi-thu-cong-gom-su-bat-trang-cao-cap-p168090100.html?spid=169691059,kỷ chén thờ,Đồ thờ cúng,5,Bát Tràng,Bát Tràng Ceramic,Root,"       Bát hương(nhang) thờ gia tiên men rạn cổ luôn là sự lựa chọn cho ban thờ gia tiên trong mỗi gia đình. Thể hiện nét văn hoá uống nước nhớ nguồn, lòng thành kính với Tổ tiên của người Việt Na..."
263193183,Bàn thờ và cúng cơm giá thật,8500000,0.0,0,OEM,,https://tiki.vn/ban-tho-va-cung-com-gia-that-p263193183.html?spid=278542384,kỷ chén thờ,Đồ thờ cúng,5,OEM,MỘC CHÂM,Root,"       -Giao hàng tận nơi, thanh toán khi đã kiểm tra và nhận hàng   -Miễn phí vận chuyển   -Bảo hành 5 năm.   ----------------------//   ..."
138924213,"Bát hương thờ gia tiên men rạn giả cổ, họa tiết đắp nổi thủ công. Gốm sứ Bát Tràng cao cấp",450000,0.0,0,Bát Tràng,,https://tiki.vn/bat-huong-tho-gia-tien-men-ran-gia-co-hoa-tiet-dap-noi-thu-cong-gom-su-bat-trang-cao-cap-p138924213.html?spid=160908781,kỷ chén thờ,Đồ thờ cúng,5,Bát Tràng,Cửa hàng gốm sứ Bát Tràng,Root,"       Bát hương(nhang) thờ gia tiên men rạn cổ luôn là sự lựa chọn cho ban thờ gia tiên trong mỗi gia đình. Thể hiện nét văn hoá uống nước nhớ nguồn, lòng thành kính với Tổ tiên của người Việt Na..."
91276092,Bộ đồ thờ men rạn đắp nổi hoa sen - ban thờ 1.27m,6250000,0.0,0,Bát Tràng,,https://tiki.vn/product-p91276092.html?spid=93249425,kỷ chén thờ,Đồ thờ cúng,5,Bát Tràng,Gốm sứ Gia Hưng Bát tràng,Root,"       Thông tin sản phẩm   Sản phẩm thích hợp cho bàn thờ có kích thước lớn 1,27m   Chất liệu: men rạn   Sản phẩm bao gồm   1 bát hương sen 18cm   1 chân bát hương sen 18cm   2 lọ hoa sen d..."
191389790,Set Ban Thờ Men Rạn Đắp Nổi Size Bé,2800000,0.0,0,Gốm Sứ Bát Tràng,,https://tiki.vn/set-ban-tho-men-ran-dap-noi-size-be-p191389790.html?spid=204423891,kỷ chén thờ,Đồ thờ cúng,6,Gốm Sứ Bát Tràng,Cửa hàng gốm sứ Bát Tràng,Bộ đồ thờ,Set Ban Thờ Men Rạn Đắp Nổi được làm thủ công bởi bàn tay nghệ sĩ của những nghệ nhân làng gốm Bát Tràng Kích thước : Bé Bao gồm :+Bát Hương 16cm kèm đế :1 chiếc+Chóe 19cm : 2 chiếc+Mâm Bổng 25cm : 1...
263190905,bàn thờ và cúng cơm giá thật,8500000,0.0,0,OEM,,https://tiki.vn/ban-tho-va-cung-com-gia-that-p263190905.html?spid=278542531,kỷ chén thờ,Đồ thờ cúng,6,OEM,MỘC CHÂM,Root,"       -Giao hàng tận nơi, thanh toán khi đã kiểm tra và nhận hàng   -Miễn phí vận chuyển   -Bảo hành 5 năm.   ----------------------//   ..."
138924174,"Bộ ban thờ gia tiên men rạn giả cổ, họa tiết đắp nổi thủ công. Gốm sứ Bát Tràng cao cấp.",5350000,0.0,0,Bát Tràng,,https://tiki.vn/bo-ban-tho-gia-tien-men-ran-gia-co-hoa-tiet-dap-noi-thu-cong-gom-su-bat-trang-cao-cap-p138924174.html?spid=147763723,kỷ chén thờ,Đồ thờ cúng,6,Bát Tràng,Gốm sứ Gia Hưng Bát tràng,Root,"       Thông tin sản phẩm:   Bộ đồ thờ cúng Bát Tràng.   Chất liệu Sứ men rạn cao cấp, gồm 19 món:   - 2 lọ hoa   - 3 bát hương, 3 chân bát hương   - 3 chóe cao 16cm   - 2 mâm bồng   - 1 kỷ..."
142003370,"Lư hương, bát hương, bát nhang thờ cúng đặt bàn thờ đá cẩm thạch trắng",290000,0.0,0,Thủy Hòa,,https://tiki.vn/lu-huong-bat-huong-bat-nhang-tho-cung-dat-ban-tho-da-cam-thach-trang-p142003370.html?spid=142003372,kỷ chén thờ,Đồ thờ cúng,6,Thủy Hòa,Thủy Hòa Official Store,"Lư trầm, bát hương, bát nhang","Kích thước: Cao 9cm và đường kính 10cm                   Cao 12cm và đường kính 12cm                     Cao 15cm và đường kính 15cmKhối lượng: 1,57 kg và 3,5 kgChất liệu: Đá cẩm thạch trắng..."
263189550,bàn thờ  và cúng cơm giá thật,7900000,0.0,0,OEM,,https://tiki.vn/ban-tho-va-cung-com-gia-that-p263189550.html?spid=278542309,kỷ chén thờ,Đồ thờ cúng,6,OEM,MỘC CHÂM,Root,"       -Giao hàng tận nơi, thanh toán khi đã kiểm tra và nhận hàng   -Miễn phí vận chuyển   -Bảo hành 5 năm.   ----------------------//   ..."
143592425,Bộ 5 chung nước thờ cúng ông thần tài thổ địa có đế đá chạm chữ tài lộc,990000,0.0,0,Thủy Hòa,,https://tiki.vn/bo-5-chung-nuoc-tho-cung-ong-than-tai-tho-dia-co-de-da-cham-chu-tai-loc-p143592425.html?spid=143592426,kỷ chén thờ,Đồ thờ cúng,6,Thủy Hòa,Thủy Hòa Official Store,Bộ đồ thờ,"Chất liệu: Chung nước là đá ngọc hoàng long, Đế là đá trắngKích thước: Ly nước cao 4cm, đường kính 5,5cm; Đế đá Dài 30cm x Rộng 6cm x Cao 4cmKhối lượng: 2,6 kgBộ sản phẩm gồm: 5 ly nước và 1 đế đá đượ..."
263250644,bộ án thờ gỗ gụ,18600000,0.0,0,OEM,,https://tiki.vn/bo-an-tho-go-gu-p263250644.html?spid=278542480,kỷ chén thờ,Đồ thờ cúng,6,OEM,MỘC CHÂM,Root,"       **** NỘI THẤT BÌNH LONG rất hân hạnh được phục vụ quý khách!***   Xưởng sản xuất đồ gỗ giới thiệu sản phẩm Bàn thờ triện đặc gỗ gụ đủ kích thước   - Hàng có sẵn, được kiểm tra mộc trước k..."
263250544,bộ án thờ gỗ gụ,18600000,0.0,0,OEM,,https://tiki.vn/bo-an-tho-go-gu-p263250544.html?spid=278542592,kỷ chén thờ,Đồ thờ cúng,6,OEM,MỘC CHÂM,Root,"       Xưởng sản xuất đồ gỗ giới thiệu sản phẩm Bàn thờ triện đặc gỗ gụ đủ kích thước   - Hàng có sẵn, được kiểm tra mộc trước khi hoàn thiện, còn nhiều mẫu khác, xin mời khách đến tham quan   G..."
275008227,Bát Hương Bát Nhang Trầm Hương Bằng Sứ Cao Cấp Size Vừa Nhiều Màu Sắc Phong Thủy Trang Trí Bàn Thờ Dâng Hương Thờ Cúng Tôn Giáo,139251,0.0,0,3lành,,https://tiki.vn/bat-huong-bat-nhang-tram-huong-bang-su-cao-cap-size-vua-nhieu-mau-sac-phong-thuy-trang-tri-ban-tho-dang-huong-p275008227.html?spid=275008235,kỷ chén thờ,Đồ thờ cúng,6,3lành,Trầm Hương 3 Lành,Root,Thông tin sản phẩm Bát Hương Bát Nhang Trầm Hương Bằng Sứ Cao Cấp Cao✅Xuất xứ: Việt Nam✅Chất liệu: Sứ Cao Cấp (đường vân rạn cực kì đẹp mắt)✅ Kích thước: Chiều cao 4.8cm x chiều ngang 8.5cmἸ...
91276023,Bộ đồ thờ thần tài thổ địa_men rạn cổ MS001,4600000,0.0,0,Bát Tràng,,https://tiki.vn/product-p91276023.html?spid=93249115,kỷ chén thờ,Đồ thờ cúng,6,Bát Tràng,Bát Tràng Ceramic,Root,       Thông tin sản phẩm:   Bộ thần tài   Bát hương phi 16cm   Mâm bồng phi 23cm   Đèn dầu S3   Bát sâm   Lọ huệ cao 32cm   Chóe   Ống hương   ...
263191086,ań thờ gỗ hương.,8900000,0.0,0,OEM,,https://tiki.vn/an-tho-go-huong-p263191086.html?spid=278542808,kỷ chén thờ,Đồ thờ cúng,7,OEM,MỘC CHÂM,Root,     ...
263184578,Án thờ gỗ tự nhiên .,2400000,0.0,0,OEM,,https://tiki.vn/an-tho-go-tu-nhien-p263184578.html?spid=278542446,kỷ chén thờ,Đồ thờ cúng,7,OEM,MỘC CHÂM,Root,     ...
263253197,Án thờ mít hàng đẹp,14000000,0.0,0,OEM,,https://tiki.vn/an-tho-mit-hang-dep-p263253197.html?spid=278543162,kỷ chén thờ,Đồ thờ cúng,7,OEM,MỘC CHÂM,Root,       **** NỘI THẤT BÌNH LONG rất hân hạnh được phục vụ quý khách!***   ...
